OG_RIV_TEXT,OG_OXFORD_TEXT,RIVERSIDE_FILENAME,OXFORD_FILENAME,OUTPUT_FILENAME,LINE_NUMBER,MATCH,RIVERSIDE_SYLLABLES,OXFORD_SYLLABLES,RIVERSIDE_TEXT,OXFORD_TEXT,RIVERSIDE_SCANSION,OXFORD_SCANSION,RIVERSIDE_TAGGING,OXFORD_TAGGING,FLAG_COLOR
"Of whennes?"""" quod she, whan that she was freyned","“Of whennes?” quod she, whan that she was freined,°",data/riverside_cats/SNT_riv.cat,data/oxford_txts/SNT_oxford.txt,data/csvs/SNT,The Second Nun's Tale 433,,10,10,Of whennes quod she whan that she was freyned,Of whennes quod she whan that she was freined,u Su S x u S u S uS,u Su S x u S u S uS,of@prep whennes@adv quethen@v%pt_3 she@pron%nom whan@adv&conj that@part she@pron%nom ben@v%pt_3 frainen@v%ppl,of@prep whennes@adv quethen@v%pt_3 she@pron%nom whan@adv&conj that@part she@pron%nom ben@v%pt_3 frainen@v%ppl,
Of conscience and of good feith unfeyned.,“Of conscience and of good feith unfeined.”°,data/riverside_cats/SNT_riv.cat,data/oxford_txts/SNT_oxford.txt,data/csvs/SNT,The Second Nun's Tale 434,,10,10,Of conscience and of good feith unfeyned,Of conscience and of good feith unfeined,u SuSx u S u S uSx,u SuSx u S u S uSx,of@prep conscience@n and@conj of@prep god@adj feith@n unfeined@adj,of@prep conscience@n and@conj of@prep god@adj feith@n unfeined@adj,
"Almachius seyde, """"Ne takestow noon heede","Almachius seide, “Takest thow non hede",data/riverside_cats/SNT_riv.cat,data/oxford_txts/SNT_oxford.txt,data/csvs/SNT,The Second Nun's Tale 435,DIFF,10,10,Almachius seyde Ne takestow noon heede,Almachius seide Takest thow non hede,uSuS ux S uxS u Sx,uSuS ux Su S u Sx,almachius@n#propn seien@v1%pt_3 ne@adv taken@v%pr_2_pron non@gram_adj hed@n2,almachius@n#propn seien@v1%pt_3 taken@v%pr_2_pron thou@pron%nom non@gram_adj hed@n2,green
"Of my power?"""" And she answerde hym this:",Of my power?” and she answerde him this—,data/riverside_cats/SNT_riv.cat,data/oxford_txts/SNT_oxford.txt,data/csvs/SNT,The Second Nun's Tale 436,,10,10,Of my power And she answerde hym this,Of my power and she answerde him this,u S uS u S uSx u S,u S uS u S uSx u S,of@prep min@pron%gen pouere@n and@conj she@pron%nom answeren@v%pt_3 him@pron%obj this@pron,of@prep min@pron%gen pouere@n and@conj she@pron%nom answeren@v%pt_3 him@pron%obj this@pron,
"Youre myght,"""" quod she, """"ful litel is to dreede","“Your might,” quod she, “ful litel is to drede;",data/riverside_cats/SNT_riv.cat,data/oxford_txts/SNT_oxford.txt,data/csvs/SNT,The Second Nun's Tale 437,,10,10,Youre myght quod she ful litel is to dreede,Your might quod she ful litel is to drede,ux S u S u Su S u Sx,u S u S u Su S u Sx,your@pron%pl_gen might@n quethen@v%pt_3 she@pron%nom ful@adv litel@adj ben@v%pr_3 to@part dreden@v%inf,your@pron%pl_gen might@n quethen@v%pt_3 she@pron%nom ful@adv litel@adj ben@v%pr_3 to@part dreden@v%inf,
For every mortal mannes power nys,For every mortal mannes power nis,data/riverside_cats/SNT_riv.cat,data/oxford_txts/SNT_oxford.txt,data/csvs/SNT,The Second Nun's Tale 438,,10,10,For every mortal mannes power nys,For every mortal mannes power nis,u SuS uS uS ux S,u SuS uS uS ux S,for@conj everi@pron_gram_adj mortal@adj man@n%gen pouere@n ben@v%pr_3_neg,for@conj everi@pron_gram_adj mortal@adj man@n%gen pouere@n ben@v%pr_3_neg,
"But lyk a bladdre ful of wynd, ywys.","But lik a bladdre,° ful of wind, ywis.°",data/riverside_cats/SNT_riv.cat,data/oxford_txts/SNT_oxford.txt,data/csvs/SNT,The Second Nun's Tale 439,,10,10,But lyk a bladdre ful of wynd ywys,But lik a bladdre ful of wind ywis,u S u Su S u S uS,u S u Su S u S uS,but@conj like@prep a@indef_art bladdre@n ful@adj of@prep wind@n1 iwis@adv,but@conj like@prep a@indef_art bladdre@n ful@adj of@prep wind@n1 iwis@adv,
"For with a nedles poynt, whan it is blowe","For with a nedles point, whan it is blowe,°",data/riverside_cats/SNT_riv.cat,data/oxford_txts/SNT_oxford.txt,data/csvs/SNT,The Second Nun's Tale 440,,10,10,For with a nedles poynt whan it is blowe,For with a nedles point whan it is blowe,u S u Su S u S u Sx,u S u Su S u S u Sx,for@conj with@prep a@indef_art nedle@n%gen pointe@n1 whan@adv&conj hit@pron ben@v%pr_3 blouen@v1%ppl,for@conj with@prep a@indef_art nedle@n%gen pointe@n1 whan@adv&conj hit@pron ben@v%pr_3 blouen@v1%ppl,
May al the boost of it be leyd ful lowe.,May al the boost° of it be leid ful lowe.”,data/riverside_cats/SNT_riv.cat,data/oxford_txts/SNT_oxford.txt,data/csvs/SNT,The Second Nun's Tale 441,,10,10,May al the boost of it be leyd ful lowe,May al the boost of it be leid ful lowe,u S u S u S u S u Sx,u S u S u S u S u Sx,mouen@v3%pr_3 al@gram_adj the@def_art bost@n of@prep hit@pron ben@v%inf leien@v1%ppl ful@adv loue@adv,mouen@v3%pr_3 al@gram_adj the@def_art bost@n of@prep hit@pron ben@v%inf leien@v1%ppl ful@adv loue@adv,
"Ful wrongfully bigonne thow,"""" quod he","“Ful wrongfully bigonne thou,” quod he",data/riverside_cats/SNT_riv.cat,data/oxford_txts/SNT_oxford.txt,data/csvs/SNT,The Second Nun's Tale 442,,10,10,Ful wrongfully bigonne thow quod he,Ful wrongfully bigonne thou quod he,u SuS uSu S u S,u SuS uSu S u S,ful@adv wrongfulli@adv biginnen@v%pt_2 thou@pron%nom quethen@v%pt_3 he@pron1%nom,ful@adv wrongfulli@adv biginnen@v%pt_2 thou@pron%nom quethen@v%pt_3 he@pron1%nom,
And yet in wrong is thy perseveraunce.,“And yet in wrong is thy perseveraunce;,data/riverside_cats/SNT_riv.cat,data/oxford_txts/SNT_oxford.txt,data/csvs/SNT,The Second Nun's Tale 443,,10,10,And yet in wrong is thy perseveraunce,And yet in wrong is thy perseveraunce,u S u S u S uSuSx,u S u S u S uSuSx,and@conj yet@adv in@prep wrong@n2 ben@v%pr_3 thin@pron%gen perseveraunce@n1,and@conj yet@adv in@prep wrong@n2 ben@v%pr_3 thin@pron%gen perseveraunce@n1,
Wostow nat how oure myghty princes free,Wostow nat° how our mighty princes free°,data/riverside_cats/SNT_riv.cat,data/oxford_txts/SNT_oxford.txt,data/csvs/SNT,The Second Nun's Tale 444,,10,10,Wostow nat how oure myghty princes free,Wostow nat how our mighty princes free,uS u S ux Su Su S,uS u S u Su Su S,witen@v1%pr_2_pron not@adv hou@adv&conj oure@pron%pl_gen mighti@adj prince@n%pl fre@adj,witen@v1%pr_2_pron not@adv hou@adv&conj oure@pron%pl_gen mighti@adj prince@n%pl fre@adj,
Han thus comanded and maad ordinaunce,Han thus comanded and maad ordinaunce,data/riverside_cats/SNT_riv.cat,data/oxford_txts/SNT_oxford.txt,data/csvs/SNT,The Second Nun's Tale 445,,10,10,Han thus comanded and maad ordinaunce,Han thus comanded and maad ordinaunce,u S uSu S u SuSx,u S uSu S u SuSx,haven@v%pr_pl thus@adv commaunden@v%ppl and@conj maken@v1%ppl ordinaunce@n,haven@v%pr_pl thus@adv commaunden@v%ppl and@conj maken@v1%ppl ordinaunce@n,
That every Cristen wight shal han penaunce,That every Cristen wight° shal han penaunce°,data/riverside_cats/SNT_riv.cat,data/oxford_txts/SNT_oxford.txt,data/csvs/SNT,The Second Nun's Tale 446,,10,10,That every Cristen wight shal han penaunce,That every Cristen wight shal han penaunce,u SuS uS u S u xSx,u SuS uS u S u xSx,that@conj everi@pron_gram_adj cristen@adj wight@n shulen@v1%pr_3 haven@v%inf penaunce@n,that@conj everi@pron_gram_adj cristen@adj wight@n shulen@v1%pr_3 haven@v%inf penaunce@n,
But if that he his Cristendom withseye,"But if° that he his cristendom withseye,°",data/riverside_cats/SNT_riv.cat,data/oxford_txts/SNT_oxford.txt,data/csvs/SNT,The Second Nun's Tale 447,,0,0,But if that he his Cristendom withseye,But if that he his cristendom withseye,      ,      ,but@conj if@conj that@part he@pron1%nom his@pron1%gen cristendom@n withseien@v%pr_3,but@conj if@conj that@part he@pron1%nom his@pron1%gen cristendom@n withseien@v%pr_3,
"And goon al quit, if he wole it reneye?","And goon al quit, if he wol it reneye?”°",data/riverside_cats/SNT_riv.cat,data/oxford_txts/SNT_oxford.txt,data/csvs/SNT,The Second Nun's Tale 448,,0,0,And goon al quit if he wole it reneye,And goon al quit if he wol it reneye,        ,        ,and@conj gon@v%inf al@adv quite@adj if@conj he@pron1%nom willen@v%pr_3 hit@pron reneien@v1%inf,and@conj gon@v%inf al@adv quite@adj if@conj he@pron1%nom willen@v%pr_3 hit@pron reneien@v1%inf,
"Yowre princes erren, as youre nobleye dooth","“Your princes erren, as your nobley° dooth,”",data/riverside_cats/SNT_riv.cat,data/oxford_txts/SNT_oxford.txt,data/csvs/SNT,The Second Nun's Tale 449,,10,10,Yowre princes erren as youre nobleye dooth,Your princes erren as your nobley dooth,ux Su Su S ux Su S,u Su Su S u Su S,your@pron%pl_gen prince@n%pl erren@v1%pr_pl as@conj your@pron%pl_gen nobleie@n don@v1%pr_3,your@pron%pl_gen prince@n%pl erren@v1%pr_pl as@conj your@pron%pl_gen nobleie@n don@v1%pr_3,
"Quod tho Cecile, """"and with a wood sentence","Quod tho Cecile, “and with a wood sentence°",data/riverside_cats/SNT_riv.cat,data/oxford_txts/SNT_oxford.txt,data/csvs/SNT,The Second Nun's Tale 450,,10,10,Quod tho Cecile and with a wood sentence,Quod tho Cecile and with a wood sentence,u S uSx u S u S uSx,u S uSx u S u S uSx,quethen@v%pt_3 tho@adv cecile@n#propn and@conj with@prep a@indef_art wod@adj sentence@n,quethen@v%pt_3 tho@adv cecile@n#propn and@conj with@prep a@indef_art wod@adj sentence@n,
"Ye make us gilty, and it is nat sooth.","Ye make us gilty, and it is nat sooth;°",data/riverside_cats/SNT_riv.cat,data/oxford_txts/SNT_oxford.txt,data/csvs/SNT,The Second Nun's Tale 451,,10,10,Ye make us gilty and it is nat sooth,Ye make us gilty and it is nat sooth,u Sx u Su S u S u S,u Sx u Su S u S u S,ye@pron%pl_nom maken@v1%pr_pl us@pron%pl_obj gilti@adj and@conj hit@pron ben@v%pr_3 not@adv soth@adj,ye@pron%pl_nom maken@v1%pr_pl us@pron%pl_obj gilti@adj and@conj hit@pron ben@v%pr_3 not@adv soth@adj,
"For ye, that knowen wel oure innocence","For ye, that knowen wel our innocence",data/riverside_cats/SNT_riv.cat,data/oxford_txts/SNT_oxford.txt,data/csvs/SNT,The Second Nun's Tale 452,,10,10,For ye that knowen wel oure innocence,For ye that knowen wel our innocence,u S u Su S ux SuSx,u S u Su S u SuSx,for@conj ye@pron%pl_nom that@pron knouen@v%pr_pl wel@adv oure@pron%pl_gen innocence@n,for@conj ye@pron%pl_nom that@pron knouen@v%pr_pl wel@adv oure@pron%pl_gen innocence@n,
For as muche as we doon a reverence,For as muche as we doon a reverence,data/riverside_cats/SNT_riv.cat,data/oxford_txts/SNT_oxford.txt,data/csvs/SNT,The Second Nun's Tale 453,,10,10,For as muche as we doon a reverence,For as muche as we doon a reverence,u S ux S u S u SuSx,u S ux S u S u SuSx,for@conj as@conj muche@n as@conj we@pron%pl_nom don@v1%pr_pl a@indef_art reverence@n,for@conj as@conj muche@n as@conj we@pron%pl_nom don@v1%pr_pl a@indef_art reverence@n,
"To Crist, and for we bere a Cristen name","To Crist, and for we bere a Cristen name",data/riverside_cats/SNT_riv.cat,data/oxford_txts/SNT_oxford.txt,data/csvs/SNT,The Second Nun's Tale 454,,10,10,To Crist and for we bere a Cristen name,To Crist and for we bere a Cristen name,u S u S u Sx u Su Sx,u S u S u Sx u Su Sx,to@prep crist@n#propn and@conj for@conj we@pron%pl_nom beren@v1%pr_pl a@indef_art cristen@adj name@n,to@prep crist@n#propn and@conj for@conj we@pron%pl_nom beren@v1%pr_pl a@indef_art cristen@adj name@n,
Ye putte on us a cryme and eek a blame.,"Ye putte on us a crime, and eek a blame.",data/riverside_cats/SNT_riv.cat,data/oxford_txts/SNT_oxford.txt,data/csvs/SNT,The Second Nun's Tale 455,,10,10,Ye putte on us a cryme and eek a blame,Ye putte on us a crime and eek a blame,u Sx u S u Sx u S u Sx,u Sx u S u Sx u S u Sx,ye@pron%pl_nom putten@v%pt_pl on@prep us@pron%pl_obj a@indef_art crime@n and@conj ek@adv a@indef_art blame@n,ye@pron%pl_nom putten@v%pt_pl on@prep us@pron%pl_obj a@indef_art crime@n and@conj ek@adv a@indef_art blame@n,
But we that knowen thilke name so,“But we that knowen° thilke° name so,data/riverside_cats/SNT_riv.cat,data/oxford_txts/SNT_oxford.txt,data/csvs/SNT,The Second Nun's Tale 456,,10,10,But we that knowen thilke name so,But we that knowen thilke name so,u S u Su Su Su S,u S u Su Su Su S,but@conj we@pron%pl_nom that@pron knouen@v%pr_pl thilke@gram_adj name@n so@adv,but@conj we@pron%pl_nom that@pron knouen@v%pr_pl thilke@gram_adj name@n so@adv,
"For vertuous, we may it nat withseye.","For° vertuous, we may it nat withseye.”°",data/riverside_cats/SNT_riv.cat,data/oxford_txts/SNT_oxford.txt,data/csvs/SNT,The Second Nun's Tale 457,,0,0,For vertuous we may it nat withseye,For vertuous we may it nat withseye,      ,      ,for@prep vertuous@adj we@pron%pl_nom mouen@v3%pr_pl hit@pron not@adv withseien@v%inf,for@prep vertuous@adj we@pron%pl_nom mouen@v3%pr_pl hit@pron not@adv withseien@v%inf,
"Almache answerde, """"Chees oon of thise two:","Almache answerde, “Chees oon of thise two",data/riverside_cats/SNT_riv.cat,data/oxford_txts/SNT_oxford.txt,data/csvs/SNT,The Second Nun's Tale 458,,10,10,Almache answerde Chees oon of thise two,Almache answerde Chees oon of thise two,uSx uSx u S u Su S,uSx uSx u S u Su S,almachius@n#propn answeren@v%pt_3 chesen@v%imp on@pron of@prep these@gram_adj%pl two@num_n,almachius@n#propn answeren@v%pt_3 chesen@v%imp on@pron of@prep these@gram_adj%pl two@num_n,
"Do sacrifice, or Cristendom reneye","Do sacrifice, or cristendom reneye",data/riverside_cats/SNT_riv.cat,data/oxford_txts/SNT_oxford.txt,data/csvs/SNT,The Second Nun's Tale 459,,0,0,Do sacrifice or Cristendom reneye,Do sacrifice or cristendom reneye,    ,    ,don@v1%inf sacrifice@n or@conj cristendom@n reneien@v1%imp,don@v1%inf sacrifice@n or@conj cristendom@n reneien@v1%imp,
That thou mowe now escapen by that weye.,That thou mowe now escapen by that weye.”,data/riverside_cats/SNT_riv.cat,data/oxford_txts/SNT_oxford.txt,data/csvs/SNT,The Second Nun's Tale 460,,10,10,That thou mowe now escapen by that weye,That thou mowe now escapen by that weye,u S ux S uSu S u S,u S ux S uSu S u S,that@conj thou@pron%nom mouen@v3%pr_2 nou@adv escapen@v%inf bi@prep that@art&gram_adj wei@n,that@conj thou@pron%nom mouen@v3%pr_2 nou@adv escapen@v%inf bi@prep that@art&gram_adj wei@n,
At which the hooly blisful faire mayde,At which the holy blisful faire maide,data/riverside_cats/SNT_riv.cat,data/oxford_txts/SNT_oxford.txt,data/csvs/SNT,The Second Nun's Tale 461,,10,10,At which the hooly blisful faire mayde,At which the holy blisful faire maide,u S u Su Su Su Sx,u S u Su Su Su Sx,at@prep which@pron the@def_art holi@adj2 blisful@adj fair@adj maide@n,at@prep which@pron the@def_art holi@adj2 blisful@adj fair@adj maide@n,
"Gan for to laughe, and to the juge sayde:","Gan for to laughe, and to the juge seide",data/riverside_cats/SNT_riv.cat,data/oxford_txts/SNT_oxford.txt,data/csvs/SNT,The Second Nun's Tale 462,,10,10,Gan for to laughe and to the juge sayde,Gan for to laughe and to the juge seide,u S u Sx u S u Su Sx,u S u Sx u S u Su Sx,ginnen@v%pt_3 for@prep#adv to@part laughen@v%inf and@conj to@prep the@def_art juge@n1 seien@v1%pt_3,ginnen@v%pt_3 for@prep#adv to@part laughen@v%inf and@conj to@prep the@def_art juge@n1 seien@v1%pt_3,
"O juge, confus in thy nycetee","“O juge, confus in thy nicetee,°",data/riverside_cats/SNT_riv.cat,data/oxford_txts/SNT_oxford.txt,data/csvs/SNT,The Second Nun's Tale 463,,10,10,O juge confus in thy nycetee,O juge confus in thy nicetee,u Su Su S u SuS,u Su Su S u SuS,o@interj juge@n1 confused@ppl#adj in@prep thin@pron%gen nicete@n,o@interj juge@n1 confused@ppl#adj in@prep thin@pron%gen nicete@n,
Woltow that I reneye innocence,Woltow that I reneye innocence,data/riverside_cats/SNT_riv.cat,data/oxford_txts/SNT_oxford.txt,data/csvs/SNT,The Second Nun's Tale 464,,9,9,Woltow that I reneye innocence,Woltow that I reneye innocence,Su S u Su SuSx,Su S u Su SuSx,willen@v%pr_2_pron that@conj ich@pron%nom reneien@v1%pr_1 innocence@n,willen@v%pr_2_pron that@conj ich@pron%nom reneien@v1%pr_1 innocence@n,
"To make me a wikked wight?"""" quod shee.",To make me a wikked wight?”° quod she;,data/riverside_cats/SNT_riv.cat,data/oxford_txts/SNT_oxford.txt,data/csvs/SNT,The Second Nun's Tale 465,,10,10,To make me a wikked wight quod shee,To make me a wikked wight quod she,u Su S u Su S u S,u Su S u Su S u S,to@part maken@v1%inf me@pron2%obj a@indef_art wikked@adj wight@n quethen@v%pt_3 she@pron%nom,to@part maken@v1%inf me@pron2%obj a@indef_art wikked@adj wight@n quethen@v%pt_3 she@pron%nom,
"Lo, he dissymuleth heere in audience;",“Lo! he dissimuleth° here in audience,data/riverside_cats/SNT_riv.cat,data/oxford_txts/SNT_oxford.txt,data/csvs/SNT,The Second Nun's Tale 466,,10,10,Lo he dissymuleth heere in audience,Lo he dissimuleth here in audience,u S uSux Sx u SuSx,u S uSuS xx u SuSx,lo@interj he@pron1%nom dissimulen@v%pr_3 her@adv in@prep audience@n,lo@interj he@pron1%nom dissimulen@v%pr_3 her@adv in@prep audience@n,
"He stareth, and woodeth in his advertence!",He spareth° and woodeth° in his advertence!”°,data/riverside_cats/SNT_riv.cat,data/oxford_txts/SNT_oxford.txt,data/csvs/SNT,The Second Nun's Tale 467,DIFF,10,10,He stareth and woodeth in his advertence,He spareth and woodeth in his advertence,u Su S ux S u SuSx,u Su S ux S u SuSx,he@pron1%nom staren@v%pr_3 and@conj woden@v1%pr_3 in@prep his@pron1%gen advertence@n,he@pron1%nom sparen@v%imp and@conj woden@v1%pr_3 in@prep his@pron1%gen advertence@n,green
"To whom Almachius, """"Unsely wrecche","To whom Almachius, “Unsely° wrecche",data/riverside_cats/SNT_riv.cat,data/oxford_txts/SNT_oxford.txt,data/csvs/SNT,The Second Nun's Tale 468,,10,10,To whom Almachius Unsely wrecche,To whom Almachius Unsely wrecche,u S uSuS uSu Sx,u S uSuS uSu Sx,to@prep whom@pron%obj almachius@n#propn unseli@adj wrecche@n,to@prep whom@pron%obj almachius@n#propn unseli@adj wrecche@n,
Ne woostow nat how fer my myght may strecche?,Ne woostow nat how far my might may strecche?,data/riverside_cats/SNT_riv.cat,data/oxford_txts/SNT_oxford.txt,data/csvs/SNT,The Second Nun's Tale 469,,10,10,Ne woostow nat how fer my myght may strecche,Ne woostow nat how far my might may strecche,u Su S u S u S u Sx,u Su S u S u S u Sx,ne@adv witen@v1%pr_2_pron not@adv hou@adv&conj fer@adv min@pron%gen might@n mouen@v3%pr_3 strecchen@v%inf,ne@adv witen@v1%pr_2_pron not@adv hou@adv&conj fer@adv min@pron%gen might@n mouen@v3%pr_3 strecchen@v%inf,
Han noght oure myghty princes to me yiven,"“Han noght our mighty princes to me yeven,°",data/riverside_cats/SNT_riv.cat,data/oxford_txts/SNT_oxford.txt,data/csvs/SNT,The Second Nun's Tale 470,,10,10,Han noght oure myghty princes to me yiven,Han noght our mighty princes to me yeven,u S ux Su Su S x uS,u S u Su Su S x uS,haven@v%pr_pl nought@adv oure@pron%pl_gen mighti@adj prince@n%pl to@prep me@pron2%obj yeven@v%ppl,haven@v%pr_pl nought@adv oure@pron%pl_gen mighti@adj prince@n%pl to@prep me@pron2%obj yeven@v%ppl,
"Ye, bothe power and auctoritee","Ye, bothe power and auctoritee",data/riverside_cats/SNT_riv.cat,data/oxford_txts/SNT_oxford.txt,data/csvs/SNT,The Second Nun's Tale 471,,10,10,Ye bothe power and auctoritee,Ye bothe power and auctoritee,u Su Su S uSuS,u Su Su S uSuS,ye@adv bothe@num_conj pouere@n and@conj auctorite@n,ye@adv bothe@num_conj pouere@n and@conj auctorite@n,
To maken folk to dyen or to lyven?,To maken folk to dyen or to liven?,data/riverside_cats/SNT_riv.cat,data/oxford_txts/SNT_oxford.txt,data/csvs/SNT,The Second Nun's Tale 472,,11,11,To maken folk to dyen or to lyven,To maken folk to dyen or to liven,u Su S u Su S u Su,u Su S u Su S u Su,to@part maken@v1%inf folk@n to@part dien@v%inf or@conj to@part liven@v1%inf,to@part maken@v1%inf folk@n to@part dien@v%inf or@conj to@part liven@v1%inf,
Why spekestow so proudly thanne to me?,Why spekestow so proudly than to me?”,data/riverside_cats/SNT_riv.cat,data/oxford_txts/SNT_oxford.txt,data/csvs/SNT,The Second Nun's Tale 473,,10,10,Why spekestow so proudly thanne to me,Why spekestow so proudly than to me,u SuS u Su Sx u S,u SuS u Su S u S,whi@adv speken@v%pr_2_pron so@adv proudli@adv thanne@adv to@prep me@pron2%obj,whi@adv speken@v%pr_2_pron so@adv proudli@adv thanne@adv to@prep me@pron2%obj,
"I speke noght but stedfastly,"""" quod she;","“I speke noght but stedfastly,” quod she",data/riverside_cats/SNT_riv.cat,data/oxford_txts/SNT_oxford.txt,data/csvs/SNT,The Second Nun's Tale 474,,10,10,I speke noght but stedfastly quod she,I speke noght but stedfastly quod she,u Su S u SuS u S,u Su S u SuS u S,ich@pron%nom speken@v%pr_1 nought@pron but@conj sted-fastli@adv quethen@v%pt_3 she@pron%nom,ich@pron%nom speken@v%pr_1 nought@pron but@conj sted-fastli@adv quethen@v%pt_3 she@pron%nom,
"Nat proudly, for I seye, as for my syde","“Nat proudly, for I seye, as for my side",data/riverside_cats/SNT_riv.cat,data/oxford_txts/SNT_oxford.txt,data/csvs/SNT,The Second Nun's Tale 475,,10,10,Nat proudly for I seye as for my syde,Nat proudly for I seye as for my side,u Su S u S u S u Sx,u Su S u S u S u Sx,not@adv proudli@adv for@conj ich@pron%nom seien@v1%pr_1 as@conj for@prep min@pron%gen side@n,not@adv proudli@adv for@conj ich@pron%nom seien@v1%pr_1 as@conj for@prep min@pron%gen side@n,
We haten deedly thilke vice of pryde.,We haten deedly thilke vice of pride.,data/riverside_cats/SNT_riv.cat,data/oxford_txts/SNT_oxford.txt,data/csvs/SNT,The Second Nun's Tale 476,,10,10,We haten deedly thilke vice of pryde,We haten deedly thilke vice of pride,u Su Su Su Sx u Sx,u Su Su Su Sx u Sx,we@pron%pl_nom haten@v%pr_pl dedli@adv thilke@gram_adj vice@n of@prep pride@n2,we@pron%pl_nom haten@v%pr_pl dedli@adv thilke@gram_adj vice@n of@prep pride@n2,
And if thou drede nat a sooth to heere,“And if thou drede nat a sooth° to here,data/riverside_cats/SNT_riv.cat,data/oxford_txts/SNT_oxford.txt,data/csvs/SNT,The Second Nun's Tale 477,,10,10,And if thou drede nat a sooth to heere,And if thou drede nat a sooth to here,u S u Su S u S u Sx,u S u Su S u S u Sx,and@conj if@conj thou@pron%nom dreden@v%pr_2 not@adv a@indef_art soth@n to@part heren@v%inf,and@conj if@conj thou@pron%nom dreden@v%pr_2 not@adv a@indef_art soth@n to@part heren@v%inf,
"Thanne wol I shewe al openly, by right","Than wol I shewe al openly, by right",data/riverside_cats/SNT_riv.cat,data/oxford_txts/SNT_oxford.txt,data/csvs/SNT,The Second Nun's Tale 478,,10,10,Thanne wol I shewe al openly by right,Than wol I shewe al openly by right,ux S u Sx u SuS u S,u S u Sx u SuS u S,thanne@adv willen@v%pr_1 ich@pron%nom sheuen@v1%inf al@adv openli@adv bi@prep right@n,thanne@adv willen@v%pr_1 ich@pron%nom sheuen@v1%inf al@adv openli@adv bi@prep right@n,
That thou hast maad a ful gret lesyng heere.,That thou hast maad a ful gret lesing° here.,data/riverside_cats/SNT_riv.cat,data/oxford_txts/SNT_oxford.txt,data/csvs/SNT,The Second Nun's Tale 479,,10,10,That thou hast maad a ful gret lesyng heere,That thou hast maad a ful gret lesing here,u S u S u S u Su Sx,u S u S u S u Su Sx,that@conj thou@pron%nom haven@v%pr_2 maken@v1%ppl a@indef_art ful@adv gret@adj lesinge@ger2 her@adv,that@conj thou@pron%nom haven@v%pr_2 maken@v1%ppl a@indef_art ful@adv gret@adj lesinge@ger2 her@adv,
Thou seyst thy princes han thee yeven myght,"Thou seyst, thy princes han thee yeven might",data/riverside_cats/SNT_riv.cat,data/oxford_txts/SNT_oxford.txt,data/csvs/SNT,The Second Nun's Tale 480,,10,10,Thou seyst thy princes han thee yeven myght,Thou seyst thy princes han thee yeven might,u S u Su S u Su S,u S u Su S u Su S,thou@pron%nom seien@v1%pr_2 thin@pron%gen prince@n%pl haven@v%pr_pl the@pron2%obj yeven@v%ppl might@n,thou@pron%nom seien@v1%pr_2 thin@pron%gen prince@n%pl haven@v%pr_pl the@pron2%obj yeven@v%ppl might@n,
Bothe for to sleen and for to quyken a wight;,Bothe for to sleen and for to quiken° a wight;,data/riverside_cats/SNT_riv.cat,data/oxford_txts/SNT_oxford.txt,data/csvs/SNT,The Second Nun's Tale 481,,10,10,Bothe for to sleen and for to quyken a wight,Bothe for to sleen and for to quiken a wight,ux S u S u S u Sx u S,ux S u S u S u Sx u S,bothe@num_conj for@prep#adv to@part slen@v%inf and@conj for@prep#adv to@part quiken@v%inf a@indef_art wight@n,bothe@num_conj for@prep#adv to@part slen@v%inf and@conj for@prep#adv to@part quiken@v%inf a@indef_art wight@n,
"Thou, that ne mayst but oonly lyf bireve","Thou, that ne mayst but only lif bireve,°",data/riverside_cats/SNT_riv.cat,data/oxford_txts/SNT_oxford.txt,data/csvs/SNT,The Second Nun's Tale 482,,10,10,Thou that ne mayst but oonly lyf bireve,Thou that ne mayst but only lif bireve,u S u S u Su S uSx,u S u S u Su S uSx,thou@pron%nom that@pron ne@adv mouen@v3%pr_2 but@conj onli@adj lif@n bireven@v%inf,thou@pron%nom that@pron ne@adv mouen@v3%pr_2 but@conj onli@adj lif@n bireven@v%inf,
Thou hast noon oother power ne no leve.,Thou hast non other power ne no leve!°,data/riverside_cats/SNT_riv.cat,data/oxford_txts/SNT_oxford.txt,data/csvs/SNT,The Second Nun's Tale 483,,10,10,Thou hast noon oother power ne no leve,Thou hast non other power ne no leve,u S u Su Su S u Sx,u S u Su Su S u Sx,thou@pron%nom haven@v%pr_2 non@gram_adj other@gram_adj pouere@n ne@conj1 no@gram_adj leve@n2,thou@pron%nom haven@v%pr_2 non@gram_adj other@gram_adj pouere@n ne@conj1 no@gram_adj leve@n2,
But thou mayst seyn thy princes han thee maked,"But thou mayst seyn,° thy princes han thee maked",data/riverside_cats/SNT_riv.cat,data/oxford_txts/SNT_oxford.txt,data/csvs/SNT,The Second Nun's Tale 484,,10,10,But thou mayst seyn thy princes han thee maked,But thou mayst seyn thy princes han thee maked,u S u S u Su S u Sx,u S u S u Su S u Sx,but@conj thou@pron%nom mouen@v3%pr_2 seien@v1%inf thin@pron%gen prince@n%pl haven@v%pr_pl the@pron2%obj maken@v1%ppl,but@conj thou@pron%nom mouen@v3%pr_2 seien@v1%inf thin@pron%gen prince@n%pl haven@v%pr_pl the@pron2%obj maken@v1%ppl,
Ministre of deeth; for if thou speke of mo,"Ministre of deeth; for if thou speke of mo,°",data/riverside_cats/SNT_riv.cat,data/oxford_txts/SNT_oxford.txt,data/csvs/SNT,The Second Nun's Tale 485,,10,10,Ministre of deeth for if thou speke of mo,Ministre of deeth for if thou speke of mo,uSx u S u S u Sx u S,uSx u S u S u Sx u S,ministre@n of@prep deth@n for@conj if@conj thou@pron%nom speken@v%pr_2 of@prep mo@n,ministre@n of@prep deth@n for@conj if@conj thou@pron%nom speken@v%pr_2 of@prep mo@n,
