OG_RIV_TEXT,OG_OXFORD_TEXT,RIVERSIDE_FILENAME,OXFORD_FILENAME,OUTPUT_FILENAME,LINE_NUMBER,MATCH,RIVERSIDE_SYLLABLES,OXFORD_SYLLABLES,RIVERSIDE_TEXT,OXFORD_TEXT,RIVERSIDE_SCANSION,OXFORD_SCANSION,RIVERSIDE_TAGGING,OXFORD_TAGGING,FLAG_COLOR
For whan he wiste it may noon oother be,For whan he wiste it may noon other be,data/riverside_cats/MerT_riv.cat,data/oxford_txts/MerT_oxford.txt,data/csvs/MerT,The Merchant's Tale 2083,,10,10,For whan he wiste it may noon oother be,For whan he wiste it may noon other be,u S u Sx u S u Su S,u S u Sx u S u Su S,for@conj whan@adv&conj he@pron1%nom witen@v1%pt_3 hit@pron mouen@v3%pr_3 non@gram_adj other@pron ben@v%inf,for@conj whan@adv&conj he@pron1%nom witen@v1%pt_3 hit@pron mouen@v3%pr_3 non@gram_adj other@pron ben@v%inf,
He paciently took his adversitee,He paciently took his adversitee;,data/riverside_cats/MerT_riv.cat,data/oxford_txts/MerT_oxford.txt,data/csvs/MerT,The Merchant's Tale 2084,,0,0,He paciently took his adversitee,He paciently took his adversitee,"    ",u SuS u S uSuS,he@pron1%nom pacientli@adv taken@v%pt_3 his@pron1%gen adversite@n,he@pron1%nom pacientli@adv taken@v%pt_3 his@pron1%gen adversite@n,
"Save, out of doute, he may nat forgoon","Save,° out of doute,° he may nat forgoon°",data/riverside_cats/MerT_riv.cat,data/oxford_txts/MerT_oxford.txt,data/csvs/MerT,The Merchant's Tale 2085,,10,10,Save out of doute he may nat forgoon,Save out of doute he may nat forgoon,ux S u Su S u S uS,ux S u Su S u S uS,sauf@prep#conj oute@adv#prep of@prep doute@n he@pron1%nom mouen@v3%pr_3 not@adv forgon@v%inf,sauf@prep#conj oute@adv#prep of@prep doute@n he@pron1%nom mouen@v3%pr_3 not@adv forgon@v%inf,
That he nas jalous everemoore in oon;,That he nas jalous° evermore in oon;°,data/riverside_cats/MerT_riv.cat,data/oxford_txts/MerT_oxford.txt,data/csvs/MerT,The Merchant's Tale 2086,,10,10,That he nas jalous everemoore in oon,That he nas jalous evermore in oon,u S u Su SxuSx u S,u S u Su SuSx u S,that@conj he@pron1%nom ben@v%pt_3_neg jelous@adj ever-mor@adv in@prep on@pron,that@conj he@pron1%nom ben@v%pt_3_neg jelous@adj ever-mor@adv in@prep on@pron,
Which jalousye it was so outrageous,"Which jalousie it was so outrageous,°",data/riverside_cats/MerT_riv.cat,data/oxford_txts/MerT_oxford.txt,data/csvs/MerT,The Merchant's Tale 2087,,0,10,Which jalousye it was so outrageous,Which jalousie it was so outrageous,"     ",u SuS u S x uSuS,which@pron jelousie@n hit@pron ben@v%pt_3 so@adv outrageous@adj,which@pron jelousie@n hit@pron ben@v%pt_3 so@adv outrageous@adj,
"That neither in halle, n' yn noon oother hous","That neither in halle, n&apos;in° noon other hous,°",data/riverside_cats/MerT_riv.cat,data/oxford_txts/MerT_oxford.txt,data/csvs/MerT,The Merchant's Tale 2088,DIFF,10,10,That neither in halle n yn noon oother hous,That neither in halle n in noon other hous,u Su S ux  S u Su S,u Sx u Sx  uSu S u S,that@conj neither@conj in@prep halle@n ne@conj1 in@prep non@gram_adj other@gram_adj hous@n,that@conj neither@conj in@prep halle@n ne@conj1 in@prep non@gram_adj other@gram_adj hous@n,green
"Ne in noon oother place, neverthemo","Ne in noon other place, neverthemo",data/riverside_cats/MerT_riv.cat,data/oxford_txts/MerT_oxford.txt,data/csvs/MerT,The Merchant's Tale 2089,,10,10,Ne in noon oother place neverthemo,Ne in noon other place neverthemo,u S u Su Sx uSuS,u S u Su Sx uSuS,ne@conj1 in@prep non@gram_adj other@gram_adj place@n never-the-mo@adv,ne@conj1 in@prep non@gram_adj other@gram_adj place@n never-the-mo@adv,
He nolde suffre hire for to ryde or go,"He nolde suffre° hir for to ride or go,°",data/riverside_cats/MerT_riv.cat,data/oxford_txts/MerT_oxford.txt,data/csvs/MerT,The Merchant's Tale 2090,,10,10,He nolde suffre hire for to ryde or go,He nolde suffre hir for to ride or go,u Sx ux Su S u Sx u S,u Su Sx u S u Sx u S,he@pron1%nom willen@v%pt_3_neg sufferen@v%inf hire@pron2%fem_obj for@prep#adv to@part riden@v%inf or@conj gon@v%inf,he@pron1%nom willen@v%pt_3_neg sufferen@v%inf hire@pron2%fem_obj for@prep#adv to@part riden@v%inf or@conj gon@v%inf,
But if that he had hond on hire alway;,But if that° he had hand on hir alway;,data/riverside_cats/MerT_riv.cat,data/oxford_txts/MerT_oxford.txt,data/csvs/MerT,The Merchant's Tale 2091,,10,10,But if that he had hond on hire alway,But if that he had hand on hir alway,u S u S u S u Sx uS,u S u S u S u S uS,but@conj if@conj that@part he@pron1%nom haven@v%pt_3 honde@n on@prep hire@pron2%fem_obj al-wei@adv,but@conj if@conj that@part he@pron1%nom haven@v%pt_3 honde@n on@prep hire@pron2%fem_obj al-wei@adv,
For which ful ofte wepeth fresshe May,For which ful ofte wepeth fresshe May,data/riverside_cats/MerT_riv.cat,data/oxford_txts/MerT_oxford.txt,data/csvs/MerT,The Merchant's Tale 2092,,10,10,For which ful ofte wepeth fresshe May,For which ful ofte wepeth fresshe May,u S u Su Su Su S,u S u Su Su Su S,for@prep which@pron ful@adv ofte@adv wepen@v%pr_3 fresh@adj mai@n3#propn,for@prep which@pron ful@adv ofte@adv wepen@v%pr_3 fresh@adj mai@n3#propn,
That loveth Damyan so benyngnely,"That loveth Damian so benignely,°",data/riverside_cats/MerT_riv.cat,data/oxford_txts/MerT_oxford.txt,data/csvs/MerT,The Merchant's Tale 2093,DIFF,10,10,That loveth Damyan so benyngnely,That loveth Damian so benignely,u Su SuS u xSuS,u Su SuS u xSuS,that@pron loven@v1%pr_3 damian@n#propn so@adv benigneli@adv,that@pron loven@v1%pr_3 damian@n#propn so@adv benigneli@adv,green
That she moot outher dyen sodeynly,That she mot° outher° dyen sodeinly,data/riverside_cats/MerT_riv.cat,data/oxford_txts/MerT_oxford.txt,data/csvs/MerT,The Merchant's Tale 2094,,10,10,That she moot outher dyen sodeynly,That she mot outher dyen sodeinly,u S u Su Su SuS,u S u Su Su SuS,that@pron she@pron%nom moten@v2%pr_3 outher@conj dien@v%inf sodeinli@adv,that@pron she@pron%nom moten@v2%pr_3 outher@conj dien@v%inf sodeinli@adv,
Or elles she moot han hym as hir leste.,Or elles she mot han him as hir leste;°,data/riverside_cats/MerT_riv.cat,data/oxford_txts/MerT_oxford.txt,data/csvs/MerT,The Merchant's Tale 2095,,10,10,Or elles she moot han hym as hir leste,Or elles she mot han him as hir leste,u Su S u S u S u Sx,u Su S u S u S u Sx,or@conj elles@adv she@pron%nom moten@v2%pr_3 haven@v%inf him@pron%obj as@conj hire@pron2%fem_obj listen@v1%pt_3,or@conj elles@adv she@pron%nom moten@v2%pr_3 haven@v%inf him@pron%obj as@conj hire@pron2%fem_obj listen@v1%pt_3,
She wayteth whan hir herte wolde breste.,She waiteth whan° hir herte wolde breste.°,data/riverside_cats/MerT_riv.cat,data/oxford_txts/MerT_oxford.txt,data/csvs/MerT,The Merchant's Tale 2096,,10,10,She wayteth whan hir herte wolde breste,She waiteth whan hir herte wolde breste,u Su S u Su Su Sx,u Su S u Su Su Sx,she@pron%nom waiten@v%pr_3 whan@adv&conj hire@pron1%fem_gen herte@n willen@v%pt_3 bresten@v%inf,she@pron%nom waiten@v%pr_3 whan@adv&conj hire@pron1%fem_gen herte@n willen@v%pt_3 bresten@v%inf,
Upon that oother syde Damyan,¶Upon that other side Damian,data/riverside_cats/MerT_riv.cat,data/oxford_txts/MerT_oxford.txt,data/csvs/MerT,The Merchant's Tale 2097,,10,10,Upon that oother syde Damyan,Upon that other side Damian,uS u Su Su SuS,uS u Su Su SuS,upon@prep that@art&gram_adj other@gram_adj side@n damian@n#propn,upon@prep that@art&gram_adj other@gram_adj side@n damian@n#propn,
Bicomen is the sorwefulleste man,Bicomen is the sorwefulleste man,data/riverside_cats/MerT_riv.cat,data/oxford_txts/MerT_oxford.txt,data/csvs/MerT,The Merchant's Tale 2098,,10,10,Bicomen is the sorwefulleste man,Bicomen is the sorwefulleste man,uSu S u SuSux S,uSu S u SuSux S,bicomen@v%ppl ben@v%pr_3 the@def_art sorweful@adj%sup man@n,bicomen@v%ppl ben@v%pr_3 the@def_art sorweful@adj%sup man@n,
"That evere was, for neither nyght ne day",That ever was; for neither night ne day,data/riverside_cats/MerT_riv.cat,data/oxford_txts/MerT_oxford.txt,data/csvs/MerT,The Merchant's Tale 2099,,10,10,That evere was for neither nyght ne day,That ever was for neither night ne day,u Sux S u Su S u S,u Su S u Su S u S,that@pron ever@adv ben@v%pt_3 for@conj neither@conj night@n ne@conj1 dai@n,that@pron ever@adv ben@v%pt_3 for@conj neither@conj night@n ne@conj1 dai@n,
Ne myghte he speke a word to fresshe May,Ne mighte he speke a word to fresshe May,data/riverside_cats/MerT_riv.cat,data/oxford_txts/MerT_oxford.txt,data/csvs/MerT,The Merchant's Tale 2100,,10,10,Ne myghte he speke a word to fresshe May,Ne mighte he speke a word to fresshe May,u Sx u Sx u S u Su S,u Sx u Sx u S u Su S,ne@adv mouen@v3%pt_3 he@pron1%nom speken@v%inf a@indef_art word@n to@prep fresh@adj mai@n3#propn,ne@adv mouen@v3%pt_3 he@pron1%nom speken@v%inf a@indef_art word@n to@prep fresh@adj mai@n3#propn,
"As to his purpos, of no swich mateere","As to his purpos,° of no swich matere,°",data/riverside_cats/MerT_riv.cat,data/oxford_txts/MerT_oxford.txt,data/csvs/MerT,The Merchant's Tale 2101,,10,10,As to his purpos of no swich mateere,As to his purpos of no swich matere,u S u Su S u S uSx,u S u Su S u S uSx,as@conj to@prep his@pron1%gen purpos@n of@prep no@gram_adj swich@gram_adj matere@n,as@conj to@prep his@pron1%gen purpos@n of@prep no@gram_adj swich@gram_adj matere@n,
But if that Januarie moste it heere,"But if that° Januarie moste it here,°",data/riverside_cats/MerT_riv.cat,data/oxford_txts/MerT_oxford.txt,data/csvs/MerT,The Merchant's Tale 2102,,10,10,But if that Januarie moste it heere,But if that Januarie moste it here,u S u SuSu Sx u Sx,u S u SuSu Sx u Sx,but@conj if@conj that@part januarie@n#propn moten@v2%pt_3 hit@pron heren@v%inf,but@conj if@conj that@part januarie@n#propn moten@v2%pt_3 hit@pron heren@v%inf,
That hadde an hand upon hire everemo.,That hadde an hand upon hir evermo.,data/riverside_cats/MerT_riv.cat,data/oxford_txts/MerT_oxford.txt,data/csvs/MerT,The Merchant's Tale 2103,,10,10,That hadde an hand upon hire everemo,That hadde an hand upon hir evermo,u Sx u S uS ux SxuS,u Sx u S uS u SuS,that@pron haven@v%pt_3 a@indef_art honde@n upon@prep hire@pron2%fem_obj ever-mor@adv,that@pron haven@v%pt_3 a@indef_art honde@n upon@prep hire@pron2%fem_obj ever-mor@adv,
"But nathelees, by writyng to and fro","But nathelees, by writing to and fro",data/riverside_cats/MerT_riv.cat,data/oxford_txts/MerT_oxford.txt,data/csvs/MerT,The Merchant's Tale 2104,,10,10,But nathelees by writyng to and fro,But nathelees by writing to and fro,u SuS u Su S u S,u SuS u Su S u S,but@conj no-the-lesse@adv bi@prep writinge@ger to@adv1 and@conj from@adv,but@conj no-the-lesse@adv bi@prep writinge@ger to@adv1 and@conj from@adv,
And privee signes wiste he what she mente,"And privee° signes,° wiste° he what she mente;",data/riverside_cats/MerT_riv.cat,data/oxford_txts/MerT_oxford.txt,data/csvs/MerT,The Merchant's Tale 2105,,10,10,And privee signes wiste he what she mente,And privee signes wiste he what she mente,u Su Su Sx u S u Sx,u Su Su Sx u S u Sx,and@conj prive@adj1 signe@n%pl witen@v1%pt_3 he@pron1%nom what@pron she@pron%nom menen@v1%pt_3,and@conj prive@adj1 signe@n%pl witen@v1%pt_3 he@pron1%nom what@pron she@pron%nom menen@v1%pt_3,
And she knew eek the fyn of his entente.,And she knew eek the fin° of his entente.°,data/riverside_cats/MerT_riv.cat,data/oxford_txts/MerT_oxford.txt,data/csvs/MerT,The Merchant's Tale 2106,,10,10,And she knew eek the fyn of his entente,And she knew eek the fin of his entente,u S u S u S u S uSx,u S u S u S u S uSx,and@conj she@pron%nom knouen@v%pt_3 ek@adv the@def_art fin@n2 of@prep his@pron1%gen entente@n,and@conj she@pron%nom knouen@v%pt_3 ek@adv the@def_art fin@n2 of@prep his@pron1%gen entente@n,
"O Januarie, what myghte it thee availle","¶O Januarie, what mighte it thee availle",data/riverside_cats/MerT_riv.cat,data/oxford_txts/MerT_oxford.txt,data/csvs/MerT,The Merchant's Tale 2107,,0,0,O Januarie what myghte it thee availle,O Januarie what mighte it thee availle,"      ",u SuSux u S u S uS,o@interj januarie@n#propn what@pron mouen@v3%pt_3 hit@pron the@pron2%obj availen@v%inf,o@interj januarie@n#propn what@pron mouen@v3%pt_3 hit@pron the@pron2%obj availen@v%inf,
Thogh thou myghtest se as fer as shippes saille?,Thou mightest° see as fer as shippes saille?,data/riverside_cats/MerT_riv.cat,data/oxford_txts/MerT_oxford.txt,data/csvs/MerT,The Merchant's Tale 2108,DIFF,10,10,Thogh thou myghtest se as fer as shippes saille,Thou mightest see as fer as shippes saille,u S uS x u S u Su Sx,u Su S u S u Su Sx,though@conj thou@pron%nom mouen@v3%pt_2 sen@v1%inf as@conj fer@adv as@conj ship@n%pl seilen@v%pr_pl,thou@pron%nom mouen@v3%pt_2 sen@v1%inf as@conj fer@adv as@conj ship@n%pl seilen@v%pr_pl,green
For as good is blynd deceyved be,For also good° is blind deceived be,data/riverside_cats/MerT_riv.cat,data/oxford_txts/MerT_oxford.txt,data/csvs/MerT,The Merchant's Tale 2109,DIFF,9,10,For as good is blynd deceyved be,For also good is blind deceived be,S u S u S uSu S,u Su S u S uSu S,for@conj as@conj god@adj ben@v%pr_3 blind@adj deceiven@v%ppl ben@v%inf,for@conj as@conj god@adj as@conj blind@adj deceiven@v%ppl ben@v%inf,green
As to be deceyved whan a man may se.,As be deceived whan a man may se.,data/riverside_cats/MerT_riv.cat,data/oxford_txts/MerT_oxford.txt,data/csvs/MerT,The Merchant's Tale 2110,DIFF,10,10,As to be deceyved whan a man may se,As be deceived whan a man may se,u S u SuS u S u S x,u S uSu S u S u S,as@conj to@part ben@v%inf deceiven@v%ppl whan@adv&conj a@indef_art man@n mouen@v3%pr_3 sen@v1%inf,as@conj ben@v%inf deceiven@v%ppl whan@adv&conj a@indef_art man@n mouen@v3%pr_3 sen@v1%inf,green
"Lo, Argus, which that hadde an hondred yen","Lo, Argus, which that° hadde an hondred eyen",data/riverside_cats/MerT_riv.cat,data/oxford_txts/MerT_oxford.txt,data/csvs/MerT,The Merchant's Tale 2111,,11,11,Lo Argus which that hadde an hondred yen,Lo Argus which that hadde an hondred eyen,u Su S u Sx u Su Su,u Su S u Sx u Su Su,lo@interj argus@n1#propn which@pron that@pron haven@v%pt_3 a@indef_art hundred@num_adj eie@n1%pl,lo@interj argus@n1#propn which@pron that@pron haven@v%pt_3 a@indef_art hundred@num_adj eie@n1%pl,
For al that evere he koude poure or pryen,"For al that ever he coude poure° or prien,°",data/riverside_cats/MerT_riv.cat,data/oxford_txts/MerT_oxford.txt,data/csvs/MerT,The Merchant's Tale 2112,,11,10,For al that evere he koude poure or pryen,For al that ever he coude poure or prien,u S u Sux S ux Sx u Su,u S u S u Sx ux S uS,for@conj al@gram_adjas_n that@pron ever@adv he@pron1%nom connen@v%pt_3 pouren@v1%inf or@conj prien@v%inf,for@conj al@gram_adjas_n that@pron ever@adv he@pron1%nom connen@v%pt_3 pouren@v1%inf or@conj prien@v%inf,
"Yet was he blent, and, God woot, so been mo","Yet was he blent;° and, God wot,° so ben mo,°",data/riverside_cats/MerT_riv.cat,data/oxford_txts/MerT_oxford.txt,data/csvs/MerT,The Merchant's Tale 2113,,10,10,Yet was he blent and God woot so been mo,Yet was he blent and God wot so ben mo,u S u S u S u S u S,u S u S u S u S u S,yet@adv ben@v%pt_3 he@pron1%nom blenden@v1%ppl and@conj god@n1#propn witen@v1%pr_3 so@adv ben@v%pr_pl mo@n,yet@adv ben@v%pt_3 he@pron1%nom blenden@v1%ppl and@conj god@n1#propn witen@v1%pr_3 so@adv ben@v%pr_pl mo@n,
That wenen wisly that it be nat so.,That wenen wisly° that it be nat so.,data/riverside_cats/MerT_riv.cat,data/oxford_txts/MerT_oxford.txt,data/csvs/MerT,The Merchant's Tale 2114,,10,10,That wenen wisly that it be nat so,That wenen wisly that it be nat so,u Su Su S u S u S,u Su Su S u S u S,that@pron wenen@v2%pr_pl wisli@adv that@conj hit@pron ben@v%pr_3 not@adv so@adv,that@pron wenen@v2%pr_pl wisli@adv that@conj hit@pron ben@v%pr_3 not@adv so@adv,
"Passe over is an ese, I sey namoore.","Passe over is an ese,° I sey namore.",data/riverside_cats/MerT_riv.cat,data/oxford_txts/MerT_oxford.txt,data/csvs/MerT,The Merchant's Tale 2115,,10,10,Passe over is an ese I sey namoore,Passe over is an ese I sey namore,ux Su S u Sx u S uSx,ux Su S u Sx u S uSx,passen@v%inf over@adv ben@v%pr_3 a@indef_art ese@n ich@pron%nom seien@v1%pr_1 no_more@n,passen@v%inf over@adv ben@v%pr_3 a@indef_art ese@n ich@pron%nom seien@v1%pr_1 no_more@n,
"This fresshe May, that I spak of so yoore","¶This fresshe May, that I spak of so yore,°",data/riverside_cats/MerT_riv.cat,data/oxford_txts/MerT_oxford.txt,data/csvs/MerT,The Merchant's Tale 2116,,10,10,This fresshe May that I spak of so yoore,This fresshe May that I spak of so yore,u Su S u S u S u Sx,u Su S u S u S u Sx,this@gram_adj fresh@adj mai@n3#propn that@pron ich@pron%nom speken@v%pt_1 of@prep so@adv yor@adv,this@gram_adj fresh@adj mai@n3#propn that@pron ich@pron%nom speken@v%pt_1 of@prep so@adv yor@adv,
In warm wex hath emprented the clyket,"In warme wex° hath emprented° the cliket,°",data/riverside_cats/MerT_riv.cat,data/oxford_txts/MerT_oxford.txt,data/csvs/MerT,The Merchant's Tale 2117,,10,10,In warm wex hath emprented the clyket,In warme wex hath emprented the cliket,u S u S uSu S uS,u Sx u S uSu S uS,in@prep warm@adj wax@n1 haven@v%pr_3 emprenten@v%ppl the@def_art cliket@n1,in@prep warm@adj wax@n1 haven@v%pr_3 emprenten@v%ppl the@def_art cliket@n1,
That Januarie bar of the smale wyket,"That Januarie bar° of the smale wiket,°",data/riverside_cats/MerT_riv.cat,data/oxford_txts/MerT_oxford.txt,data/csvs/MerT,The Merchant's Tale 2118,,0,0,That Januarie bar of the smale wyket,That Januarie bar of the smale wiket,"      ",u SuSx u S u Su Su,that@pron januarie@n#propn beren@v1%pt_3 of@prep the@def_art smal@adj wiket@n,that@pron januarie@n#propn beren@v1%pt_3 of@prep the@def_art smal@adj wiket@n,green
By which into his gardyn ofte he wente;,By which into his gardin ofte he wente.,data/riverside_cats/MerT_riv.cat,data/oxford_txts/MerT_oxford.txt,data/csvs/MerT,The Merchant's Tale 2119,,10,10,By which into his gardyn ofte he wente,By which into his gardin ofte he wente,u S uS u Su Sx u Sx,u S uS u Su Sx u Sx,bi@prep which@pron in-to@prep his@pron1%gen gardin@n ofte@adv he@pron1%nom wenden@v%pt_3,bi@prep which@pron in-to@prep his@pron1%gen gardin@n ofte@adv he@pron1%nom wenden@v%pt_3,
"And Damyan, that knew al hire entente","And Damian, that knew al hir entente",data/riverside_cats/MerT_riv.cat,data/oxford_txts/MerT_oxford.txt,data/csvs/MerT,The Merchant's Tale 2120,,10,10,And Damyan that knew al hire entente,And Damian that knew al hir entente,u SuS u S u Sx uSx,u SuS u S u S uSx,and@conj damian@n#propn that@pron knouen@v%pt_3 al@gram_adj hire@pron1%fem_gen entente@n,and@conj damian@n#propn that@pron knouen@v%pt_3 al@gram_adj hire@pron1%fem_gen entente@n,
The cliket countrefeted pryvely.,The cliket countrefeted° prively;°,data/riverside_cats/MerT_riv.cat,data/oxford_txts/MerT_oxford.txt,data/csvs/MerT,The Merchant's Tale 2121,,10,10,The cliket countrefeted pryvely,The cliket countrefeted prively,u Su SuSu SuS,u Su SuSu SuS,the@def_art cliket@n1 countrefeten@v%pt_3 privelie@adv,the@def_art cliket@n1 countrefeten@v%pt_3 privelie@adv,
"Ther nys namoore to seye, but hastily","Ther nis namore° to seye, but° hastily",data/riverside_cats/MerT_riv.cat,data/oxford_txts/MerT_oxford.txt,data/csvs/MerT,The Merchant's Tale 2122,,10,10,Ther nys namoore to seye but hastily,Ther nis namore to seye but hastily,u S uSx u S u SuS,u S uSx u S u SuS,ther@adv ben@v%pr_3_neg no_more@n to@part seien@v1%inf but@conj hastilie@adv,ther@adv ben@v%pr_3_neg no_more@n to@part seien@v1%inf but@conj hastilie@adv,
Som wonder by this clyket shal bityde,"Som wonder° by this cliket shal bitide,°",data/riverside_cats/MerT_riv.cat,data/oxford_txts/MerT_oxford.txt,data/csvs/MerT,The Merchant's Tale 2123,,10,10,Som wonder by this clyket shal bityde,Som wonder by this cliket shal bitide,u Su S u Su S uSx,u Su S u Su S uSx,som@gram_adj wonder@n bi@prep this@gram_adj cliket@n1 shulen@v1%pr_3 bitiden@v%inf,som@gram_adj wonder@n bi@prep this@gram_adj cliket@n1 shulen@v1%pr_3 bitiden@v%inf,
"Which ye shul heeren, if ye wole abyde.","Which ye shul heren, if ye wole abide.°",data/riverside_cats/MerT_riv.cat,data/oxford_txts/MerT_oxford.txt,data/csvs/MerT,The Merchant's Tale 2124,,10,10,Which ye shul heeren if ye wole abyde,Which ye shul heren if ye wole abide,u S u Su S u Sx uSx,u S u Su S u Sx uSx,which@pron ye@pron%pl_nom shulen@v1%pr_pl heren@v%inf if@conj ye@pron%pl_nom willen@v%pr_pl abiden@v%inf,which@pron ye@pron%pl_nom shulen@v1%pr_pl heren@v%inf if@conj ye@pron%pl_nom willen@v%pr_pl abiden@v%inf,
"O noble Ovyde, ful sooth seystou, God woot","¶O noble Ovide, ful sooth° seystou,° God woot!",data/riverside_cats/MerT_riv.cat,data/oxford_txts/MerT_oxford.txt,data/csvs/MerT,The Merchant's Tale 2125,,0,0,O noble Ovyde ful sooth seystou God woot,O noble Ovide ful sooth seystou God woot,"       ",u Sux uS u S uS u S,o@interj noble@adj ovide@n#propn ful@adj soth@n seien@v1%pr_2_pron god@n1#propn witen@v1%pr_3,o@interj noble@adj ovide@n#propn ful@adj soth@n seien@v1%pr_2_pron god@n1#propn witen@v1%pr_3,
"What sleighte is it, thogh it be long and hoot","What sleighte° is it, thogh it be long and hoot,°",data/riverside_cats/MerT_riv.cat,data/oxford_txts/MerT_oxford.txt,data/csvs/MerT,The Merchant's Tale 2126,,10,10,What sleighte is it thogh it be long and hoot,What sleighte is it thogh it be long and hoot,u Sx u S u S u S u S,u Sx u S u S u S u S,what@gram_adj sleight@n ben@v%pr_3 hit@pron though@conj hit@pron ben@v%pr_3 long@adj1 and@conj hot@adj,what@gram_adj sleight@n ben@v%pr_3 hit@pron though@conj hit@pron ben@v%pr_3 long@adj1 and@conj hot@adj,
That Love nyl fynde it out in som manere?,That he° nil° finde it out in som manere?,data/riverside_cats/MerT_riv.cat,data/oxford_txts/MerT_oxford.txt,data/csvs/MerT,The Merchant's Tale 2127,DIFF,10,10,That Love nyl fynde it out in som manere,That he nil finde it out in som manere,u Sx u Sx u S u S uSx,u S u Sx u S u S uSx,that@pron love@n1#propn willen@v%pr_3_neg finden@v%inf hit@pron oute@adv in@prep som@gram_adj manere@n,that@pron he@pron1%nom willen@v%pr_3_neg finden@v%inf hit@pron oute@adv in@prep som@gram_adj manere@n,green
By Piramus and Tesbee may men leere;,By Piramus and Tesbee may men lere;,data/riverside_cats/MerT_riv.cat,data/oxford_txts/MerT_oxford.txt,data/csvs/MerT,The Merchant's Tale 2128,,10,10,By Piramus and Tesbee may men leere,By Piramus and Tesbee may men lere,u SuS u Su S u Sx,u SuS u Su S u Sx,bi@prep piramus@n#propn and@conj tisbe@n#propn mouen@v3%pr_pl man@n%pl leren@v%inf,bi@prep piramus@n#propn and@conj tisbe@n#propn mouen@v3%pr_pl man@n%pl leren@v%inf,
Thogh they were kept ful longe streite overal,"Thogh they were kept ful long° streite° overal,°",data/riverside_cats/MerT_riv.cat,data/oxford_txts/MerT_oxford.txt,data/csvs/MerT,The Merchant's Tale 2129,,10,10,Thogh they were kept ful longe streite overal,Thogh they were kept ful long streite overal,u S ux S u Sx ux SuS,u S ux S u S ux SuS,though@conj thei@pron%pl_nom ben@v%pt_pl kepen@v%ppl ful@adv longe@adv streite@adv over-al@adv,though@conj thei@pron%pl_nom ben@v%pt_pl kepen@v%ppl ful@adv longe@adv streite@adv over-al@adv,
"They been accorded, rownynge thurgh a wal","They been accorded,° rouning° thurgh a wal",data/riverside_cats/MerT_riv.cat,data/oxford_txts/MerT_oxford.txt,data/csvs/MerT,The Merchant's Tale 2130,,10,10,They been accorded rownynge thurgh a wal,They been accorded rouning thurgh a wal,u S uSu Sux S u S,u S uSu Su S u S,thei@pron%pl_nom ben@v%pr_pl accorden@v%ppl rounen@v%prp_abs thurgh@prep a@indef_art wal@n1,thei@pron%pl_nom ben@v%pr_pl accorden@v%ppl rounen@v%prp_abs thurgh@prep a@indef_art wal@n1,
Ther no wight koude han founde out swich a sleighte.,Ther° no wight coude han founde out swich a sleighte.°,data/riverside_cats/MerT_riv.cat,data/oxford_txts/MerT_oxford.txt,data/csvs/MerT,The Merchant's Tale 2131,,10,10,Ther no wight koude han founde out swich a sleighte,Ther no wight coude han founde out swich a sleighte,u S u Sx u Sx u S u Sx,u S u Sx u Sx u S u Sx,ther@adv no@gram_adj wight@n connen@v%pt_3 haven@v%inf finden@v%ppl oute@adv swich@gram_adj a@indef_art sleight@n,ther@adv no@gram_adj wight@n connen@v%pt_3 haven@v%inf finden@v%ppl oute@adv swich@gram_adj a@indef_art sleight@n,
But now to purpos: er that dayes eighte,¶But now to purpos;° er that dayes eighte,data/riverside_cats/MerT_riv.cat,data/oxford_txts/MerT_oxford.txt,data/csvs/MerT,The Merchant's Tale 2132,,10,10,But now to purpos er that dayes eighte,But now to purpos er that dayes eighte,u S u Su S u Su Sx,u S u Su S u Su Sx,but@conj nou@adv to@prep purpos@n er@conj1 that@part dai@n%pl eighte@num_adj,but@conj nou@adv to@prep purpos@n er@conj1 that@part dai@n%pl eighte@num_adj,
"Were passed [of] the month of [Juyn], bifil","Were passed, er the monthe of Juil,° bifil°",data/riverside_cats/MerT_riv.cat,data/oxford_txts/MerT_oxford.txt,data/csvs/MerT,The Merchant's Tale 2133,DIFF,10,10,Were passed of the month of Juyn bifil,Were passed er the monthe of Juil bifil,ux Su S u S u S uS,ux Su S u Sx u S uS,ben@v%pt_pl passen@v%ppl of@prep the@def_art month@n of@prep juin@n bifallen@v%pt_3,ben@v%pt_pl passen@v%ppl er@adv the@def_art month@n of@prep  bifallen@v%pt_3,green
That Januarie hath caught so greet a wil,"That Januarie hath caught so greet a wil,°",data/riverside_cats/MerT_riv.cat,data/oxford_txts/MerT_oxford.txt,data/csvs/MerT,The Merchant's Tale 2134,,0,0,That Januarie hath caught so greet a wil,That Januarie hath caught so greet a wil,"       ",u SuSux u S u S u S,that@conj januarie@n#propn haven@v%pr_3 cacchen@v%ppl so@adv gret@adj a@indef_art wille@n,that@conj januarie@n#propn haven@v%pr_3 cacchen@v%ppl so@adv gret@adj a@indef_art wille@n,
"Thurgh eggyng of his wyf, hym for to pleye","Thurgh egging° of his wif, him for to pleye°",data/riverside_cats/MerT_riv.cat,data/oxford_txts/MerT_oxford.txt,data/csvs/MerT,The Merchant's Tale 2135,,10,10,Thurgh eggyng of his wyf hym for to pleye,Thurgh egging of his wif him for to pleye,u Su S u S u S u S,u Su S u S u S u S,thurgh@prep egging@ger1 of@prep his@pron1%gen wif@n him@pron%obj for@prep#adv to@part pleien@v1%inf,thurgh@prep egging@ger1 of@prep his@pron1%gen wif@n him@pron%obj for@prep#adv to@part pleien@v1%inf,
