OG_RIV_TEXT,OG_OXFORD_TEXT,RIVERSIDE_FILENAME,OXFORD_FILENAME,OUTPUT_FILENAME,LINE_NUMBER,MATCH,RIVERSIDE_SYLLABLES,OXFORD_SYLLABLES,RIVERSIDE_TEXT,OXFORD_TEXT,RIVERSIDE_SCANSION,OXFORD_SCANSION,RIVERSIDE_TAGGING,OXFORD_TAGGING,FLAG_COLOR
"His fresshe May, his paradys, his make.","His fresshe May, his paradis, his make.°",data/riverside_cats/MerT_riv.cat,data/oxford_txts/MerT_oxford.txt,data/csvs/MerT,The Merchant's Tale 1822,,10,10,His fresshe May his paradys his make,His fresshe May his paradis his make,u Su S u SuS u Sx,u Su S u SuS u Sx,his@pron1%gen fresh@adj mai@n3#propn his@pron1%gen paradise@n his@pron1%gen make@n1,his@pron1%gen fresh@adj mai@n3#propn his@pron1%gen paradise@n his@pron1%gen make@n1,
He lulleth hire; he kisseth hire ful ofte;,"He lulleth° hir, he kisseth hir ful ofte",data/riverside_cats/MerT_riv.cat,data/oxford_txts/MerT_oxford.txt,data/csvs/MerT,The Merchant's Tale 1823,,10,10,He lulleth hire he kisseth hire ful ofte,He lulleth hir he kisseth hir ful ofte,u Su Sx u Su Sx u Sx,u Su S u Su S u Sx,he@pron1%nom lullen@v%pr_3 hire@pron2%fem_obj he@pron1%nom kissen@v%pr_3 hire@pron2%fem_obj ful@adv ofte@adv,he@pron1%nom lullen@v%pr_3 hire@pron2%fem_obj he@pron1%nom kissen@v%pr_3 hire@pron2%fem_obj ful@adv ofte@adv,
With thikke brustles of his berd unsofte,With thikke bristles of his berd unsofte,data/riverside_cats/MerT_riv.cat,data/oxford_txts/MerT_oxford.txt,data/csvs/MerT,The Merchant's Tale 1824,,10,10,With thikke brustles of his berd unsofte,With thikke bristles of his berd unsofte,u Su Su S u S uSx,u Su Su S u S uSx,with@prep thikke@adj bristel@n%pl of@prep his@pron1%gen berd@n1 unsoft@adj,with@prep thikke@adj bristel@n%pl of@prep his@pron1%gen berd@n1 unsoft@adj,
"Lyk to the skyn of houndfyssh, sharp as brere --","Lik to° the skin of houndfish, sharp as brere,°",data/riverside_cats/MerT_riv.cat,data/oxford_txts/MerT_oxford.txt,data/csvs/MerT,The Merchant's Tale 1825,,10,10,Lyk to the skyn of houndfyssh sharp as brere,Lik to the skin of houndfish sharp as brere,u S u S u Su S u Sx,u S u S u Su S u Sx,lik@adj to@prep the@def_art skin@n1 of@prep houndes-fish@n sharp@adj as@conj brer@n --@dash,lik@adj to@prep the@def_art skin@n1 of@prep houndes-fish@n sharp@adj as@conj brer@n --@dash,
For he was shave al newe in his manere --,For he was shave al newe in his manere.,data/riverside_cats/MerT_riv.cat,data/oxford_txts/MerT_oxford.txt,data/csvs/MerT,The Merchant's Tale 1826,,10,10,For he was shave al newe in his manere,For he was shave al newe in his manere,u S u Sx u Sx u S uSx,u S u Sx u Sx u S uSx,for@conj he@pron1%nom ben@v%pt_3 shaven@v%ppl al@adv neue@adv in@prep his@pron1%gen manere@n --@dash,for@conj he@pron1%nom ben@v%pt_3 shaven@v%ppl al@adv neue@adv in@prep his@pron1%gen manere@n --@dash,
He rubbeth hire aboute hir tendre face,He rubbeth hir aboute hir tendre face,data/riverside_cats/MerT_riv.cat,data/oxford_txts/MerT_oxford.txt,data/csvs/MerT,The Merchant's Tale 1827,,10,10,He rubbeth hire aboute hir tendre face,He rubbeth hir aboute hir tendre face,u Su Sx uSx u Su Sx,u Su S uSx u Su Sx,he@pron1%nom rubben@v%pr_3 hire@pron2%fem_obj abouten@prep hire@pron1%fem_gen tender@adj face@n,he@pron1%nom rubben@v%pr_3 hire@pron2%fem_obj abouten@prep hire@pron1%fem_gen tender@adj face@n,
"And seyde thus, """"Allas! I moot trespace","And seide thus, “Allas! I moot° trespace°",data/riverside_cats/MerT_riv.cat,data/oxford_txts/MerT_oxford.txt,data/csvs/MerT,The Merchant's Tale 1828,,10,10,And seyde thus Allas I moot trespace,And seide thus Allas I moot trespace,u Su S uS u S uSx,u Su S uS u S uSx,and@conj seien@v1%pt_3 thus@adv alas@interj ich@pron%nom moten@v2%pr_1 trespassen@v%inf,and@conj seien@v1%pt_3 thus@adv alas@interj ich@pron%nom moten@v2%pr_1 trespassen@v%inf,
"To yow, my spouse, and yow greetly offende","To yow, my spouse, and yow gretly offende",data/riverside_cats/MerT_riv.cat,data/oxford_txts/MerT_oxford.txt,data/csvs/MerT,The Merchant's Tale 1829,,10,10,To yow my spouse and yow greetly offende,To yow my spouse and yow gretly offende,u S u Sx u S uS uSx,u S u Sx u S uS uSx,to@prep you@pron%pl_obj min@pron%gen spouse@n and@conj you@pron%pl_obj gretli@adv offenden@v%inf,to@prep you@pron%pl_obj min@pron%gen spouse@n and@conj you@pron%pl_obj gretli@adv offenden@v%inf,
Er tyme come that I wil doun descende.,Er time come that I wil doun descende.°,data/riverside_cats/MerT_riv.cat,data/oxford_txts/MerT_oxford.txt,data/csvs/MerT,The Merchant's Tale 1830,,10,10,Er tyme come that I wil doun descende,Er time come that I wil doun descende,u Su Sx u S u S uSx,u Su Sx u S u S uSx,er@conj1 time@n comen@v%pr_3 that@conj ich@pron%nom willen@v%pr_1 doun@adv descenden@v%inf,er@conj1 time@n comen@v%pr_3 that@conj ich@pron%nom willen@v%pr_1 doun@adv descenden@v%inf,
"But nathelees, considereth this,"""" quod he","But nathelees, considereth this,” quod he",data/riverside_cats/MerT_riv.cat,data/oxford_txts/MerT_oxford.txt,data/csvs/MerT,The Merchant's Tale 1831,,10,10,But nathelees considereth this quod he,But nathelees considereth this quod he,u SuS uSux S u S,u SuS uSux S u S,but@conj no-the-lesse@adv consideren@v%imp this@pron quethen@v%pt_3 he@pron1%nom,but@conj no-the-lesse@adv consideren@v%imp this@pron quethen@v%pt_3 he@pron1%nom,
"Ther nys no werkman, whatsoevere he be","“Ther nis no° werkman, whatsoever he be",data/riverside_cats/MerT_riv.cat,data/oxford_txts/MerT_oxford.txt,data/csvs/MerT,The Merchant's Tale 1832,,10,10,Ther nys no werkman whatsoevere he be,Ther nis no werkman whatsoever he be,u S u Su SuSxx u S,u S u Su SuSx u S,ther@adv ben@v%pr_3_neg no@gram_adj werk-man@n what-so-ever@adj he@pron1%nom ben@v%pr_3,ther@adv ben@v%pr_3_neg no@gram_adj werk-man@n what-so-ever@adj he@pron1%nom ben@v%pr_3,
That may bothe werke wel and hastily;,That° may both werke wel and hastily;,data/riverside_cats/MerT_riv.cat,data/oxford_txts/MerT_oxford.txt,data/csvs/MerT,The Merchant's Tale 1833,,10,10,That may bothe werke wel and hastily,That may both werke wel and hastily,u S ux Su S u SuS,u S u Su S u SuS,that@pron mouen@v3%pr_3 bothe@num_conj werken@v%inf wel@adv and@conj hastilie@adv,that@pron mouen@v3%pr_3 bothe@num_conj werken@v%inf wel@adv and@conj hastilie@adv,
This wol be doon at leyser parfitly.,This wol be doon at leiser parfitly.,data/riverside_cats/MerT_riv.cat,data/oxford_txts/MerT_oxford.txt,data/csvs/MerT,The Merchant's Tale 1834,,10,10,This wol be doon at leyser parfitly,This wol be doon at leiser parfitly,u S u S u Su SuS,u S u S u Su SuS,this@pron willen@v%pr_3 ben@v%inf don@v1%ppl at@prep leiser@n parfitli@adv,this@pron willen@v%pr_3 ben@v%inf don@v1%ppl at@prep leiser@n parfitli@adv,
It is no fors how longe that we pleye;,It is no fors° how longe that we pleye;,data/riverside_cats/MerT_riv.cat,data/oxford_txts/MerT_oxford.txt,data/csvs/MerT,The Merchant's Tale 1835,,10,10,It is no fors how longe that we pleye,It is no fors how longe that we pleye,u S u S u Su S u S,u S u S u Su S u S,hit@pron ben@v%pr_3 no@gram_adj force@n hou@adv&conj longe@adv that@part we@pron%pl_nom pleien@v1%pr_pl,hit@pron ben@v%pr_3 no@gram_adj force@n hou@adv&conj longe@adv that@part we@pron%pl_nom pleien@v1%pr_pl,
In trewe wedlok coupled be we tweye,In trewe wedlok wedded be we tweye;,data/riverside_cats/MerT_riv.cat,data/oxford_txts/MerT_oxford.txt,data/csvs/MerT,The Merchant's Tale 1836,DIFF,10,10,In trewe wedlok coupled be we tweye,In trewe wedlok wedded be we tweye,u Su Su Su S u S,u Su Su Su S u S,in@prep treu@adj wedlok@n couplen@v%ppl ben@v%pr_pl we@pron%pl_nom twein@num_n,in@prep treu@adj wedlok@n wedden@v%ppl ben@v%pr_pl we@pron%pl_nom twein@num_n,green
And blessed be the yok that we been inne,And blessed be the yok that we been inne,data/riverside_cats/MerT_riv.cat,data/oxford_txts/MerT_oxford.txt,data/csvs/MerT,The Merchant's Tale 1837,,10,10,And blessed be the yok that we been inne,And blessed be the yok that we been inne,u Su S u S u S u Sx,u Su S u S u S u Sx,and@conj blessen@v%ppl ben@v%pr_3 the@def_art yok@n that@pron we@pron%pl_nom ben@v%pr_pl inne@prep,and@conj blessen@v%ppl ben@v%pr_3 the@def_art yok@n that@pron we@pron%pl_nom ben@v%pr_pl inne@prep,
For in oure actes we mowe do no synne.,For in our actes we mow do no sinne.,data/riverside_cats/MerT_riv.cat,data/oxford_txts/MerT_oxford.txt,data/csvs/MerT,The Merchant's Tale 1838,,10,10,For in oure actes we mowe do no synne,For in our actes we mow do no sinne,u S ux Su S ux S u Sx,u S u Su S u S u Sx,for@conj in@prep oure@pron%pl_gen acte@n%pl we@pron%pl_nom mouen@v3%pr_pl don@v1%inf no@gram_adj sinne@n,for@conj in@prep oure@pron%pl_gen acte@n%pl we@pron%pl_nom mouen@v3%pr_pl don@v1%inf no@gram_adj sinne@n,
A man may do no synne with his wyf,A man may do no sinne with his wif,data/riverside_cats/MerT_riv.cat,data/oxford_txts/MerT_oxford.txt,data/csvs/MerT,The Merchant's Tale 1839,,10,10,A man may do no synne with his wyf,A man may do no sinne with his wif,u S u S u Su S u S,u S u S u Su S u S,a@indef_art man@n mouen@v3%pr_3 don@v1%inf no@gram_adj sinne@n with@prep his@pron1%gen wif@n,a@indef_art man@n mouen@v3%pr_3 don@v1%inf no@gram_adj sinne@n with@prep his@pron1%gen wif@n,
Ne hurte hymselven with his owene knyf,Ne hurte himselven with his owene knif;,data/riverside_cats/MerT_riv.cat,data/oxford_txts/MerT_oxford.txt,data/csvs/MerT,The Merchant's Tale 1840,,10,10,Ne hurte hymselven with his owene knyf,Ne hurte himselven with his owene knif,u Sx uSu S u Sux S,u Sx uSu S u Sux S,ne@conj1 hurten@v%inf him-self@pron with@prep his@pron1%gen ouen@adj knif@n,ne@conj1 hurten@v%inf him-self@pron with@prep his@pron1%gen ouen@adj knif@n,
For we han leve to pleye us by the lawe.,For we han leve to pleye us° by the lawe.”,data/riverside_cats/MerT_riv.cat,data/oxford_txts/MerT_oxford.txt,data/csvs/MerT,The Merchant's Tale 1841,,10,10,For we han leve to pleye us by the lawe,For we han leve to pleye us by the lawe,u S u Sx u S u S u Sx,u S u Sx u S u S u Sx,for@conj we@pron%pl_nom haven@v%pr_pl leve@n2 to@part pleien@v1%inf us@pron%pl_obj bi@prep the@def_art laue@n,for@conj we@pron%pl_nom haven@v%pr_pl leve@n2 to@part pleien@v1%inf us@pron%pl_obj bi@prep the@def_art laue@n,
Thus laboureth he til that the day gan dawe;,Thus laboureth he til that the day gan dawe;°,data/riverside_cats/MerT_riv.cat,data/oxford_txts/MerT_oxford.txt,data/csvs/MerT,The Merchant's Tale 1842,,10,10,Thus laboureth he til that the day gan dawe,Thus laboureth he til that the day gan dawe,u Sux S u S u S u Sx,u Sux S u S u S u Sx,thus@adv labouren@v%pr_3 he@pron1%nom til@conj that@part the@def_art dai@n ginnen@v%pt_3 dauen@v%inf,thus@adv labouren@v%pr_3 he@pron1%nom til@conj that@part the@def_art dai@n ginnen@v%pt_3 dauen@v%inf,
And thanne he taketh a sop in fyn clarree,"And than he taketh a sop° in fin clarree,°",data/riverside_cats/MerT_riv.cat,data/oxford_txts/MerT_oxford.txt,data/csvs/MerT,The Merchant's Tale 1843,,10,10,And thanne he taketh a sop in fyn clarree,And than he taketh a sop in fin clarree,u Sx u Sx u S u S uS,u S u Sx u S u S uS,and@conj thanne@adv he@pron1%nom taken@v%pr_3 a@indef_art soppe@n1 in@prep fin@adj clare@n1,and@conj thanne@adv he@pron1%nom taken@v%pr_3 a@indef_art soppe@n1 in@prep fin@adj clare@n1,
And upright in his bed thanne sitteth he,And upright in his bed than sitteth he,data/riverside_cats/MerT_riv.cat,data/oxford_txts/MerT_oxford.txt,data/csvs/MerT,The Merchant's Tale 1844,,10,10,And upright in his bed thanne sitteth he,And upright in his bed than sitteth he,u Su S u S ux Su S,u Su S u S u Su S,and@conj uprighte@adv in@prep his@pron1%gen bed@n1 thanne@adv sitten@v%pr_3 he@pron1%nom,and@conj uprighte@adv in@prep his@pron1%gen bed@n1 thanne@adv sitten@v%pr_3 he@pron1%nom,
And after that he sang ful loude and cleere,And after that he sang ful loude and clere,data/riverside_cats/MerT_riv.cat,data/oxford_txts/MerT_oxford.txt,data/csvs/MerT,The Merchant's Tale 1845,,10,10,And after that he sang ful loude and cleere,And after that he sang ful loude and clere,u Su S u S u Sx u Sx,u Su S u S u Sx u Sx,and@conj after@prep that@pron he@pron1%nom singen@v%pt_3 ful@adv loude@adv and@conj cler@adv,and@conj after@prep that@pron he@pron1%nom singen@v%pt_3 ful@adv loude@adv and@conj cler@adv,
"And kiste his wyf, and made wantown cheere.","And kiste his wif, and made wantoun chere.°",data/riverside_cats/MerT_riv.cat,data/oxford_txts/MerT_oxford.txt,data/csvs/MerT,The Merchant's Tale 1846,,10,10,And kiste his wyf and made wantown cheere,And kiste his wif and made wantoun chere,u Sx u S u Su Su Sx,u Sx u S u Su Su Sx,and@conj kissen@v%pt_3 his@pron1%gen wif@n and@conj maken@v1%pt_3 wantoun@adj chere@n1,and@conj kissen@v%pt_3 his@pron1%gen wif@n and@conj maken@v1%pt_3 wantoun@adj chere@n1,
"He was al coltissh, ful of ragerye","He was al coltish,° ful of ragerie,°",data/riverside_cats/MerT_riv.cat,data/oxford_txts/MerT_oxford.txt,data/csvs/MerT,The Merchant's Tale 1847,,0,10,He was al coltissh ful of ragerye,He was al coltish ful of ragerie,"      ",u S u Su S u SuS,he@pron1%nom ben@v%pt_3 al@adv coltish@adj ful@adj of@prep ragerie@n,he@pron1%nom ben@v%pt_3 al@adv coltish@adj ful@adj of@prep ragerie@n,
And ful of jargon as a flekked pye.,And ful of jargon° as a flekked pie.°,data/riverside_cats/MerT_riv.cat,data/oxford_txts/MerT_oxford.txt,data/csvs/MerT,The Merchant's Tale 1848,,10,10,And ful of jargon as a flekked pye,And ful of jargon as a flekked pie,u S u Su S u Su S,u S u Su S u Su S,and@conj ful@adj of@prep jargoun@n as@conj a@indef_art flekked@ppl#adj pie@n1,and@conj ful@adj of@prep jargoun@n as@conj a@indef_art flekked@ppl#adj pie@n1,
The slakke skyn aboute his nekke shaketh,The slakke skin aboute his nekke shaketh,data/riverside_cats/MerT_riv.cat,data/oxford_txts/MerT_oxford.txt,data/csvs/MerT,The Merchant's Tale 1849,,10,10,The slakke skyn aboute his nekke shaketh,The slakke skin aboute his nekke shaketh,u Su S uSx u Sx uS,u Su S uSx u Sx uS,the@def_art slak@adj skin@n1 abouten@prep his@pron1%gen nekke@n shaken@v%pr_3,the@def_art slak@adj skin@n1 abouten@prep his@pron1%gen nekke@n shaken@v%pr_3,
"Whil that he sang, so chaunteth he and craketh.",Whil that he sang; so chaunteth° he and craketh.°,data/riverside_cats/MerT_riv.cat,data/oxford_txts/MerT_oxford.txt,data/csvs/MerT,The Merchant's Tale 1850,,10,10,Whil that he sang so chaunteth he and craketh,Whil that he sang so chaunteth he and craketh,u S u S u Su S u Sx,u S u S u Su S u Sx,whil@conj that@part he@pron1%nom singen@v%pt_3 so@adv chaunten@v1%pr_3 he@pron1%nom and@conj craken@v%pr_3,whil@conj that@part he@pron1%nom singen@v%pt_3 so@adv chaunten@v1%pr_3 he@pron1%nom and@conj craken@v%pr_3,
But God woot what that May thoughte in hir herte,¶But God wot° what that° May thoughte in hir herte,data/riverside_cats/MerT_riv.cat,data/oxford_txts/MerT_oxford.txt,data/csvs/MerT,The Merchant's Tale 1851,,10,10,But God woot what that May thoughte in hir herte,But God wot what that May thoughte in hir herte,u S u S u S ux S u Sx,u S u S u S ux S u Sx,but@conj god@n1#propn witen@v1%pr_3 what@pron that@pron mai@n3#propn thinken@v2%pt_3 in@prep hire@pron1%fem_gen herte@n,but@conj god@n1#propn witen@v1%pr_3 what@pron that@pron mai@n3#propn thinken@v2%pt_3 in@prep hire@pron1%fem_gen herte@n,
Whan she hym saugh up sittynge in his sherte,Whan she him saugh up sittinge in his sherte,data/riverside_cats/MerT_riv.cat,data/oxford_txts/MerT_oxford.txt,data/csvs/MerT,The Merchant's Tale 1852,,10,10,Whan she hym saugh up sittynge in his sherte,Whan she him saugh up sittinge in his sherte,u x S u S uSu S u Sx,u x S u S uSu S u Sx,whan@adv&conj she@pron%nom him@pron%obj sen@v1%pt_3 up@adv sitten@v%prp_abs in@prep his@pron1%gen shirte@n,whan@adv&conj she@pron%nom him@pron%obj sen@v1%pt_3 up@adv sitten@v%prp_abs in@prep his@pron1%gen shirte@n,
"In his nyght-cappe, and with his nekke lene;","In his night cappe, and with his nekke lene;°",data/riverside_cats/MerT_riv.cat,data/oxford_txts/MerT_oxford.txt,data/csvs/MerT,The Merchant's Tale 1853,DIFF,10,10,In his nyghtcappe and with his nekke lene,In his night cappe and with his nekke lene,u S uSx u S u Su Sx,u S u Sx u S u Su Sx,in@prep his@pron1%gen night-cappe@n and@conj with@prep his@pron1%gen nekke@n lene@adj1,in@prep his@pron1%gen night@n cappe@n and@conj with@prep his@pron1%gen nekke@n lene@adj1,green
She preyseth nat his pleyyng worth a bene.,She preiseth nat his pleying worth a bene.°,data/riverside_cats/MerT_riv.cat,data/oxford_txts/MerT_oxford.txt,data/csvs/MerT,The Merchant's Tale 1854,,9,10,She preyseth nat his pleyyng worth a bene,She preiseth nat his pleying worth a bene,S uS u S u S u Sx,u Su S u Su S u Sx,she@pron%nom preisen@v%pr_3 not@adv his@pron1%gen pleiinge@ger worth@adj a@indef_art bene@n1,she@pron%nom preisen@v%pr_3 not@adv his@pron1%gen pleiinge@ger worth@adj a@indef_art bene@n1,
"Thanne seide he thus, """"My reste wol I take;","Than seide he thus, “My reste wol I take;",data/riverside_cats/MerT_riv.cat,data/oxford_txts/MerT_oxford.txt,data/csvs/MerT,The Merchant's Tale 1855,,10,10,Thanne seide he thus My reste wol I take,Than seide he thus My reste wol I take,ux Sx u S u Su S u Sx,u Sx u S u Su S u Sx,thanne@adv seien@v1%pt_3 he@pron1%nom thus@adv min@pron%gen reste@n1 willen@v%pr_1 ich@pron%nom taken@v%inf,thanne@adv seien@v1%pt_3 he@pron1%nom thus@adv min@pron%gen reste@n1 willen@v%pr_1 ich@pron%nom taken@v%inf,
"Now day is come, I may no lenger wake.","Now day is come, I may no lenger wake.”",data/riverside_cats/MerT_riv.cat,data/oxford_txts/MerT_oxford.txt,data/csvs/MerT,The Merchant's Tale 1856,,10,10,Now day is come I may no lenger wake,Now day is come I may no lenger wake,u S u Sx u S u Su Sx,u S u Sx u S u Su Sx,nou@conj dai@n ben@v%pr_3 comen@v%ppl ich@pron%nom mouen@v3%pr_1 no@adv lengere@adv%comp waken@v%inf,nou@conj dai@n ben@v%pr_3 comen@v%ppl ich@pron%nom mouen@v3%pr_1 no@adv lengere@adv%comp waken@v%inf,
And doun he leyde his heed and sleep til pryme.,"And doun he leide his heed, and sleep° til prime.°",data/riverside_cats/MerT_riv.cat,data/oxford_txts/MerT_oxford.txt,data/csvs/MerT,The Merchant's Tale 1857,,10,10,And doun he leyde his heed and sleep til pryme,And doun he leide his heed and sleep til prime,u S u Sx u S u S u Sx,u S u Sx u S u S u Sx,and@conj doun@adv he@pron1%nom leien@v1%pt_3 his@pron1%gen hed@n1 and@conj slepen@v%pt_3 til@prep prime@n,and@conj doun@adv he@pron1%nom leien@v1%pt_3 his@pron1%gen hed@n1 and@conj slepen@v%pt_3 til@prep prime@n,
"And afterward, whan that he saugh his tyme","And afterward, whan that he saugh his time,°",data/riverside_cats/MerT_riv.cat,data/oxford_txts/MerT_oxford.txt,data/csvs/MerT,The Merchant's Tale 1858,,10,10,And afterward whan that he saugh his tyme,And afterward whan that he saugh his time,u SuS u S u S u Sx,u SuS u S u S u Sx,and@conj after-ward@adv whan@adv&conj that@part he@pron1%nom sen@v1%pt_3 his@pron1%gen time@n,and@conj after-ward@adv whan@adv&conj that@part he@pron1%nom sen@v1%pt_3 his@pron1%gen time@n,
Up ryseth Januarie; but fresshe May,Up riseth Januarie; but fresshe May,data/riverside_cats/MerT_riv.cat,data/oxford_txts/MerT_oxford.txt,data/csvs/MerT,The Merchant's Tale 1859,,10,10,Up ryseth Januarie but fresshe May,Up riseth Januarie but fresshe May,u Su SuSu S ux S,u Su SuSu S ux S,up@adv risen@v%pr_3 januarie@n#propn but@conj fresh@adj mai@n3#propn,up@adv risen@v%pr_3 januarie@n#propn but@conj fresh@adj mai@n3#propn,
Heeld hire chambre unto the fourthe day,Holdeth hir° chambre unto the fourthe day,data/riverside_cats/MerT_riv.cat,data/oxford_txts/MerT_oxford.txt,data/csvs/MerT,The Merchant's Tale 1860,DIFF,10,10,Heeld hire chambre unto the fourthe day,Holdeth hir chambre unto the fourthe day,u Su Sx uS u Su S,uS u Sx uS u Su S,holden@v1%pt_3 hire@pron1%fem_gen chaumbre@n unto@prep the@def_art ferthe@num_adj dai@n,holden@v1%pr_3 hire@pron1%fem_gen chaumbre@n unto@prep the@def_art ferthe@num_adj dai@n,green
As usage is of wyves for the beste.,As usage° is of wives for the beste.,data/riverside_cats/MerT_riv.cat,data/oxford_txts/MerT_oxford.txt,data/csvs/MerT,The Merchant's Tale 1861,,10,10,As usage is of wyves for the beste,As usage is of wives for the beste,u Sux S u Su S u Sx,u Sux S u Su S u Sx,as@conj usage@n ben@v%pr_3 of@prep wif@n%pl for@prep the@def_art best@adjas_n%sup,as@conj usage@n ben@v%pr_3 of@prep wif@n%pl for@prep the@def_art best@adjas_n%sup,
For every labour somtyme moot han reste,"For every labour° somtime moot han reste,°",data/riverside_cats/MerT_riv.cat,data/oxford_txts/MerT_oxford.txt,data/csvs/MerT,The Merchant's Tale 1862,,10,10,For every labour somtyme moot han reste,For every labour somtime moot han reste,u SuS uS uSx u S xx,u SuS uS uSx u S xx,for@conj everi@pron_gram_adj labour@n som-time@adv moten@v2%pr_3 haven@v%inf reste@n1,for@conj everi@pron_gram_adj labour@n som-time@adv moten@v2%pr_3 haven@v%inf reste@n1,
Or elles longe may he nat endure;,Or elles longe may he nat endure;,data/riverside_cats/MerT_riv.cat,data/oxford_txts/MerT_oxford.txt,data/csvs/MerT,The Merchant's Tale 1863,,10,10,Or elles longe may he nat endure,Or elles longe may he nat endure,u Su Su S u S uSx,u Su Su S u S uSx,or@conj elles@adv longe@adv mouen@v3%pr_3 he@pron1%nom not@adv enduren@v%inf,or@conj elles@adv longe@adv mouen@v3%pr_3 he@pron1%nom not@adv enduren@v%inf,
"This is to seyn, no lyves creature","This is to seyn, no lives° creature",data/riverside_cats/MerT_riv.cat,data/oxford_txts/MerT_oxford.txt,data/csvs/MerT,The Merchant's Tale 1864,,10,10,This is to seyn no lyves creature,This is to seyn no lives creature,u S u S u Su SuSx,u S u S u Su SuSx,this@pron ben@v%pr_3 to@part seien@v1%inf no@gram_adj lif@n%gen creature@n,this@pron ben@v%pr_3 to@part seien@v1%inf no@gram_adj lif@n%gen creature@n,
"Be it of fyssh, or bryd, or beest, or man.","Be it of fish, or brid, or beest, or man.",data/riverside_cats/MerT_riv.cat,data/oxford_txts/MerT_oxford.txt,data/csvs/MerT,The Merchant's Tale 1865,,10,10,Be it of fyssh or bryd or beest or man,Be it of fish or brid or beest or man,u S u S u S u S u S,u S u S u S u S u S,ben@v%pr_3 hit@pron of@prep fish@n or@conj brid@n or@conj beste@n or@conj man@n,ben@v%pr_3 hit@pron of@prep fish@n or@conj brid@n or@conj beste@n or@conj man@n,
Now wol I speke of woful Damyan,¶Now wol I speke of woful Damian,data/riverside_cats/MerT_riv.cat,data/oxford_txts/MerT_oxford.txt,data/csvs/MerT,The Merchant's Tale 1866,,10,10,Now wol I speke of woful Damyan,Now wol I speke of woful Damian,u S u Sx u Su SuS,u S u Sx u Su SuS,nou@adv willen@v%pr_1 ich@pron%nom speken@v%inf of@prep woful@adj damian@n#propn,nou@adv willen@v%pr_1 ich@pron%nom speken@v%inf of@prep woful@adj damian@n#propn,
"That langwissheth for love, as ye shul heere;","That languissheth for love, as ye shul here;",data/riverside_cats/MerT_riv.cat,data/oxford_txts/MerT_oxford.txt,data/csvs/MerT,The Merchant's Tale 1867,DIFF,10,10,That langwissheth for love as ye shul heere,That languissheth for love as ye shul here,u SuS u Sx u S u Sx,u SuS u Sx u S u Sx,that@pron languishen@v%pr_3 for@prep love@n1 as@conj ye@pron%pl_nom shulen@v1%pr_pl heren@v%inf,that@pron languishen@v%pr_3 for@prep love@n1 as@conj ye@pron%pl_nom shulen@v1%pr_pl heren@v%inf,green
Therfore I speke to hym in this manere:,Therfore I speke to him in this manere:,data/riverside_cats/MerT_riv.cat,data/oxford_txts/MerT_oxford.txt,data/csvs/MerT,The Merchant's Tale 1868,,10,10,Therfore I speke to hym in this manere,Therfore I speke to him in this manere,uSx u Sx u S u S uSx,uSx u Sx u S u S uSx,ther-fore@adv ich@pron%nom speken@v%pr_1 to@prep him@pron%obj in@prep this@gram_adj manere@n,ther-fore@adv ich@pron%nom speken@v%pr_1 to@prep him@pron%obj in@prep this@gram_adj manere@n,
"I seye, """"O sely Damyan, allas!","I seye, “O sely° Damian, allas!",data/riverside_cats/MerT_riv.cat,data/oxford_txts/MerT_oxford.txt,data/csvs/MerT,The Merchant's Tale 1869,,10,10,I seye O sely Damyan allas,I seye O sely Damian allas,u S u Su SuS uS,u S u Su SuS uS,ich@pron%nom seien@v1%pr_1 o@interj seli@adj damian@n#propn alas@interj,ich@pron%nom seien@v1%pr_1 o@interj seli@adj damian@n#propn alas@interj,
"Andswere to my demaunde, as in this cas.","Answer to my demaunde,° as in this cas,°",data/riverside_cats/MerT_riv.cat,data/oxford_txts/MerT_oxford.txt,data/csvs/MerT,The Merchant's Tale 1870,DIFF,10,10,Andswere to my demaunde as in this cas,Answer to my demaunde as in this cas,uSx u S uSx u S u S,uS u S uSx u S u S,answeren@v%imp to@prep min@pron%gen demaunde@n as@conj in@prep this@gram_adj cas@n,answeren@v%inf to@prep min@pron%gen demaunde@n as@conj in@prep this@gram_adj cas@n,green
"How shaltow to thy lady, fresshe May",How shaltow° to thy lady fresshe May,data/riverside_cats/MerT_riv.cat,data/oxford_txts/MerT_oxford.txt,data/csvs/MerT,The Merchant's Tale 1871,,10,10,How shaltow to thy lady fresshe May,How shaltow to thy lady fresshe May,u Su S u Su Su S,u Su S u Su Su S,hou@adv&conj shulen@v1%pr_2_pron to@prep thin@pron%gen ladie@n fresh@adj mai@n3#propn,hou@adv&conj shulen@v1%pr_2_pron to@prep thin@pron%gen ladie@n fresh@adj mai@n3#propn,
Telle thy wo? She wole alwey seye nay.,Tell thy wo? She wole alwey seye ‘nay’;,data/riverside_cats/MerT_riv.cat,data/oxford_txts/MerT_oxford.txt,data/csvs/MerT,The Merchant's Tale 1872,,9,9,Telle thy wo She wole alwey seye nay,Tell thy wo She wole alwey seye nay,Sx u S u Sx uS u S,S u S u Sx uS u S,tellen@v%inf thin@pron%gen wo@n she@pron%nom willen@v%pr_3 al-wei@adv seien@v1%inf nai@interj#n,tellen@v%inf thin@pron%gen wo@n she@pron%nom willen@v%pr_3 al-wei@adv seien@v1%inf nai@interj#n,
