OG_RIV_TEXT,OG_OXFORD_TEXT,RIVERSIDE_FILENAME,OXFORD_FILENAME,OUTPUT_FILENAME,LINE_NUMBER,MATCH,RIVERSIDE_SYLLABLES,OXFORD_SYLLABLES,RIVERSIDE_TEXT,OXFORD_TEXT,RIVERSIDE_SCANSION,OXFORD_SCANSION,RIVERSIDE_TAGGING,OXFORD_TAGGING,FLAG_COLOR
Ye shul nat plesen hire fully yeres thre --,"Ye shul nat plese hir fully yeres three,°",data/riverside_cats/MerT_riv.cat,data/oxford_txts/MerT_oxford.txt,data/csvs/MerT,The Merchant's Tale 1562,DIFF,10,10,Ye shul nat plesen hire fully yeres thre,Ye shul nat plese hir fully yeres three,u S u Su Sx uS uSx x,u S u Sx u Su Sux S,ye@pron%pl_nom shulen@v1%pr_pl not@adv plesen@v%inf hire@pron2%fem_obj fulli@adv yer@n%pl thre@num_adj --@dash,ye@pron%pl_nom shulen@v1%pr_pl not@adv plesen@v%inf hire@pron2%fem_obj fulli@adv yer@n%pl thre@num_adj,green
"This is to seyn, to doon hire ful plesaunce.","This is to seyn, to doon hir ful plesaunce.°",data/riverside_cats/MerT_riv.cat,data/oxford_txts/MerT_oxford.txt,data/csvs/MerT,The Merchant's Tale 1563,,10,10,This is to seyn to doon hire ful plesaunce,This is to seyn to doon hir ful plesaunce,u S u S u S ux S uSx,u S u S u S u S uSx,this@pron ben@v%pr_3 to@part seien@v1%inf to@part don@v1%inf hire@pron2%fem_obj ful@adj plesaunce@n1,this@pron ben@v%pr_3 to@part seien@v1%inf to@part don@v1%inf hire@pron2%fem_obj ful@adj plesaunce@n1,
A wyf axeth ful many an observaunce.,A wif axeth° ful many an observaunce.°,data/riverside_cats/MerT_riv.cat,data/oxford_txts/MerT_oxford.txt,data/csvs/MerT,The Merchant's Tale 1564,,10,10,A wyf axeth ful many an observaunce,A wif axeth ful many an observaunce,u S uS u Sx u SuSx,u S uS u Sx u SuSx,a@indef_art wif@n asken@v%pr_3 ful@adv mani@gram_adj a@indef_art observaunce@n,a@indef_art wif@n asken@v%pr_3 ful@adv mani@gram_adj a@indef_art observaunce@n,
I prey yow that ye be nat yvele apayd.,I prey yow that ye be nat ivel apaid.”°,data/riverside_cats/MerT_riv.cat,data/oxford_txts/MerT_oxford.txt,data/csvs/MerT,The Merchant's Tale 1565,,0,0,I prey yow that ye be nat yvele apayd,I prey yow that ye be nat ivel apaid,"        ",u S u S u S u Sux uS,ich@pron%nom preien@v1%pr_1 you@pron%pl_obj that@conj ye@pron%pl_nom ben@v%pr_pl not@adv ivele@adv apaien@v%ppl,ich@pron%nom preien@v1%pr_1 you@pron%pl_obj that@conj ye@pron%pl_nom ben@v%pr_pl not@adv ivele@adv apaien@v%ppl,
"Wel,"""" quod this Januarie, """"and hastow ysayd?","¶“Wel,” quod this Januarie, “and hastow said?°",data/riverside_cats/MerT_riv.cat,data/oxford_txts/MerT_oxford.txt,data/csvs/MerT,The Merchant's Tale 1566,,0,0,Wel quod this Januarie and hastow ysayd,Wel quod this Januarie and hastow said,"      ",u S u SuSux u Su S,wel@adv#interj quethen@v%pt_3 this@gram_adj januarie@n#propn and@conj haven@v%pr_2_pron iseien@v%ppl,wel@adv#interj quethen@v%pt_3 this@gram_adj januarie@n#propn and@conj haven@v%pr_2_pron iseien@v%ppl,
"Straw for thy Senek, and for thy proverbes!","Straw for° thy Senek,° and for thy proverbes",data/riverside_cats/MerT_riv.cat,data/oxford_txts/MerT_oxford.txt,data/csvs/MerT,The Merchant's Tale 1567,,10,10,Straw for thy Senek and for thy proverbes,Straw for thy Senek and for thy proverbes,u S u Su S u S uSx,u S u Su S u S uSx,strau@n#interj for@prep thin@pron%gen senec@n#propn and@conj for@prep thin@pron%gen proverbe@n%pl,strau@n#interj for@prep thin@pron%gen senec@n#propn and@conj for@prep thin@pron%gen proverbe@n%pl,
I counte nat a panyer ful of herbes,I counte° nat a panier° ful of herbes°,data/riverside_cats/MerT_riv.cat,data/oxford_txts/MerT_oxford.txt,data/csvs/MerT,The Merchant's Tale 1568,,10,10,I counte nat a panyer ful of herbes,I counte nat a panier ful of herbes,u Sx u S uSu S u Sx,u Sx u S uSu S u Sx,ich@pron%nom counten@v%pr_1 not@adv a@indef_art paniere@n ful@adj of@prep herbe@n%pl,ich@pron%nom counten@v%pr_1 not@adv a@indef_art paniere@n ful@adj of@prep herbe@n%pl,
Of scole-termes. Wyser men than thow,Of scole-termes;° wiser men than thow,data/riverside_cats/MerT_riv.cat,data/oxford_txts/MerT_oxford.txt,data/csvs/MerT,The Merchant's Tale 1569,,10,10,Of scoletermes Wyser men than thow,Of scoletermes wiser men than thow,u SuSu Su S u S,u SuSu Su S u S,of@prep scole-termes@n%pl wise@adj%comp man@n%pl than@conj thou@pron%nom,of@prep scole-termes@n%pl wise@adj%comp man@n%pl than@conj thou@pron%nom,
"As thou hast herd, assenteden right now","As thou hast herd, assenteden° right now",data/riverside_cats/MerT_riv.cat,data/oxford_txts/MerT_oxford.txt,data/csvs/MerT,The Merchant's Tale 1570,,10,10,As thou hast herd assenteden right now,As thou hast herd assenteden right now,u S u S uSuS u S,u S u S uSuS u S,as@conj thou@pron%nom haven@v%pr_2 heren@v%ppl assenten@v%pt_pl righte@adv nou@adv,as@conj thou@pron%nom haven@v%pr_2 heren@v%ppl assenten@v%pt_pl righte@adv nou@adv,
"To my purpos. Placebo, what sey ye?","To my purpos; Placebo, what sey ye?”",data/riverside_cats/MerT_riv.cat,data/oxford_txts/MerT_oxford.txt,data/csvs/MerT,The Merchant's Tale 1571,,10,10,To my purpos Placebo what sey ye,To my purpos Placebo what sey ye,u S uS uSu S u S,u S uS uSu S u S,to@prep min@pron%gen purpos@n placebo@n2#propn what@pron seien@v1%pr_pl ye@pron%pl_nom,to@prep min@pron%gen purpos@n placebo@n2#propn what@pron seien@v1%pr_pl ye@pron%pl_nom,
"I seye it is a cursed man,"""" quod he","“I seye, it is a cursed man,” quod he",data/riverside_cats/MerT_riv.cat,data/oxford_txts/MerT_oxford.txt,data/csvs/MerT,The Merchant's Tale 1572,,10,10,I seye it is a cursed man quod he,I seye it is a cursed man quod he,u S u S u Su S u S,u S u S u Su S u S,ich@pron%nom seien@v1%pr_1 hit@pron ben@v%pr_3 a@indef_art cursed@ppl#adj man@n quethen@v%pt_3 he@pron1%nom,ich@pron%nom seien@v1%pr_1 hit@pron ben@v%pr_3 a@indef_art cursed@ppl#adj man@n quethen@v%pt_3 he@pron1%nom,
"That letteth matrimoigne, sikerly.","“That letteth° matrimoine, sikerly.”°",data/riverside_cats/MerT_riv.cat,data/oxford_txts/MerT_oxford.txt,data/csvs/MerT,The Merchant's Tale 1573,DIFF,10,10,That letteth matrimoigne sikerly,That letteth matrimoine sikerly,u Su SuSu SuS,u Su SuSu SuS,that@pron letten@v%pr_3 matrimoine@n sikerli@adv,that@pron letten@v%pr_3 matrimoine@n sikerli@adv,green
And with that word they rysen sodeynly,"And with that word they risen° sodeinly,°",data/riverside_cats/MerT_riv.cat,data/oxford_txts/MerT_oxford.txt,data/csvs/MerT,The Merchant's Tale 1574,,10,10,And with that word they rysen sodeynly,And with that word they risen sodeinly,u S u S u Su SuS,u S u S u Su SuS,and@conj with@prep that@art&gram_adj word@n thei@pron%pl_nom risen@v%pr_pl sodeinli@adv,and@conj with@prep that@art&gram_adj word@n thei@pron%pl_nom risen@v%pr_pl sodeinli@adv,
And been assented fully that he sholde,"And been assented° fully, that he sholde",data/riverside_cats/MerT_riv.cat,data/oxford_txts/MerT_oxford.txt,data/csvs/MerT,The Merchant's Tale 1575,,10,10,And been assented fully that he sholde,And been assented fully that he sholde,u S uSu Su S u Sx,u S uSu Su S u Sx,and@conj ben@v%pr_pl assenten@v%ppl fulli@adv that@art&gram_adj he@pron1%nom shulen@v1%pt_3,and@conj ben@v%pr_pl assenten@v%ppl fulli@adv that@art&gram_adj he@pron1%nom shulen@v1%pt_3,
Be wedded whanne hym liste and where he wolde.,Be wedded whanne him list° and wher° he wolde.,data/riverside_cats/MerT_riv.cat,data/oxford_txts/MerT_oxford.txt,data/csvs/MerT,The Merchant's Tale 1576,,10,10,Be wedded whanne hym liste and where he wolde,Be wedded whanne him list and wher he wolde,u Su Sx u Sx u Sx u Sx,u Su Sx u S u S u Sx,ben@v%inf wedden@v%ppl whan@adv&conj him@pron%obj listen@v1%pr_3 and@conj wher@adv&conj he@pron1%nom willen@v%pt_3,ben@v%inf wedden@v%ppl whan@adv&conj him@pron%obj listen@v1%pr_3 and@conj wher@adv&conj he@pron1%nom willen@v%pt_3,
Heigh fantasye and curious bisynesse,¶Heigh fantasie° and curious bisinesse°,data/riverside_cats/MerT_riv.cat,data/oxford_txts/MerT_oxford.txt,data/csvs/MerT,The Merchant's Tale 1577,,0,0,Heigh fantasye and curious bisynesse,Heigh fantasie and curious bisinesse,"    ",u SuS u Su SuS,heigh@adj fantasie@n and@conj curious@adj bisinesse@n,heigh@adj fantasie@n and@conj curious@adj bisinesse@n,
Fro day to day gan in the soule impresse,Fro day to day gan in the soule impresse°,data/riverside_cats/MerT_riv.cat,data/oxford_txts/MerT_oxford.txt,data/csvs/MerT,The Merchant's Tale 1578,,10,10,Fro day to day gan in the soule impresse,Fro day to day gan in the soule impresse,u S u S u S u Sx uSx,u S u S u S u Sx uSx,from@prep dai@n to@prep dai@n ginnen@v%pt_3 in@prep the@def_art soule@n impressen@v%inf,from@prep dai@n to@prep dai@n ginnen@v%pt_3 in@prep the@def_art soule@n impressen@v%inf,
Of Januarie aboute his mariage.,Of Januarie aboute his mariage.,data/riverside_cats/MerT_riv.cat,data/oxford_txts/MerT_oxford.txt,data/csvs/MerT,The Merchant's Tale 1579,,0,0,Of Januarie aboute his mariage,Of Januarie aboute his mariage,"    ",u SuSux uS u SuS,of@prep januarie@n#propn abouten@prep his@pron1%gen mariage@n,of@prep januarie@n#propn abouten@prep his@pron1%gen mariage@n,
Many fair shap and many a fair visage,"Many fair shap,° and many a fair visage°",data/riverside_cats/MerT_riv.cat,data/oxford_txts/MerT_oxford.txt,data/csvs/MerT,The Merchant's Tale 1580,,10,10,Many fair shap and many a fair visage,Many fair shap and many a fair visage,uS u S u Sx u S uSx,uS u S u Sx u S uSx,mani@gram_adj fair@adj shape@n and@conj mani@gram_adj a@indef_art fair@adj visage@n,mani@gram_adj fair@adj shape@n and@conj mani@gram_adj a@indef_art fair@adj visage@n,
Ther passeth thurgh his herte nyght by nyght,"Ther passeth thurgh his herte, night by night.",data/riverside_cats/MerT_riv.cat,data/oxford_txts/MerT_oxford.txt,data/csvs/MerT,The Merchant's Tale 1581,,10,10,Ther passeth thurgh his herte nyght by nyght,Ther passeth thurgh his herte night by night,u Su S u Su S u S,u Su S u Su S u S,ther@adv passen@v%pr_3 thurgh@prep his@pron1%gen herte@n night@n bi@prep night@n,ther@adv passen@v%pr_3 thurgh@prep his@pron1%gen herte@n night@n bi@prep night@n,
"As whoso tooke a mirour, polisshed bryght",As whoso° toke a mirour polished bright,data/riverside_cats/MerT_riv.cat,data/oxford_txts/MerT_oxford.txt,data/csvs/MerT,The Merchant's Tale 1582,,10,10,As whoso tooke a mirour polisshed bryght,As whoso toke a mirour polished bright,u Su Sx u Su Sux S,u Su Sx u Su Sux S,as@conj who-so@pron%nom taken@v%pt_3 a@indef_art mirour@n polishen@v%ppl_abs brighte@adv,as@conj who-so@pron%nom taken@v%pt_3 a@indef_art mirour@n polishen@v%ppl_abs brighte@adv,
And sette it in a commune market-place,And sette it in a commune° market-place,data/riverside_cats/MerT_riv.cat,data/oxford_txts/MerT_oxford.txt,data/csvs/MerT,The Merchant's Tale 1583,,10,10,And sette it in a commune marketplace,And sette it in a commune marketplace,u Sx u S u Sux SuSx,u Sx u S u Sux SuSx,and@conj setten@v%pt_3 hit@pron in@prep a@indef_art commune@adj market-place@n,and@conj setten@v%pt_3 hit@pron in@prep a@indef_art commune@adj market-place@n,
Thanne sholde he se ful many a figure pace,Than sholde he see many a figure pace°,data/riverside_cats/MerT_riv.cat,data/oxford_txts/MerT_oxford.txt,data/csvs/MerT,The Merchant's Tale 1584,DIFF,10,10,Thanne sholde he se ful many a figure pace,Than sholde he see many a figure pace,ux Sx u x S uS u Sux Sx,u Sx u S uS u Sux Sx,thanne@adv shulen@v1%pt_3 he@pron1%nom sen@v1%inf ful@adv mani@gram_adj a@indef_art figure@n passen@v%inf,thanne@adv shulen@v1%pt_3 he@pron1%nom sen@v1%inf mani@gram_adj a@indef_art figure@n passen@v%inf,green
By his mirour; and in the same wyse,"By his mirour; and, in the same wise,°",data/riverside_cats/MerT_riv.cat,data/oxford_txts/MerT_oxford.txt,data/csvs/MerT,The Merchant's Tale 1585,,10,10,By his mirour and in the same wyse,By his mirour and in the same wise,u S uS u S u Su Sx,u S uS u S u Su Sx,bi@prep his@pron1%gen mirour@n and@conj in@prep the@def_art same@gram_adj wise@n2,bi@prep his@pron1%gen mirour@n and@conj in@prep the@def_art same@gram_adj wise@n2,
Gan Januarie inwith his thoght devyse,Gan Januarie inwith° his thoght devise°,data/riverside_cats/MerT_riv.cat,data/oxford_txts/MerT_oxford.txt,data/csvs/MerT,The Merchant's Tale 1586,,0,0,Gan Januarie inwith his thoght devyse,Gan Januarie inwith his thoght devise,"     ",u SuSux uS u S uS,ginnen@v%pt_3 januarie@n#propn inwith@prep his@pron1%gen thought@n devisen@v%inf,ginnen@v%pt_3 januarie@n#propn inwith@prep his@pron1%gen thought@n devisen@v%inf,
Of maydens whiche that dwelten hym bisyde.,"Of maidens, whiche that° dwelten him biside.°",data/riverside_cats/MerT_riv.cat,data/oxford_txts/MerT_oxford.txt,data/csvs/MerT,The Merchant's Tale 1587,,10,10,Of maydens whiche that dwelten hym bisyde,Of maidens whiche that dwelten him biside,u Su Sx u Su S uSx,u Su Sx u Su S uSx,of@prep maiden@n%pl which@pron that@pron dwellen@v%pt_pl him@pron%obj bisides@prep,of@prep maiden@n%pl which@pron that@pron dwellen@v%pt_pl him@pron%obj bisides@prep,
He wiste nat wher that he myghte abyde.,He wiste° nat wher that he mighte abide.°,data/riverside_cats/MerT_riv.cat,data/oxford_txts/MerT_oxford.txt,data/csvs/MerT,The Merchant's Tale 1588,,10,10,He wiste nat wher that he myghte abyde,He wiste nat wher that he mighte abide,u Su S u S u Sx uSx,u Su S u S u Sx uSx,he@pron1%nom witen@v1%pt_3 not@adv wher@adv&conj that@part he@pron1%nom mouen@v3%pt_3 abiden@v%inf,he@pron1%nom witen@v1%pt_3 not@adv wher@adv&conj that@part he@pron1%nom mouen@v3%pt_3 abiden@v%inf,
For if that oon have beaute in hir face,For if that oon° have beaute in hir face,data/riverside_cats/MerT_riv.cat,data/oxford_txts/MerT_oxford.txt,data/csvs/MerT,The Merchant's Tale 1589,,10,10,For if that oon have beaute in hir face,For if that oon have beaute in hir face,u S u S ux Su S u Sx,u S u S ux Su S u Sx,for@conj if@conj that@part on@pron haven@v%pr_3 beaute@n in@prep hire@pron1%fem_gen face@n,for@conj if@conj that@part on@pron haven@v%pr_3 beaute@n in@prep hire@pron1%fem_gen face@n,
Another stant so in the peples grace,Another stant° so in the peples grace°,data/riverside_cats/MerT_riv.cat,data/oxford_txts/MerT_oxford.txt,data/csvs/MerT,The Merchant's Tale 1590,,10,10,Another stant so in the peples grace,Another stant so in the peples grace,uSu S u S u Su Sx,uSu S u S u Su Sx,another@pron stonden@v1%pr_3 so@adv in@prep the@def_art peple@n%gen grace@n,another@pron stonden@v1%pr_3 so@adv in@prep the@def_art peple@n%gen grace@n,
For hire sadnesse and hire benyngnytee,"For hir sadnesse,° and hir benignitee,°",data/riverside_cats/MerT_riv.cat,data/oxford_txts/MerT_oxford.txt,data/csvs/MerT,The Merchant's Tale 1591,DIFF,10,10,For hire sadnesse and hire benyngnytee,For hir sadnesse and hir benignitee,u Sx uSx u Sx uSuS,u S uSx u S uSuS,for@prep hire@pron1%fem_gen sadnesse@n and@conj hire@pron1%fem_gen benignite@n,for@prep hire@pron1%fem_gen sadnesse@n and@conj hire@pron1%fem_gen benignite@n,green
That of the peple grettest voys hath she;,That of the peple grettest vois° hath she.,data/riverside_cats/MerT_riv.cat,data/oxford_txts/MerT_oxford.txt,data/csvs/MerT,The Merchant's Tale 1592,,10,10,That of the peple grettest voys hath she,That of the peple grettest vois hath she,u S u Su Su S u S,u S u Su Su S u S,that@conj of@prep the@def_art peple@n gret@adj%sup voice@n haven@v%pr_3 she@pron%nom,that@conj of@prep the@def_art peple@n gret@adj%sup voice@n haven@v%pr_3 she@pron%nom,
And somme were riche and hadden badde name.,"And somme were riche, and hadden badde name.°",data/riverside_cats/MerT_riv.cat,data/oxford_txts/MerT_oxford.txt,data/csvs/MerT,The Merchant's Tale 1593,,10,10,And somme were riche and hadden badde name,And somme were riche and hadden badde name,u Sx ux Sx u Su Su Sx,u Sx ux Sx u Su Su Sx,and@conj som@pron ben@v%pt_pl riche@adj and@conj haven@v%pt_pl badde@adj name@n,and@conj som@pron ben@v%pt_pl riche@adj and@conj haven@v%pt_pl badde@adj name@n,
"But nathelees, bitwixe ernest and game","¶But nathelees, bitwixe ernest° and game,°",data/riverside_cats/MerT_riv.cat,data/oxford_txts/MerT_oxford.txt,data/csvs/MerT,The Merchant's Tale 1594,,10,10,But nathelees bitwixe ernest and game,But nathelees bitwixe ernest and game,u SuS uSx uS u Sx,u SuS uSx uS u Sx,but@conj no-the-lesse@adv bitwixe@prep ernest@n and@conj game@n,but@conj no-the-lesse@adv bitwixe@prep ernest@n and@conj game@n,
He atte laste apoynted hym on oon,He atte laste apointed him° on oon,data/riverside_cats/MerT_riv.cat,data/oxford_txts/MerT_oxford.txt,data/csvs/MerT,The Merchant's Tale 1595,,10,10,He atte laste apoynted hym on oon,He atte laste apointed him on oon,u Su Sx uSu S u S,u Su Sx uSu S u S,he@pron1%nom atte@prep laste@adj#n%sup appointen@v%pt_3 him@pron%obj on@prep on@pron,he@pron1%nom atte@prep laste@adj#n%sup appointen@v%pt_3 him@pron%obj on@prep on@pron,
And leet alle othere from his herte goon,And leet alle other° from his herte goon,data/riverside_cats/MerT_riv.cat,data/oxford_txts/MerT_oxford.txt,data/csvs/MerT,The Merchant's Tale 1596,,10,10,And leet alle othere from his herte goon,And leet alle other from his herte goon,u S ux Sux S u Su S,u S ux Su S u Su S,and@conj leten@v%pt_3 al@gram_adj other@pron from@prep his@pron1%gen herte@n gon@v%inf,and@conj leten@v%pt_3 al@gram_adj other@pron from@prep his@pron1%gen herte@n gon@v%inf,
And chees hire of his owene auctoritee;,And chees° hir of° his owene auctoritee;,data/riverside_cats/MerT_riv.cat,data/oxford_txts/MerT_oxford.txt,data/csvs/MerT,The Merchant's Tale 1597,,10,10,And chees hire of his owene auctoritee,And chees hir of his owene auctoritee,u S ux S u Sxx uSuS,u S u S u Sxx uSuS,and@conj chesen@v%pt_3 hire@pron2%fem_obj of@prep his@pron1%gen ouen@adj auctorite@n,and@conj chesen@v%pt_3 hire@pron2%fem_obj of@prep his@pron1%gen ouen@adj auctorite@n,
"For love is blynd alday, and may nat see.","For love is blind al day,° and may nat see.",data/riverside_cats/MerT_riv.cat,data/oxford_txts/MerT_oxford.txt,data/csvs/MerT,The Merchant's Tale 1598,DIFF,10,10,For love is blynd alday and may nat see,For love is blind al day and may nat see,u Sx u S uS u S u S,u Sx u S u S u S u S,for@conj love@n1 ben@v%pr_3 blind@adj al_dai@adv and@conj mouen@v3%pr_3 not@adv sen@v1%inf,for@conj love@n1 ben@v%pr_3 blind@adj and@conj dai@n and@conj mouen@v3%pr_3 not@adv sen@v1%inf,green
And whan that he was in his bed ybroght,"And whan that he was in° his bed ybroght,°",data/riverside_cats/MerT_riv.cat,data/oxford_txts/MerT_oxford.txt,data/csvs/MerT,The Merchant's Tale 1599,,10,10,And whan that he was in his bed ybroght,And whan that he was in his bed ybroght,u S u S u S u S uS,u S u S u S u S uS,and@conj whan@adv&conj that@part he@pron1%nom ben@v%pt_3 in@prep his@pron1%gen bed@n1 ibringen@v%ppl,and@conj whan@adv&conj that@part he@pron1%nom ben@v%pt_3 in@prep his@pron1%gen bed@n1 ibringen@v%ppl,
He purtreyed in his herte and in his thoght,"He purtreied,° in his herte and in his thoght",data/riverside_cats/MerT_riv.cat,data/oxford_txts/MerT_oxford.txt,data/csvs/MerT,The Merchant's Tale 1600,,0,0,He purtreyed in his herte and in his thoght,He purtreied in his herte and in his thoght,"        ",u Su S u S u S u S,he@pron1%nom portraien@v%pt_3 in@prep his@pron1%gen herte@n and@conj in@prep his@pron1%gen thought@n,he@pron1%nom portraien@v%pt_3 in@prep his@pron1%gen herte@n and@conj in@prep his@pron1%gen thought@n,
Hir fresshe beautee and hir age tendre,Hir fresshe beautee and hir age tendre,data/riverside_cats/MerT_riv.cat,data/oxford_txts/MerT_oxford.txt,data/csvs/MerT,The Merchant's Tale 1601,,10,10,Hir fresshe beautee and hir age tendre,Hir fresshe beautee and hir age tendre,u Su Su S u Su Sx,u Su Su S u Su Sx,hire@pron1%fem_gen fresh@adj beaute@n and@conj hire@pron1%fem_gen age@n tender@adj,hire@pron1%fem_gen fresh@adj beaute@n and@conj hire@pron1%fem_gen age@n tender@adj,
"Hir myddel smal, hire armes longe and sklendre","Hir middel° smal, hir armes longe and sclendre,°",data/riverside_cats/MerT_riv.cat,data/oxford_txts/MerT_oxford.txt,data/csvs/MerT,The Merchant's Tale 1602,,10,10,Hir myddel smal hire armes longe and sklendre,Hir middel smal hir armes longe and sclendre,u Su S ux Su Sx u Sx,u Su S u Su Sx u Sx,hire@pron1%fem_gen middel@n smal@adj hire@pron1%fem_gen arm@n%pl long@adj1 and@conj sclendre@adj,hire@pron1%fem_gen middel@n smal@adj hire@pron1%fem_gen arm@n%pl long@adj1 and@conj sclendre@adj,
"Hir wise governaunce, hir gentillesse","Hir wise governaunce,° hir gentillesse,°",data/riverside_cats/MerT_riv.cat,data/oxford_txts/MerT_oxford.txt,data/csvs/MerT,The Merchant's Tale 1603,,10,10,Hir wise governaunce hir gentillesse,Hir wise governaunce hir gentillesse,u Su SuSx u SuSx,u Su SuSx u SuSx,hire@pron1%fem_gen wise@adj governaunce@n hire@pron1%fem_gen gentilesse@n,hire@pron1%fem_gen wise@adj governaunce@n hire@pron1%fem_gen gentilesse@n,
"Hir wommanly berynge, and hire sadnesse.",Hir wommanly beringe and hir sadnesse.°,data/riverside_cats/MerT_riv.cat,data/oxford_txts/MerT_oxford.txt,data/csvs/MerT,The Merchant's Tale 1604,,10,10,Hir wommanly berynge and hire sadnesse,Hir wommanly beringe and hir sadnesse,u SuS uSx u Sx uSx,u SuS uSx u S uSx,hire@pron1%fem_gen wommanli@adj bering@ger and@conj hire@pron1%fem_gen sadnesse@n,hire@pron1%fem_gen wommanli@adj bering@ger and@conj hire@pron1%fem_gen sadnesse@n,
And whan that he on hire was condescended,"And whan that he on hir was condescended,°",data/riverside_cats/MerT_riv.cat,data/oxford_txts/MerT_oxford.txt,data/csvs/MerT,The Merchant's Tale 1605,,10,10,And whan that he on hire was condescended,And whan that he on hir was condescended,u S u S u Sx u SuSx,u S u S u S u SuSx,and@conj whan@adv&conj that@part he@pron1%nom on@prep hire@pron2%fem_obj ben@v%pt_3 condescenden@v%ppl,and@conj whan@adv&conj that@part he@pron1%nom on@prep hire@pron2%fem_obj ben@v%pt_3 condescenden@v%ppl,
Hym thoughte his choys myghte nat ben amended.,Him thoughte his chois ne might nat ben amended.°,data/riverside_cats/MerT_riv.cat,data/oxford_txts/MerT_oxford.txt,data/csvs/MerT,The Merchant's Tale 1606,DIFF,10,10,Hym thoughte his choys myghte nat ben amended,Him thoughte his chois ne might nat ben amended,u Sx u S ux S u SuS,u Sx u S u S u S uSx,him@pron%obj thinken@v1%pt_3 his@pron1%gen chois@n mouen@v3%pt_3 not@adv ben@v%inf amenden@v%ppl,him@pron%obj thinken@v1%pt_3 his@pron1%gen chois@n ne@adv mouen@v3%pt_3 not@adv ben@v%inf amenden@v%ppl,green
For whan that he hymself concluded hadde,For whan that° he himself concluded hadde,data/riverside_cats/MerT_riv.cat,data/oxford_txts/MerT_oxford.txt,data/csvs/MerT,The Merchant's Tale 1607,,10,10,For whan that he hymself concluded hadde,For whan that he himself concluded hadde,u S u S uS uSu Sx,u S u S uS uSu Sx,for@conj whan@adv&conj that@part he@pron1%nom him-self@pron concluden@v%ppl haven@v%pt_3,for@conj whan@adv&conj that@part he@pron1%nom him-self@pron concluden@v%ppl haven@v%pt_3,
Hym thoughte ech oother mannes wit so badde,Him thoughte ech° other mannes wit° so badde,data/riverside_cats/MerT_riv.cat,data/oxford_txts/MerT_oxford.txt,data/csvs/MerT,The Merchant's Tale 1608,,10,10,Hym thoughte ech oother mannes wit so badde,Him thoughte ech other mannes wit so badde,u Sx u Su Su S u Sx,u Sx u Su Su S u Sx,him@pron%obj thinken@v1%pt_3 ech@pron_gram_adj other@gram_adj man@n%gen wit@n so@adv badde@adj,him@pron%obj thinken@v1%pt_3 ech@pron_gram_adj other@gram_adj man@n%gen wit@n so@adv badde@adj,
That inpossible it were to repplye,That inpossible it were to replie,data/riverside_cats/MerT_riv.cat,data/oxford_txts/MerT_oxford.txt,data/csvs/MerT,The Merchant's Tale 1609,,0,10,That inpossible it were to repplye,That inpossible it were to replie,"     ",u SuSx u Su S uS,that@conj impossible@adj hit@pron ben@v%pt_3 to@part replien@v1%inf,that@conj impossible@adj hit@pron ben@v%pt_3 to@part replien@v1%inf,
Agayn his choys; this was his fantasye.,"Again° his chois, this was his fantasie.°",data/riverside_cats/MerT_riv.cat,data/oxford_txts/MerT_oxford.txt,data/csvs/MerT,The Merchant's Tale 1610,,0,10,Agayn his choys this was his fantasye,Again his chois this was his fantasie,"      ",uS u S u S u SuS,ayen@prep his@pron1%gen chois@n this@pron ben@v%pt_3 his@pron1%gen fantasie@n,ayen@prep his@pron1%gen chois@n this@pron ben@v%pt_3 his@pron1%gen fantasie@n,
"His freendes sente he to, at his instaunce","¶His freendes sente he to° at his instaunce,°",data/riverside_cats/MerT_riv.cat,data/oxford_txts/MerT_oxford.txt,data/csvs/MerT,The Merchant's Tale 1611,,10,10,His freendes sente he to at his instaunce,His freendes sente he to at his instaunce,u Su Sx u S u S uSx,u Su Sx u S u S uSx,his@pron1%gen frend@n%pl senden@v2%pt_3 he@pron1%nom to@prep at@prep his@pron1%gen instaunce@n,his@pron1%gen frend@n%pl senden@v2%pt_3 he@pron1%nom to@prep at@prep his@pron1%gen instaunce@n,
And preyed hem to doon hym that plesaunce,"And preyed hem to doon him that plesaunce,°",data/riverside_cats/MerT_riv.cat,data/oxford_txts/MerT_oxford.txt,data/csvs/MerT,The Merchant's Tale 1612,,10,10,And preyed hem to doon hym that plesaunce,And preyed hem to doon him that plesaunce,u Su S u S u S uSx,u Su S u S u S uSx,and@conj preien@v1%pt_3 hem@pron%pl_obj to@part don@v1%inf him@pron%obj that@art&gram_adj plesaunce@n1,and@conj preien@v1%pt_3 hem@pron%pl_obj to@part don@v1%inf him@pron%obj that@art&gram_adj plesaunce@n1,
That hastily they wolden to hym come;,That hastily they wolden to him come;,data/riverside_cats/MerT_riv.cat,data/oxford_txts/MerT_oxford.txt,data/csvs/MerT,The Merchant's Tale 1613,,10,10,That hastily they wolden to hym come,That hastily they wolden to him come,u SuS u Su S u Sx,u SuS u Su S u Sx,that@conj hastilie@adv thei@pron%pl_nom willen@v%pt_pl to@prep him@pron%obj comen@v%inf,that@conj hastilie@adv thei@pron%pl_nom willen@v%pt_pl to@prep him@pron%obj comen@v%inf,
