FILENAME,LINE_NUMBER,OG_TEXT,TEXT,NUM_SYBS,SCANSION,TAGGING
gow/05/139-gow.cat,139-gow3937,"Togedre ben these lovers tho,",Togedre ben these lovers tho,8,uSx u Su Su S,togeder@adv ben@v%pr_pl these@gram_adj%pl lovere@n2%pl tho@adv
gow/05/139-gow.cat,139-gow3938,"Til that thei hadden sones tuo,",Til that thei hadden sones tuo,8,u S u Su Su S,til@conj that@part thei@pron%pl_nom haven@v%pt_pl sone@n%pl two@num_adj
gow/05/139-gow.cat,139-gow3939,"Wherof thei weren bothe glade,",Wherof thei weren bothe glade,8,uS u Su Su Sx,wher-of@adv thei@pron%pl_nom ben@v%pt_pl bothe@num_adj glad@adj
gow/05/139-gow.cat,139-gow3940,And olde Eson gret joie made,And olde Eson gret joie made,8,u Su Su S u Sx,and@conj olde@adj eson@n#propn gret@adj joie@n maken@v1%pt_3
gow/05/139-gow.cat,139-gow3941,To sen thencress of his lignage;,To sen thencress of his lignage,8,u S uS u S uSx,to@part sen@v1%inf encres@n of@prep his@pron1%gen linage@n
gow/05/139-gow.cat,139-gow3942,"For he was of so gret an Age,",For he was of so gret an Age,8,u S u S u S u Sx,for@conj he@pron1%nom ben@v%pt_3 of@prep so@adv gret@adj a@indef_art age@n
gow/05/139-gow.cat,139-gow3943,"That men awaiten every day,",That men awaiten every day,8,u S uSu Sxu S,that@conj man@n%pl awaiten@v%pr_pl everi@pron_gram_adj dai@n
gow/05/139-gow.cat,139-gow3944,Whan that he scholde gon away.,Whan that he scholde gon away,8,u S u Su S uS,whan@adv&conj that@part he@pron1%nom shulen@v1%pt_3 gon@v%inf awei@adv
gow/05/139-gow.cat,139-gow3945,"Jason, which sih his fader old,",Jason which sih his fader old,8,uS u S u Su S,jason@n#propn which@pron sen@v1%pt_3 his@pron1%gen fader@n olde@adj
gow/05/139-gow.cat,139-gow3946,"Upon Medea made him bold,",Upon Medea made him bold,8,uS uSu Sx u S,upon@prep medea@n#propn maken@v1%pt_3 him@pron%obj bold@adj
gow/05/139-gow.cat,139-gow3947,"Of art magique, which sche couthe,",Of art magique which sche couthe,8,u S uSu S u Sx,of@prep art@n1 magik@adj which@pron she@pron%nom connen@v%pt_3
gow/05/139-gow.cat,139-gow3948,And preith hire that his fader youthe,And preith hire that his fader youthe,8,u S ux S u Su Sx,and@conj preien@v1%pr_3 hire@pron2%fem_obj that@conj his@pron1%gen fader@n youth@n
gow/05/139-gow.cat,139-gow3949,Sche wolde make ayeinward newe:,Sche wolde make ayeinward newe,8,u Su Sx uSu Sx,she@pron%nom willen@v%pt_3 maken@v1%inf ayen-ward@adv neue@adj
gow/05/139-gow.cat,139-gow3950,"And sche, that was toward him trewe,",And sche that was toward him trewe,8,u S u S uS u Sx,and@conj she@pron%nom that@pron ben@v%pt_3 towarde@prep him@pron%obj treu@adj
gow/05/139-gow.cat,139-gow3951,"Behihte him that sche wolde it do,",Behihte him that sche wolde it do,8,uSx u S u Sx u S,bihoten@v%pt_3 him@pron%obj that@conj she@pron%nom willen@v%pt_3 hit@pron don@v1%inf
gow/05/139-gow.cat,139-gow3952,Whan that sche time sawh therto.,Whan that sche time sawh therto,8,u S u Su S uS,whan@adv&conj that@part she@pron%nom time@n sen@v1%pt_3 ther-to@adv
gow/05/139-gow.cat,139-gow3953,Bot what sche dede in that matiere,Bot what sche dede in that matiere,8,u S x ux S u SuSx,but@conj what@pron she@pron%nom don@v1%pt_3 in@prep that@art&gram_adj matere@n
gow/05/139-gow.cat,139-gow3954,"It is a wonder thing to hiere,",It is a wonder thing to hiere,8,u S u Sx u S uSx,hit@pron ben@v%pr_3 a@indef_art wonder@adj thing@n to@part heren@v%inf
gow/05/139-gow.cat,139-gow3955,Bot yit for the novellerie,Bot yit for the novellerie,8,u S u S uSuS,but@conj yet@adv for@prep the@def_art novelrie@n
gow/05/139-gow.cat,139-gow3956,I thenke tellen a partie.,I thenke tellen a partie,8,u Su Su S uS,ich@pron%nom thinken@v2%pr_1 tellen@v%inf a@indef_art partie@n
gow/05/139-gow.cat,139-gow3957,"Thus it befell upon a nyht,",Thus it befell upon a nyht,8,u S uS uS u S,thus@adv hit@pron bifallen@v%pt_3 upon@prep a@indef_art night@n
gow/05/139-gow.cat,139-gow3958,"Whan ther was noght bot sterreliht,",Whan ther was noght bot sterreliht,8,u S u S u SuS,whan@adv&conj ther@adv ben@v%pt_3 nought@pron but@conj sterre-light@n
gow/05/139-gow.cat,139-gow3959,"Sche was vanyssht riht as hir liste,",Sche was vanyssht riht as hir liste,8,u S uS u S u Sx,she@pron%nom ben@v%pt_3 vanishen@v%ppl righte@adv as@conj hire@pron2%fem_obj listen@v2%pr_3
gow/05/139-gow.cat,139-gow3960,"That no wyht bot hirself it wiste,",That no wyht bot hirself it wiste,8,u S u S uS u Sx,that@conj no@gram_adj wight@n but@conj hire-self@pron hit@pron witen@v1%pt_3
gow/05/139-gow.cat,139-gow3961,And that was ate mydnyht tyde.,And that was ate mydnyht tyde,8,u S u Su Su Sx,and@conj that@pron ben@v%pt_3 atte@prep mid-night@n tide@n
gow/05/139-gow.cat,139-gow3962,The world was stille on every side;,The world was stille on every side,8,u S u Sx u Sxu Sx,the@def_art world@n ben@v%pt_3 stille@adj on@prep everi@pron_gram_adj side@n
gow/05/139-gow.cat,139-gow3963,"With open hed and fot al bare,",With open hed and fot al bare,8,u Su S u S u Sx,with@prep open@adj hed@n1 and@conj fot@n al@adv bar@adj
gow/05/139-gow.cat,139-gow3964,"Hir her tosprad sche gan to fare,",Hir her tosprad sche gan to fare,8,u S uS u S u Sx,hire@pron1%fem_gen her@n tospreden@v%ppl_abs she@pron%nom ginnen@v%pt_3 to@part faren@v%inf
gow/05/139-gow.cat,139-gow3965,"Upon hir clothes gert sche was,",Upon hir clothes gert sche was,8,uS u Su S u S,upon@prep hire@pron1%fem_gen cloth@n%pl girden@v1%ppl she@pron%nom ben@v%pt_3
gow/05/139-gow.cat,139-gow3966,Al specheles and on the gras,Al specheles and on the gras,8,u SuS u S u S,al@adv specheles@adj and@conj on@prep the@def_art gras@n
gow/05/139-gow.cat,139-gow3967,Sche glod forth as an Addre doth:,Sche glod forth as an Addre doth,8,u S u S u Su S,she@pron%nom gliden@v%pt_3 forth@adv as@conj a@indef_art naddre@n don@v1%pr_3
gow/05/139-gow.cat,139-gow3968,"Non otherwise sche ne goth,",Non otherwise sche ne goth,8,u SuSu S u S,non@adv1 other-wise@adv she@pron%nom ne@adv gon@v%pr_3
gow/05/139-gow.cat,139-gow3969,"Til sche cam to the freisshe flod,",Til sche cam to the freisshe flod,8,u S u S u Su S,til@conj she@pron%nom comen@v%pt_3 to@prep the@def_art fresh@adj flod@n
gow/05/139-gow.cat,139-gow3970,And there a while sche withstod.,And there a while sche withstod,8,u Sx u Su S uS,and@conj ther@adv a@indef_art whil@n she@pron%nom withstonden@v%pt_3
gow/05/139-gow.cat,139-gow3971,"Thries sche torned hire aboute,",Thries sche torned hire aboute,8,uS u Su Sx uSx,thrice@adv she@pron%nom turnen@v%pt_3 hire@pron2%fem_obj abouten@adv
gow/05/139-gow.cat,139-gow3972,And thries ek sche gan doun loute,And thries ek sche gan doun loute,8,u Su S u S u Sx,and@conj thrice@adv ek@adv she@pron%nom ginnen@v%pt_3 doun@adv louten@v1%inf
gow/05/139-gow.cat,139-gow3973,"And in the flod sche wette hir her,",And in the flod sche wette hir her,8,u S u S u Sx u S,and@conj in@prep the@def_art flod@n she@pron%nom weten@v%pt_3 hire@pron1%fem_gen her@n
gow/05/139-gow.cat,139-gow3974,And thries on the water ther,And thries on the water ther,8,u Su S u Su S,and@conj thrice@adv on@prep the@def_art water@n ther@adv
gow/05/139-gow.cat,139-gow3975,"Sche gaspeth with a drecchinge onde,",Sche gaspeth with a drecchinge onde,8,x uS u S uSu Sx,she@pron%nom gaspen@v%pr_3 with@prep a@indef_art drecchen@v#adj%prp onde@n2
gow/05/139-gow.cat,139-gow3976,And tho sche tok hir speche on honde.,And tho sche tok hir speche on honde,8,u S u S u Sx u Sx,and@conj tho@adv she@pron%nom taken@v%pt_3 hire@pron1%fem_gen speche@n on@prep honde@n
gow/05/139-gow.cat,139-gow3977,Ferst sche began to clepe and calle,Ferst sche began to clepe and calle,8,u S uS u Sx u Sx,first@adv she@pron%nom biginnen@v%pt_3 to@part clepen@v%inf and@conj callen@v%inf
gow/05/139-gow.cat,139-gow3978,"Upward unto the sterres alle,",Upward unto the sterres alle,8,uS uS u Su Sx,upward@adv unto@prep the@def_art sterre@n%pl al@gram_adj
gow/05/139-gow.cat,139-gow3979,"To Wynd, to Air, to See, to lond",To Wynd to Air to See to lond,8,u S u S u S u S,to@prep wind@n1 to@prep air@n1 to@prep se@n1 to@prep lond@n
gow/05/139-gow.cat,139-gow3980,"Sche preide, and ek hield up hir hond",Sche preide and ek hield up hir hond,8,u Sx u S u S u S,she@pron%nom preien@v1%pt_3 and@conj ek@adv holden@v1%pt_3 up@adv hire@pron1%fem_gen honde@n
gow/05/139-gow.cat,139-gow3981,"To Echates, and gan to crie,",To Echates and gan to crie,8,u SuS u S u S,to@prep echates@n#propn and@conj ginnen@v%pt_3 to@part crien@v%inf
gow/05/139-gow.cat,139-gow3982,Which is goddesse of Sorcerie.,Which is goddesse of Sorcerie,8,u S uSx u SuS,which@pron ben@v%pr_3 goddesse@n of@prep sorcerie@n
gow/05/139-gow.cat,139-gow3983,"Sche seide, ""Helpeth at this nede,",Sche seide Helpeth at this nede,8,u Su Su S u Sx,she@pron%nom seien@v1%pt_3 helpen@v%imp at@prep this@gram_adj nede@n1
gow/05/139-gow.cat,139-gow3984,"And as ye maden me to spede,",And as ye maden me to spede,8,u S u Su S u Sx,and@conj as@conj ye@pron%pl_nom maken@v1%pt_pl me@pron2%obj to@part speden@v%inf
gow/05/139-gow.cat,139-gow3985,"Whan Jason cam the Flees to seche,",Whan Jason cam the Flees to seche,8,u Su S u S u Sx,whan@adv&conj jason@n#propn comen@v%pt_3 the@def_art fles@n to@part sechen@v%inf
gow/05/139-gow.cat,139-gow3986,"So help me nou, I you beseche.""",So help me nou I you beseche,8,u S u S u S uSx,so@adv helpen@v%imp me@pron2%obj nou@adv ich@pron%nom you@pron%pl_obj bisechen@v%pr_1
gow/05/139-gow.cat,139-gow3987,"With that sche loketh and was war,",With that sche loketh and was war,8,u S u Su S u S,with@prep that@pron she@pron%nom loken@v2%pr_3 and@conj ben@v%pt_3 ware@adj
gow/05/139-gow.cat,139-gow3988,"Doun fro the Sky ther cam a char,",Doun fro the Sky ther cam a char,8,u S u S u S u S,doun@adv from@prep the@def_art skie@n ther@adv comen@v%pt_3 a@indef_art char@n2
gow/05/139-gow.cat,139-gow3989,The which Dragouns aboute drowe:,The which Dragouns aboute drowe,8,u S uS uSu Sx,the@def_art which@pron dragoun@n%pl abouten@adv drauen@v%pt_pl
gow/05/139-gow.cat,139-gow3990,"And tho sche gan hir hed doun bowe,",And tho sche gan hir hed doun bowe,8,u S u S u S u Sx,and@conj tho@adv she@pron%nom ginnen@v%pt_3 hire@pron1%fem_gen hed@n1 doun@adv bouen@v1%inf
gow/05/139-gow.cat,139-gow3991,"And up sche styh, and faire and wel",And up sche styh and faire and wel,8,u S u S u Sx u S,and@conj up@adv she@pron%nom stien@v%pt_3 and@conj faire@adv and@conj wel@adv
gow/05/139-gow.cat,139-gow3992,Sche drof forth bothe char and whel,Sche drof forth bothe char and whel,8,u S u Su S u S,she@pron%nom driven@v%pt_3 forth@adv bothe@num_conj char@n2 and@conj whel@n
gow/05/139-gow.cat,139-gow3993,Above in thair among the Skyes.,Above in thair among the Skyes,0,     ,aboven@adv in@prep air@n1 amonges@prep the@def_art skie@n%pl
gow/05/139-gow.cat,139-gow3994,The lond of Crete and tho parties,The lond of Crete and tho parties,0,      ,the@def_art lond@n of@prep crete@n#propn and@conj tho@gram_adj partie@n%pl
gow/05/139-gow.cat,139-gow3995,"Sche soughte, and faste gan hire hye,",Sche soughte and faste gan hire hye,8,u Sx u Sx u Su S,she@pron%nom sechen@v%pt_3 and@conj faste@adv ginnen@v%pt_3 hire@pron2%fem_obj hien@v%inf
gow/05/139-gow.cat,139-gow3996,And there upon the hulles hyhe,And there upon the hulles hyhe,8,u Sx uS u Su Sx,and@conj ther@adv upon@prep the@def_art hille@n%pl heigh@adj
gow/05/139-gow.cat,139-gow3997,"Of Othrin and Olimpe also,",Of Othrin and Olimpe also,8,u Su S uSx uS,of@prep othrin@n#propn and@conj olimpe@n#propn also@adv
gow/05/139-gow.cat,139-gow3998,"And ek of othre hulles mo,",And ek of othre hulles mo,8,u S u Su Su S,and@conj ek@adv of@prep other@gram_adj hille@n%pl mo@adj
gow/05/139-gow.cat,139-gow3999,"Sche fond and gadreth herbes suote,",Sche fond and gadreth herbes suote,8,u S u Su Su Sx,she@pron%nom finden@v%pt_3 and@conj gaderen@v%pr_3 herbe@n%pl sote@adj
gow/05/139-gow.cat,139-gow4000,"Sche pulleth up som be the rote,",Sche pulleth up som be the rote,8,u Su S u S u Sx,she@pron%nom pullen@v%pr_3 up@adv som@pron bi@prep the@def_art rote@n4
gow/05/139-gow.cat,139-gow4001,"And manye with a knyf sche scherth,",And manye with a knyf sche scherth,8,u Su S u S u S,and@conj mani@n with@prep a@indef_art knif@n she@pron%nom sheren@v%pr_3
gow/05/139-gow.cat,139-gow4002,And alle into hir char sche berth.,And alle into hir char sche berth,8,u Sx uS u S u S,and@conj al@gram_adjas_n in-to@prep hire@pron1%fem_gen char@n2 she@pron%nom beren@v1%pr_3
gow/05/139-gow.cat,139-gow4003,"Thus whan sche hath the hulles sought,",Thus whan sche hath the hulles sought,8,u S u S u Su S,thus@adv whan@adv&conj she@pron%nom haven@v%pr_3 the@def_art hille@n%pl sechen@v%ppl
gow/05/139-gow.cat,139-gow4004,"The flodes ther foryat sche nought,",The flodes ther foryat sche nought,8,u Su S uSu x S,the@def_art flod@n%pl ther@adv foryeten@v%pt_3 she@pron%nom nought@adv
gow/05/139-gow.cat,139-gow4005,"Eridian and Amphrisos,",Eridian and Amphrisos,8,uSuS u SuS,eridian@n#propn and@conj amphrisos@n#propn
gow/05/139-gow.cat,139-gow4006,"Peneie and ek Spercheidos,",Peneie and ek Spercheidos,7,Su S u SuS,peneie@n#propn and@conj ek@adv spercheidos@n#propn
gow/05/139-gow.cat,139-gow4007,To hem sche wente and ther sche nom,To hem sche wente and ther sche nom,8,u S u Sx u S u S,to@prep hem@pron%pl_obj she@pron%nom wenden@v%pt_3 and@conj ther@adv she@pron%nom nimen@v%pt_3
gow/05/139-gow.cat,139-gow4008,"Bothe of the water and the fom,",Bothe of the water and the fom,8,ux S u Su S u S,bothe@num_conj of@prep the@def_art water@n and@conj the@def_art fom@n
gow/05/139-gow.cat,139-gow4009,"The sond and ek the smale stones,",The sond and ek the smale stones,8,u S u S u Sx uS,the@def_art sand@n and@conj ek@adv the@def_art smal@adj ston@n%pl
gow/05/139-gow.cat,139-gow4010,"Whiche as sche ches out for the nones,",Whiche as sche ches out for the nones,8,ux S x u S u S uS,which@pron as@conj she@pron%nom chesen@v%pt_3 oute@adv for@prep the@def_art nones@n1
gow/05/139-gow.cat,139-gow4011,"And of the rede See a part,",And of the rede See a part,8,u S u Su S u S,and@conj of@prep the@def_art red@adj se@n1 a@indef_art part@n
gow/05/139-gow.cat,139-gow4012,"That was behovelich to hire art,",That was behovelich to hire art,8,u S uSuS x ux S,that@pron ben@v%pt_3 bihoveli@adj to@prep hire@pron1%fem_gen art@n1
gow/05/139-gow.cat,139-gow4013,"Sche tok, and after that aboute",Sche tok and after that aboute,8,u S u Su S uSx,she@pron%nom taken@v%pt_3 and@conj after@prep that@pron abouten@adv
gow/05/139-gow.cat,139-gow4014,Sche soughte sondri sedes oute,Sche soughte sondri sedes oute,8,u Su Su Su Sx,she@pron%nom sechen@v%pt_3 sondri@adj sed@n%pl oute@adv
gow/05/139-gow.cat,139-gow4015,"In feldes and in many greves,",In feldes and in many greves,8,u Su S u Su Sx,in@prep feld@n%pl and@conj in@prep mani@gram_adj greve@n1%pl
gow/05/139-gow.cat,139-gow4016,And ek a part sche tok of leves:,And ek a part sche tok of leves,8,u S u S x u S uS,and@conj ek@adv a@indef_art part@n she@pron%nom taken@v%pt_3 of@prep lef@n1%pl
gow/05/139-gow.cat,139-gow4017,Bot thing which mihte hire most availe,Bot thing which mihte hire most availe,8,u S u Sx ux S uSx,but@conj thing@n which@pron mouen@v3%pt_3 hire@pron2%fem_obj most@adv availen@v%inf
gow/05/139-gow.cat,139-gow4018,Sche fond in Crete and in Thessaile.,Sche fond in Crete and in Thessaile,8,u S u Sx u S uSx,she@pron%nom finden@v%pt_3 in@prep crete@n#propn and@conj in@prep thessaile@n#propn
gow/05/139-gow.cat,139-gow4019,"In daies and in nyhtes Nyne,",In daies and in nyhtes Nyne,8,u Su S u Su Sx,in@prep dai@n%pl and@conj in@prep night@n%pl nin@num_adj
gow/05/139-gow.cat,139-gow4020,"With gret travaile and with gret pyne,",With gret travaile and with gret pyne,8,u S uSx u S u Sx,with@prep gret@adj travail@n and@conj with@prep gret@adj pine@n1
gow/05/139-gow.cat,139-gow4021,"Sche was pourveid of every piece,",Sche was pourveid of every piece,8,x u Su S uSu Sx,she@pron%nom ben@v%pt_3 purveien@v%ppl of@prep everi@pron_gram_adj pece@n
gow/05/139-gow.cat,139-gow4022,And torneth homward into Grece.,And torneth homward into Grece,8,u Su Su Su Sx,and@conj turnen@v%pr_3 hom-ward@adv in-to@prep grece@n#propn
gow/05/139-gow.cat,139-gow4023,Before the gates of Eson,Before the gates of Eson,8,uSx u Su S uS,biforen@prep the@def_art gate@n1%pl of@prep eson@n#propn
gow/05/139-gow.cat,139-gow4024,"Hir char sche let awai to gon,",Hir char sche let awai to gon,8,u S u S uS u S,hire@pron1%fem_gen char@n2 she@pron%nom leten@v%pt_3 awei@adv to@part gon@v%inf
gow/05/139-gow.cat,139-gow4025,And tok out ferst that was therinne;,And tok out ferst that was therinne,8,u S u S u S uSx,and@conj taken@v%pt_3 oute@adv first@adv that@pron ben@v%pt_3 ther-inne@adv
gow/05/139-gow.cat,139-gow4026,For tho sche thoghte to beginne,For tho sche thoghte to beginne,8,u S u Su S uSx,for@conj tho@adv she@pron%nom thinken@v2%pt_3 to@part biginnen@v%inf
gow/05/139-gow.cat,139-gow4027,"Such thing as semeth impossible,",Such thing as semeth impossible,8,u S u Su SuSx,swich@gram_adj thing@n as@conj semen@v2%pr_3 impossible@adj
gow/05/139-gow.cat,139-gow4028,"And made hirselven invisible,",And made hirselven invisible,8,u Sx uSu SuSx,and@conj maken@v1%pt_3 hire-self@pron invisible@adj
gow/05/139-gow.cat,139-gow4029,As sche that was with Air enclosed,As sche that was with Air enclosed,8,u x S u S u SuS,as@conj she@pron%nom that@pron ben@v%pt_3 with@prep air@n1 enclosen@v%ppl
gow/05/139-gow.cat,139-gow4030,And mihte of noman be desclosed.,And mihte of noman be desclosed,8,u Sx u Su S uSx,and@conj mouen@v3%pt_3 of@prep no-man@n ben@v%inf disclosen@v%ppl
gow/05/139-gow.cat,139-gow4031,Sche tok up turves of the lond,Sche tok up turves of the lond,8,u S u Su S u S,she@pron%nom taken@v%pt_3 up@adv turf@n%pl of@prep the@def_art lond@n
gow/05/139-gow.cat,139-gow4032,"Withoute helpe of mannes hond,",Withoute helpe of mannes hond,8,uSu Sx u Su S,withouten@prep help@n of@prep man@n%gen honde@n
gow/05/139-gow.cat,139-gow4033,"Al heled with the grene gras,",Al heled with the grene gras,8,u Su S u Su S,al@adv helen@v2%ppl_abs with@prep the@def_art grene@adj gras@n
gow/05/139-gow.cat,139-gow4034,Of which an Alter mad ther was,Of which an Alter mad ther was,8,u S u Su S u S,of@prep which@pron a@indef_art auter@n maken@v1%ppl ther@adv ben@v%pt_3
gow/05/139-gow.cat,139-gow4035,Unto Echates the goddesse,Unto Echates the goddesse,8,uS uSu S uSx,unto@prep echates@n#propn the@def_art goddesse@n
gow/05/139-gow.cat,139-gow4036,"Of art magique and the maistresse,",Of art magique and the maistresse,0,     ,of@prep art@n1 magik@adj and@conj the@def_art maistresse@n
gow/05/139-gow.cat,139-gow4037,"And eft an other to Juvente,",And eft an other to Juvente,8,u S u Su S uSx,and@conj eft@adv a@indef_art other@pron to@prep juvente@n#propn
gow/05/139-gow.cat,139-gow4038,As sche which dede hir hole entente.,As sche which dede hir hole entente,8,u S u Sx u Sx uSx,as@conj she@pron%nom which@pron don@v1%pt_3 hire@pron1%fem_gen hole@adj2 entente@n
gow/05/139-gow.cat,139-gow4039,"Tho tok sche fieldwode and verveyne,",Tho tok sche fieldwode and verveyne,8,u S x uSu S uSx,tho@adv taken@v%pt_3 she@pron%nom feld-wode@n and@conj verveine@n
gow/05/139-gow.cat,139-gow4040,"Of herbes ben noght betre tueine,",Of herbes ben noght betre tueine,8,u Su S u Su Sx,of@prep herbe@n%pl ben@v%pr_pl nought@adv bettre@adj twein@num_n
gow/05/139-gow.cat,139-gow4041,Of which anon withoute let,Of which anon withoute let,8,u S uS uSu S,of@prep which@pron an-on@adv withouten@prep lette@n
gow/05/139-gow.cat,139-gow4042,These alters ben aboute set:,These alters ben aboute set,8,ux Su S uSu S,these@gram_adj%pl auter@n%pl ben@v%pr_pl abouten@advas_adj setten@v%ppl
gow/05/139-gow.cat,139-gow4043,Tuo sondri puttes faste by,Tuo sondri puttes faste by,8,u Su Su Su S,two@num_adj sondri@adj pit@n%pl faste@adv bi@adv
gow/05/139-gow.cat,139-gow4044,"Sche made, and with that hastely",Sche made and with that hastely,8,u Sx u S u SuS,she@pron%nom maken@v1%pt_3 and@conj with@prep that@pron hastilie@adv
gow/05/139-gow.cat,139-gow4045,"A wether which was blak sche slouh,",A wether which was blak sche slouh,8,u Su S u S u S,a@indef_art wether@n which@pron ben@v%pt_3 blak@adj she@pron%nom slen@v%pt_3
gow/05/139-gow.cat,139-gow4046,And out therof the blod sche drouh,And out therof the blod sche drouh,8,u S uS u S u S,and@conj oute@adv ther-of@adv the@def_art blod@n1 she@pron%nom drauen@v%pt_3
gow/05/139-gow.cat,139-gow4047,And dede into the pettes tuo;,And dede into the pettes tuo,8,u Sx uS u Su S,and@conj don@v1%pt_3 in-to@prep the@def_art pit@n%pl two@num_adj
gow/05/139-gow.cat,139-gow4048,Warm melk sche putte also therto,Warm melk sche putte also therto,8,u S u Sx uS uS,warm@adj milk@n she@pron%nom putten@v%pt_3 also@adv ther-to@adv
gow/05/139-gow.cat,139-gow4049,With hony meynd: and in such wise,With hony meynd and in such wise,8,u Su S u S u Sx,with@prep honi@n mengen@v%ppl_abs and@conj in@prep swich@gram_adj wise@n2
gow/05/139-gow.cat,139-gow4050,"Sche gan to make hir sacrifice,",Sche gan to make hir sacrifice,8,u S u Sx u SuSx,she@pron%nom ginnen@v%pt_3 to@part maken@v1%inf hire@pron1%fem_gen sacrifice@n
gow/05/139-gow.cat,139-gow4051,And cride and preide forth withal,And cride and preide forth withal,8,u Sx u Su S uS,and@conj crien@v%pt_3 and@conj preien@v1%pt_3 forth@adv with-al@adv
gow/05/139-gow.cat,139-gow4052,"To Pluto the god infernal,",To Pluto the god infernal,8,u Su S u SuS,to@prep pluto@n#propn the@def_art god@n1 infernal@adj
gow/05/139-gow.cat,139-gow4053,And to the queene Proserpine.,And to the queene Proserpine,8,u S u Su SuSx,and@conj to@prep the@def_art quene@n2 proserpine@n#propn
gow/05/139-gow.cat,139-gow4054,And so sche soghte out al the line,And so sche soghte out al the line,8,u S u Sx u S u Sx,and@conj so@adv she@pron%nom sechen@v%pt_3 oute@adv al@gram_adj the@def_art line@n1
gow/05/139-gow.cat,139-gow4055,"Of hem that longen to that craft,",Of hem that longen to that craft,8,u S u Su S u S,of@prep hem@pron%pl_obj that@pron longen@v3%pr_pl to@prep that@art&gram_adj craft@n1
gow/05/139-gow.cat,139-gow4056,"Behinde was no name laft,",Behinde was no name laft,8,uSu S u Su S,bihinden@adv&adj ben@v%pt_3 no@gram_adj name@n leven@v1%ppl
gow/05/139-gow.cat,139-gow4057,"And preide hem alle, as sche wel couthe,",And preide hem alle as sche wel couthe,8,u Sx u Sx u S u Sx,and@conj preien@v1%pt_3 hem@pron%pl_obj al@gram_adj as@conj she@pron%nom wel@adv connen@v%pt_3
gow/05/139-gow.cat,139-gow4058,To grante Eson his ferste youthe.,To grante Eson his ferste youthe,8,u Sx uS u Su Sx,to@part graunten@v%inf eson@n#propn his@pron1%gen first@num_adj youth@n
gow/05/139-gow.cat,139-gow4059,"This olde Eson broght forth was tho,",This olde Eson broght forth was tho,8,u Sx uS u S u S,this@gram_adj olde@adj eson@n#propn bringen@v%ppl forth@adv ben@v%pt_3 tho@adv
gow/05/139-gow.cat,139-gow4060,Awei sche bad alle othre go,Awei sche bad alle othre go,8,uS x u Su Su S,awei@adv she@pron%nom bidden@v%pt_3 al@gram_adj other@pron gon@v%inf
gow/05/139-gow.cat,139-gow4061,Upon peril that mihte falle;,Upon peril that mihte falle,8,uS uS u Su Sx,upon@prep peril@n that@pron mouen@v3%pt_3 fallen@v%inf
gow/05/139-gow.cat,139-gow4062,"And with that word thei wenten alle,",And with that word thei wenten alle,8,u S u S u Su Sx,and@conj with@prep that@art&gram_adj word@n thei@pron%pl_nom wenden@v%pt_pl al@gram_adj
gow/05/139-gow.cat,139-gow4063,And leften there hem tuo al one.,And leften there hem tuo al one,8,u Su Sx u S u Sx,and@conj leven@v1%pt_pl ther@adv hem@pron%pl_obj two@num_n al@adv on@num_adj
gow/05/139-gow.cat,139-gow4064,"And tho sche gan to gaspe and gone,",And tho sche gan to gaspe and gone,8,u S u S u Sx u Sx,and@conj tho@adv she@pron%nom ginnen@v%pt_3 to@part gaspen@v%inf and@conj gon@v%inf
gow/05/139-gow.cat,139-gow4065,"And made signes manyon,",And made signes manyon,0,   ,and@conj maken@v1%pt_3 signe@n%pl mani_on@phr#n
gow/05/139-gow.cat,139-gow4066,And seide hir wordes therupon;,And seide hir wordes therupon,8,u Sx u Su SuS,and@conj seien@v1%pt_3 hire@pron1%fem_gen word@n%pl ther-upon@adv
gow/05/139-gow.cat,139-gow4067,So that with spellinge of hir charmes,So that with spellinge of hir charmes,8,u S u Sux S u Sx,so@adv that@conj with@prep spellinge@ger1 of@prep hire@pron1%fem_gen charme@n%pl
gow/05/139-gow.cat,139-gow4068,"Sche tok Eson in bothe hire armes,",Sche tok Eson in bothe hire armes,8,x u Su S ux Sx uS,she@pron%nom taken@v%pt_3 eson@n#propn in@prep bothe@num_adj hire@pron1%fem_gen arm@n%pl
gow/05/139-gow.cat,139-gow4069,"And made him forto slepe faste,",And made him forto slepe faste,8,u Sx u Su Su Sx,and@conj maken@v1%pt_3 him@pron%obj forto@part slepen@v%inf faste@adv
gow/05/139-gow.cat,139-gow4070,And him upon hire herbes caste.,And him upon hire herbes caste,8,u S uS ux Su Sx,and@conj him@pron%obj upon@prep hire@pron1%fem_gen herbe@n%pl casten@v%pt_3
gow/05/139-gow.cat,139-gow4071,"The blake wether tho sche tok,",The blake wether tho sche tok,8,u Su Su S u S,the@def_art blak@adj wether@n tho@adv she@pron%nom taken@v%pt_3
gow/05/139-gow.cat,139-gow4072,"And hiewh the fleissh, as doth a cok;",And hiewh the fleissh as doth a cok,8,u S u S u S u S,and@conj heuen@v1%pt_3 the@def_art flesh@n as@conj don@v1%pr_3 a@indef_art cok@n6
gow/05/139-gow.cat,139-gow4073,"On either alter part sche leide,",On either alter part sche leide,8,u Su Su S u Sx,on@prep either@pron_adj auter@n part@n she@pron%nom leien@v1%pt_3
gow/05/139-gow.cat,139-gow4074,And with the charmes that sche seide,And with the charmes that sche seide,8,u S u Su S u Sx,and@conj with@prep the@def_art charme@n%pl that@pron she@pron%nom seien@v1%pt_3
gow/05/139-gow.cat,139-gow4075,A fyr doun fro the Sky alyhte,A fyr doun fro the Sky alyhte,8,u S u S u S uSx,a@indef_art fir@n doun@adv from@prep the@def_art skie@n alighten@v1%pt_3
gow/05/139-gow.cat,139-gow4076,And made it forto brenne lyhte.,And made it forto brenne lyhte,8,u Sx u Su Su Sx,and@conj maken@v1%pt_3 hit@pron forto@part brennen@v%inf lighte@adv1
gow/05/139-gow.cat,139-gow4077,"Bot whan Medea sawh it brenne,",Bot whan Medea sawh it brenne,8,u S uSu S u Sx,but@conj whan@adv&conj medea@n#propn sen@v1%pt_3 hit@pron brennen@v%inf
