FILENAME,LINE_NUMBER,OG_TEXT,TEXT,NUM_SYBS,SCANSION,TAGGING
gow/05/139-gow.cat,139-gow3798,"And that it stod wel al aboute,",And that it stod wel al aboute,8,u S u S u S uSx,and@conj that@conj hit@pron stonden@v1%pt_3 wel@adv al@adv abouten@adv
gow/05/139-gow.cat,139-gow3799,"Sche tolde hire ladi what sche wiste,",Sche tolde hire ladi what sche wiste,8,x ux Su Su S u Sx,she@pron%nom tellen@v%pt_3 hire@pron1%fem_gen ladie@n what@pron she@pron%nom witen@v1%pt_3
gow/05/139-gow.cat,139-gow3800,And sche for joie hire Maide kiste.,And sche for joie hire Maide kiste,8,u x S u Su Su Sx,and@conj she@pron%nom for@prep joie@n hire@pron1%fem_gen maide@n kissen@v%pt_3
gow/05/139-gow.cat,139-gow3801,"The bathes weren thanne araied,",The bathes weren thanne araied,8,u Su Sx ux SuS,the@def_art bath@n%pl ben@v%pt_pl thanne@adv arraien@v%ppl
gow/05/139-gow.cat,139-gow3802,"With herbes tempred and assaied,",With herbes tempred and assaied,8,u Su Sx u SuS,with@prep herbe@n%pl tempren@v%ppl_abs and@conj assaien@v%ppl
gow/05/139-gow.cat,139-gow3803,And Jason was unarmed sone,And Jason was unarmed sone,8,u Su S uSu Sx,and@conj jason@n#propn ben@v%pt_3 unarmen@v%ppl sone@adv
gow/05/139-gow.cat,139-gow3804,And dede as it befell to done:,And dede as it befell to done,8,u Sx u S uS u Sx,and@conj don@v1%pt_3 as@conj hit@pron bifallen@v%pt_3 to@part don@v1%inf
gow/05/139-gow.cat,139-gow3805,Into his bath he wente anon,Into his bath he wente anon,8,uS u S u Sx uS,in-to@prep his@pron1%gen bath@n he@pron1%nom wenden@v%pt_3 an-on@adv
gow/05/139-gow.cat,139-gow3806,And wyssh him clene as eny bon;,And wyssh him clene as eny bon,8,u S u Sx u Su S,and@conj washen@v%pt_3 him@pron%obj clene@adv as@conj ani@gram_adj bon@n1
gow/05/139-gow.cat,139-gow3807,"He tok a sopp, and oute he cam,",He tok a sopp and oute he cam,8,u S u S u Sx u S,he@pron1%nom taken@v%pt_3 a@indef_art soppe@n1 and@conj oute@adv he@pron1%nom comen@v%pt_3
gow/05/139-gow.cat,139-gow3808,"And on his beste aray he nam,",And on his beste aray he nam,8,u S u Sx uS u S,and@conj on@prep his@pron1%gen best@adj arrai@n he@pron1%nom nimen@v%pt_3
gow/05/139-gow.cat,139-gow3809,"And kempde his hed, whan he was clad,",And kempde his hed whan he was clad,8,u Sx u S u S u S,and@conj kemben@v%pt_3 his@pron1%gen hed@n1 whan@adv&conj he@pron1%nom ben@v%pt_3 clothen@v%ppl
gow/05/139-gow.cat,139-gow3810,And goth him forth al merie and glad,And goth him forth al merie and glad,8,u S u S u xS u S,and@conj gon@v%pr_3 him@pron%obj forth@adv al@adv mirie@adj and@conj glad@adj
gow/05/139-gow.cat,139-gow3811,Riht strawht into the kinges halle.,Riht strawht into the kinges halle,8,u S uS u Su Sx,righte@adv streight@adv in-to@prep the@def_art king@n%gen halle@n
gow/05/139-gow.cat,139-gow3812,The king cam with his knihtes alle,The king cam with his knihtes alle,8,u S u S u Su Sx,the@def_art king@n comen@v%pt_3 with@prep his@pron1%gen knight@n%pl al@gram_adj
gow/05/139-gow.cat,139-gow3813,And maden him glad welcominge;,And maden him glad welcominge,8,u Su S u SuSx,and@conj maken@v1%pt_pl him@pron%obj glad@adj welcominge@ger
gow/05/139-gow.cat,139-gow3814,And he hem tolde the tidinge,And he hem tolde the tidinge,8,u S u Su S uSx,and@conj he@pron1%nom hem@pron%pl_obj tellen@v%pt_3 the@def_art tidinge@n
gow/05/139-gow.cat,139-gow3815,"Of this and that, hou it befell,",Of this and that hou it befell,8,u S u S u S uS,of@prep this@pron and@conj that@pron hou@adv&conj hit@pron bifallen@v%pt_3
gow/05/139-gow.cat,139-gow3816,Whan that he wan the schepes fell.,Whan that he wan the schepes fell,8,u S u S u Su S,whan@adv&conj that@part he@pron1%nom winnen@v%pt_3 the@def_art shep@n%gen fel@n1
gow/05/139-gow.cat,139-gow3817,"Medea, whan sche was asent,",Medea whan sche was asent,8,uSu S u S uS,medea@n#propn whan@adv&conj she@pron%nom ben@v%pt_3 assenten@v%ppl
gow/05/139-gow.cat,139-gow3818,"Com sone to that parlement,",Com sone to that parlement,8,u Su S u SuS,comen@v%pt_3 sone@adv to@prep that@art&gram_adj parlemente@n
gow/05/139-gow.cat,139-gow3819,"And whan sche mihte Jason se,",And whan sche mihte Jason se,8,u S u Su Su S,and@conj whan@adv&conj she@pron%nom mouen@v3%pt_3 jason@n#propn sen@v1%inf
gow/05/139-gow.cat,139-gow3820,Was non so glad of alle as sche.,Was non so glad of alle as sche,8,u S u S u Sx u S,ben@v%pt_3 non@pron so@adv glad@adj of@prep al@gram_adjas_n as@conj she@pron%nom
gow/05/139-gow.cat,139-gow3821,"Ther was no joie forto seche,",Ther was no joie forto seche,7,S u S u Su Sx,ther@adv ben@v%pt_3 no@gram_adj joie@n forto@part sechen@v%inf
gow/05/139-gow.cat,139-gow3822,"Of him mad every man a speche,",Of him mad every man a speche,8,u S u Sxu S u Sx,of@prep him@pron%obj maken@v1%pt_3 everi@pron_gram_adj man@n a@indef_art speche@n
gow/05/139-gow.cat,139-gow3823,"Som man seide on, som man seide other;",Som man seide on som man seide other,8,u S ux S u S ux S,som@gram_adj man@n seien@v1%pt_3 on@pron som@gram_adj man@n seien@v1%pt_3 other@pron
gow/05/139-gow.cat,139-gow3824,Bot thogh he were goddes brother,Bot thogh he were goddes brother,8,u S u Sx uS uS,but@conj though@conj he@pron1%nom ben@v%pt_3 god@n1%gen brother@n
gow/05/139-gow.cat,139-gow3825,"And mihte make fyr and thonder,",And mihte make fyr and thonder,8,u Su Sx u S uS,and@conj mouen@v3%pt_3 maken@v1%inf fir@n and@conj thonder@n
gow/05/139-gow.cat,139-gow3826,Ther mihte be nomore wonder,Ther mihte be nomore wonder,8,u Su S uSx uS,ther@adv mouen@v3%pt_3 ben@v%inf no_more@adj wonder@n
gow/05/139-gow.cat,139-gow3827,Than was of him in that cite.,Than was of him in that cite,7,S u S u S u Sx,than@conj ben@v%pt_3 of@prep him@pron%obj in@prep that@art&gram_adj cite@n
gow/05/139-gow.cat,139-gow3828,"Echon tauhte other, ""This is he,",Echon tauhte other This is he,8,uS ux Su S u S,ech_on@pron techen@v%pt_3 other@pron this@pron ben@v%pr_3 he@pron1%nom
gow/05/139-gow.cat,139-gow3829,Which hath in his pouer withinne,Which hath in his pouer withinne,8,u S u S uS uSx,which@pron haven@v%pr_3 in@prep his@pron1%gen pouere@n with-inne@adv
gow/05/139-gow.cat,139-gow3830,That al the world ne mihte winne:,That al the world ne mihte winne,8,u S u S u Su Sx,that@pron al@gram_adj the@def_art world@n ne@adv mouen@v3%pt_3 winnen@v%inf
gow/05/139-gow.cat,139-gow3831,"Lo, hier the beste of alle goode.""",Lo hier the beste of alle goode,8,u Su S ux S ux Sx,lo@interj her@adv the@def_art best@adjas_n of@prep al@gram_adj god@n2
gow/05/139-gow.cat,139-gow3832,"Thus saiden thei that there stode,",Thus saiden thei that there stode,8,u Su S u Su Sx,thus@adv seien@v1%pt_pl thei@pron%pl_nom that@pron ther@adv stonden@v1%pt_pl
gow/05/139-gow.cat,139-gow3833,"And ek that walkede up and doun,",And ek that walkede up and doun,8,u S u Sux S u S,and@conj ek@adv that@pron walken@v1%pt_pl up@adv and@conj doun@adv
gow/05/139-gow.cat,139-gow3834,Bothe of the Court and of the toun.,Bothe of the Court and of the toun,8,ux S u S u S u S,bothe@num_conj of@prep the@def_art court@n1 and@conj of@prep the@def_art toun@n
gow/05/139-gow.cat,139-gow3835,"The time of Souper cam anon,",The time of Souper cam anon,8,u Sx u Su S uS,the@def_art time@n of@prep sopere@n1 comen@v%pt_3 an-on@adv
gow/05/139-gow.cat,139-gow3836,"Thei wisshen and therto thei gon,",Thei wisshen and therto thei gon,8,u Su S uS u S,thei@pron%pl_nom wishen@v%pr_pl and@conj ther-to@adv thei@pron%pl_nom gon@v%pr_pl
gow/05/139-gow.cat,139-gow3837,Medea was with Jason set:,Medea was with Jason set,8,uSu S u Su S,medea@n#propn ben@v%pt_3 with@prep jason@n#propn setten@v%ppl
gow/05/139-gow.cat,139-gow3838,Tho was ther many a deynte fet,Tho was ther many a deynte fet,8,u S u Su S ux S,tho@adv ben@v%pt_3 ther@adv mani@gram_adj a@indef_art deinte@adj fet@n
gow/05/139-gow.cat,139-gow3839,"And set tofore hem on the bord,",And set tofore hem on the bord,8,u S uSx u S u S,and@conj setten@v%ppl toforen@prep hem@pron%pl_obj on@prep the@def_art bord@n
gow/05/139-gow.cat,139-gow3840,Bot non so likinge as the word,Bot non so likinge as the word,8,u S u Sux S u S,but@conj non@pron so@adv likinge@ger1 as@conj the@def_art word@n
gow/05/139-gow.cat,139-gow3841,"Which was ther spoke among hem tuo,",Which was ther spoke among hem tuo,8,u S u Sx uS u S,which@pron ben@v%pt_3 ther@adv speken@v%ppl amonges@prep hem@pron%pl_obj two@num_n
gow/05/139-gow.cat,139-gow3842,So as thei dorste speke tho.,So as thei dorste speke tho,8,u S u Su Su S,so@adv as@conj thei@pron%pl_nom durren@v%pr_pl speken@v%inf tho@adv
gow/05/139-gow.cat,139-gow3843,"Bot thogh thei hadden litel space,",Bot thogh thei hadden litel space,8,u S u Su Su Sx,but@conj though@conj thei@pron%pl_nom haven@v%pt_pl litel@adj space@n
gow/05/139-gow.cat,139-gow3844,Yit thei acorden in that place,Yit thei acorden in that place,8,u S uSu S u Sx,yet@adv thei@pron%pl_nom accorden@v%pr_pl in@prep that@art&gram_adj place@n
gow/05/139-gow.cat,139-gow3845,"Hou Jason scholde come at nyht,",Hou Jason scholde come at nyht,8,u Su Su Sx u S,hou@adv&conj jason@n#propn shulen@v1%pt_3 comen@v%inf at@prep night@n
gow/05/139-gow.cat,139-gow3846,Whan every torche and every liht,Whan every torche and every liht,8,u Sxu Sx u Sxu S,whan@adv&conj everi@pron_gram_adj torche@n and@conj everi@pron_gram_adj light@n
gow/05/139-gow.cat,139-gow3847,"Were oute, and thanne of other thinges",Were oute and thanne of other thinges,8,ux Sx u Sx u Su Sx,ben@v%pt_pl oute@adv and@conj thanne@adv of@prep other@gram_adj thing@n%pl
gow/05/139-gow.cat,139-gow3848,Thei spieke aloud for supposinges,Thei spieke aloud for supposinges,8,u Sx uS u SuSx,thei@pron%pl_nom speken@v%pt_pl aloude@adv for@prep supposinge@ger%pl
gow/05/139-gow.cat,139-gow3849,Of hem that stoden there aboute:,Of hem that stoden there aboute,8,u S u Su Sx uSx,of@prep hem@pron%pl_obj that@pron stonden@v1%pt_pl ther@adv abouten@adv
gow/05/139-gow.cat,139-gow3850,"For love is everemore in doute,",For love is everemore in doute,8,u Sx u SxuSx u Sx,for@conj love@n1 ben@v%pr_3 ever-mor@adv in@prep doute@n
gow/05/139-gow.cat,139-gow3851,If that it be wisly governed,If that it be wisly governed,8,u S u S uS uSx,if@conj that@conj hit@pron ben@v%pr_3 wiseli@adv governen@v%ppl
gow/05/139-gow.cat,139-gow3852,Of hem that ben of love lerned.,Of hem that ben of love lerned,8,u S u S u Sx uS,of@prep hem@pron%pl_obj that@pron ben@v%pr_pl of@prep love@n1 lernen@v%ppl
gow/05/139-gow.cat,139-gow3853,"Whan al was don, that dissh and cuppe",Whan al was don that dissh and cuppe,8,u S u S u S u Sx,whan@adv&conj al@gram_adjas_n ben@v%pt_3 don@v1%ppl that@conj dish@n and@conj cuppe@n
gow/05/139-gow.cat,139-gow3854,"And cloth and bord and al was uppe,",And cloth and bord and al was uppe,8,u S u S u S u Sx,and@conj cloth@n and@conj bord@n and@conj al@gram_adjas_n ben@v%pt_3 uppe@adv
gow/05/139-gow.cat,139-gow3855,"Thei waken whil hem lest to wake,",Thei waken whil hem lest to wake,8,u Su S u S u Sx,thei@pron%pl_nom waken@v%pr_pl whil@conj hem@pron%pl_obj listen@v2%pr_3 to@part waken@v%inf
gow/05/139-gow.cat,139-gow3856,And after that thei leve take,And after that thei leve take,8,u Su S u Su Sx,and@conj after@prep that@pron thei@pron%pl_nom leve@n2 taken@v%pr_pl
gow/05/139-gow.cat,139-gow3857,And gon to bedde forto reste.,And gon to bedde forto reste,8,u S u Su Su Sx,and@conj gon@v%pr_pl to@prep bed@n1 forto@part resten@v1%inf
gow/05/139-gow.cat,139-gow3858,"And whan him thoghte for the beste,",And whan him thoghte for the beste,8,u S u Su S u Sx,and@conj whan@adv&conj him@pron%obj thinken@v1%pt_3 for@prep the@def_art best@adjas_n
gow/05/139-gow.cat,139-gow3859,"That every man was faste aslepe,",That every man was faste aslepe,8,u Sxu S u Sx uSx,that@conj everi@pron_gram_adj man@n ben@v%pt_3 faste@adv aslepe@adv1
gow/05/139-gow.cat,139-gow3860,"Jason, that wolde his time kepe,",Jason that wolde his time kepe,8,uS u Sx u Su Sx,jason@n#propn that@pron willen@v%pt_3 his@pron1%gen time@n kepen@v%inf
gow/05/139-gow.cat,139-gow3861,Goth forth stalkende al prively,Goth forth stalkende al prively,8,u S uSx u SuS,gon@v%pr_3 forth@adv stalken@v%prp al@adv privelie@adv
gow/05/139-gow.cat,139-gow3862,"Unto the chambre, and redely",Unto the chambre and redely,8,uS u Sx u SuS,unto@prep the@def_art chaumbre@n and@conj redili@adv2
gow/05/139-gow.cat,139-gow3863,"Ther was a Maide, which him kepte.",Ther was a Maide which him kepte,8,u S u Su S u Sx,ther@adv ben@v%pt_3 a@indef_art maide@n which@pron him@pron%obj kepen@v%pt_3
gow/05/139-gow.cat,139-gow3864,"Medea wok and nothing slepte,",Medea wok and nothing slepte,8,uSu S u Su Sx,medea@n#propn waken@v%pt_3 and@conj no-thing@adv slepen@v%pt_3
gow/05/139-gow.cat,139-gow3865,"Bot natheles sche was abedde,",Bot natheles sche was abedde,8,u SuS u S uSx,but@conj no-the-lesse@adv she@pron%nom ben@v%pt_3 abedde@adv
gow/05/139-gow.cat,139-gow3866,And he with alle haste him spedde,And he with alle haste him spedde,8,u S u Su Sx u Sx,and@conj he@pron1%nom with@prep al@gram_adj haste@n him@pron%obj speden@v%pt_3
gow/05/139-gow.cat,139-gow3867,And made him naked and al warm.,And made him naked and al warm,8,u Sx u Su S u S,and@conj maken@v1%pt_3 him@pron%obj naked@adj and@conj al@adv warm@adj
gow/05/139-gow.cat,139-gow3868,Anon he tok hire in his arm:,Anon he tok hire in his arm,8,uS u S ux S u S,an-on@adv he@pron1%nom taken@v%pt_3 hire@pron2%fem_obj in@prep his@pron1%gen arm@n
gow/05/139-gow.cat,139-gow3869,What nede is forto speke of ese?,What nede is forto speke of ese,8,u Sx u Su Sx u Sx,what@gram_adj nede@n1 ben@v%pr_3 forto@part speken@v%inf of@prep ese@n
gow/05/139-gow.cat,139-gow3870,"Hem list ech other forto plese,",Hem list ech other forto plese,8,u S u Su Su Sx,hem@pron%pl_obj listen@v2%pr_3 ech@pron_gram_adj other@pron forto@part plesen@v%inf
gow/05/139-gow.cat,139-gow3871,So that thei hadden joie ynow:,So that thei hadden joie ynow,8,u S u Su S uS,so@adv that@conj thei@pron%pl_nom haven@v%pt_pl joie@n inough@adj
gow/05/139-gow.cat,139-gow3872,And tho thei setten whanne and how,And tho thei setten whanne and how,8,u S u Su Sx u S,and@conj tho@adv thei@pron%pl_nom setten@v%pt_pl whan@adv&conj and@conj hou@adv&conj
gow/05/139-gow.cat,139-gow3873,That sche with him awey schal stele.,That sche with him awey schal stele,8,u S u S uS u Sx,that@part she@pron%nom with@prep him@pron%obj awei@adv shulen@v1%pr_3 stelen@v%inf
gow/05/139-gow.cat,139-gow3874,With wordes suche and othre fele,With wordes suche and othre fele,8,u Su Sx u Su Sx,with@prep word@n%pl swich@gram_adj and@conj other@pron fele@num_adj
gow/05/139-gow.cat,139-gow3875,"Whan al was treted to an ende,",Whan al was treted to an ende,8,u S u Su S u Sx,whan@adv&conj al@gram_adjas_n ben@v%pt_3 treten@v%ppl to@prep a@indef_art ende@n1
gow/05/139-gow.cat,139-gow3876,Jason tok leve and gan forth wende,Jason tok leve and gan forth wende,8,uS u Sx u S u Sx,jason@n#propn taken@v%pt_3 leve@n2 and@conj ginnen@v%pt_3 forth@adv wenden@v%inf
gow/05/139-gow.cat,139-gow3877,Unto his oughne chambre in pes;,Unto his oughne chambre in pes,8,uS u Su Sx u S,unto@prep his@pron1%gen ouen@adj chaumbre@n in@prep pes@n
gow/05/139-gow.cat,139-gow3878,Ther wiste it non bot Hercules.,Ther wiste it non bot Hercules,8,u Sx u S u SuS,ther@adv witen@v1%pt_3 hit@pron non@pron but@conj hercules@n#propn
gow/05/139-gow.cat,139-gow3879,"He slepte and ros whan it was time,",He slepte and ros whan it was time,8,u Sx u S u S u Sx,he@pron1%nom slepen@v%pt_3 and@conj risen@v%pt_3 whan@adv&conj hit@pron ben@v%pt_3 time@n
gow/05/139-gow.cat,139-gow3880,"And whanne it fell towardes prime,",And whanne it fell towardes prime,8,u Sx u S uSu Sx,and@conj whan@adv&conj hit@pron fallen@v%pt_3 towardes@prep prime@n
gow/05/139-gow.cat,139-gow3881,He tok to him suche as he triste,He tok to him suche as he triste,8,u S u S ux S u Sx,he@pron1%nom taken@v%pt_3 to@prep him@pron%obj swich@gram_adj as@conj he@pron1%nom trusten@v%pr_3
gow/05/139-gow.cat,139-gow3882,"In secre, that non other wiste,",In secre that non other wiste,8,u Su S u Su Sx,in@prep secre@n that@conj non@gram_adj other@pron witen@v1%pt_3
gow/05/139-gow.cat,139-gow3883,"And told hem of his conseil there,",And told hem of his conseil there,8,u S u S u Su Sx,and@conj tellen@v%pt_3 hem@pron%pl_obj of@prep his@pron1%gen counseil@n ther@adv
gow/05/139-gow.cat,139-gow3884,And seide that his wille were,And seide that his wille were,8,u Su S u Su Sx,and@conj seien@v1%pt_3 that@conj his@pron1%gen wille@n ben@v%pt_3
gow/05/139-gow.cat,139-gow3885,That thei to Schipe hadde alle thinge,That thei to Schipe hadde alle thinge,8,u S u Sx ux Su Sx,that@conj thei@pron%pl_nom to@prep ship@n haven@v%pt_pl al@gram_adj thing@n
gow/05/139-gow.cat,139-gow3886,"So priveliche in thevenynge,",So priveliche in thevenynge,8,u SuSx u SuSx,so@adv privelie@adv in@prep evening@n1
gow/05/139-gow.cat,139-gow3887,That noman mihte here dede aspie,That noman mihte here dede aspie,8,u Su Sx ux Sx uS,that@conj no-man@n mouen@v3%pt_3 here@pron%pl_gen dede@n aspien@v%inf
gow/05/139-gow.cat,139-gow3888,Bot tho that were of compaignie:,Bot tho that were of compaignie,8,u S u Sx u SuS,but@conj tho@pron2 that@pron ben@v%pt_pl of@prep compaignie@n
gow/05/139-gow.cat,139-gow3889,"For he woll go withoute leve,",For he woll go withoute leve,8,u S u S uSu Sx,for@conj he@pron1%nom willen@v%pr_3 gon@v%inf withouten@prep leve@n2
gow/05/139-gow.cat,139-gow3890,And lengere woll he noght beleve;,And lengere woll he noght beleve,8,u Sux S u S uSx,and@conj lengere@adv willen@v%pr_3 he@pron1%nom nought@adv bileven@v1%inf
gow/05/139-gow.cat,139-gow3891,Bot he ne wolde at thilke throwe,Bot he ne wolde at thilke throwe,8,u S u Sx u Su Sx,but@conj he@pron1%nom ne@adv willen@v%pt_3 at@prep thilke@gram_adj throu@n1
gow/05/139-gow.cat,139-gow3892,The king or queene scholde it knowe.,The king or queene scholde it knowe,8,u S u Su Sx u Sx,the@def_art king@n or@conj quene@n2 shulen@v1%pt_3 hit@pron knouen@v%inf
gow/05/139-gow.cat,139-gow3893,"Thei saide, ""Al this schal wel be do:""",Thei saide Al this schal wel be do,8,u Sx u S u S u S,thei@pron%pl_nom seien@v1%pt_pl al@gram_adj this@pron shulen@v1%pr_3 wel@adv ben@v%inf don@v1%ppl
gow/05/139-gow.cat,139-gow3894,And Jason truste wel therto.,And Jason truste wel therto,8,u Su Su S uS,and@conj jason@n#propn trusten@v%pr_3 wel@adv ther-to@adv
gow/05/139-gow.cat,139-gow3895,"Medea in the mene while,",Medea in the mene while,8,uSu S u Su Sx,medea@n#propn in@prep the@def_art mene@adj2 whil@n
gow/05/139-gow.cat,139-gow3896,"Which thoghte hir fader to beguile,",Which thoghte hir fader to beguile,8,u Sx u Su S uSx,which@pron thinken@v2%pt_3 hire@pron1%fem_gen fader@n to@part bigilen@v%inf
gow/05/139-gow.cat,139-gow3897,The Tresor which hir fader hadde,The Tresor which hir fader hadde,8,u Su S u Su Sx,the@def_art tresour@n which@pron hire@pron1%fem_gen fader@n haven@v%pt_3
gow/05/139-gow.cat,139-gow3898,"With hire al priveli sche ladde,",With hire al priveli sche ladde,8,u Sx u SuS u Sx,with@prep hire@pron2%fem_obj al@adv privelie@adv she@pron%nom leden@v1%pt_3
gow/05/139-gow.cat,139-gow3899,And with Jason at time set,And with Jason at time set,8,u S uS u Su S,and@conj with@prep jason@n#propn at@prep time@n setten@v%ppl_abs
gow/05/139-gow.cat,139-gow3900,"Awey sche stal and fond no let,",Awey sche stal and fond no let,8,uS u S u S u S,awei@adv she@pron%nom stelen@v%pt_3 and@conj finden@v%pt_3 no@gram_adj lette@n
gow/05/139-gow.cat,139-gow3901,And straght sche goth hire unto schipe,And straght sche goth hire unto schipe,8,u S x u Su Su Sx,and@conj streight@adv she@pron%nom gon@v%pr_3 hire@pron2%fem_obj unto@prep ship@n
gow/05/139-gow.cat,139-gow3902,"Of Grece with that felaschipe,",Of Grece with that felaschipe,8,u Su S u SuSx,of@prep grece@n#propn with@prep that@art&gram_adj felaushipe@n
gow/05/139-gow.cat,139-gow3903,And thei anon drowe up the Seil.,And thei anon drowe up the Seil,8,u S uS ux S u S,and@conj thei@pron%pl_nom an-on@adv drauen@v%pt_pl up@adv the@def_art seile@n
gow/05/139-gow.cat,139-gow3904,"And al that nyht this was conseil,",And al that nyht this was conseil,8,u S u S u S uS,and@conj al@gram_adj that@pron night@n this@pron ben@v%pt_3 counseil@n
gow/05/139-gow.cat,139-gow3905,"Bot erly, whan the Sonne schon,",Bot erly whan the Sonne schon,8,u Su S u Su S,but@conj erli@adv whan@adv&conj the@def_art sonne@n shinen@v%pt_3
gow/05/139-gow.cat,139-gow3906,"Men syhe hou that thei were agon,",Men syhe hou that thei were agon,8,u Sx u S u Sx uS,man@n%pl sen@v1%pt_pl hou@adv&conj that@part thei@pron%pl_nom ben@v%pt_pl agon@v%ppl
gow/05/139-gow.cat,139-gow3907,And come unto the king and tolde:,And come unto the king and tolde,8,u Sx uS u S u Sx,and@conj comen@v%pr_pl unto@prep the@def_art king@n and@conj tellen@v%pt_pl
gow/05/139-gow.cat,139-gow3908,"And he the sothe knowe wolde,",And he the sothe knowe wolde,8,u S u Su Su Sx,and@conj he@pron1%nom the@def_art soth@n knouen@v%inf willen@v%pt_3
gow/05/139-gow.cat,139-gow3909,And axeth where his dowhter was.,And axeth where his dowhter was,8,u Su Sx u Su S,and@conj asken@v%pr_3 wher@adv&conj his@pron1%gen doughter@n ben@v%pt_3
gow/05/139-gow.cat,139-gow3910,"Ther was no word bot Out, Allas!",Ther was no word bot Out Allas,8,u S u S u S uS,ther@adv ben@v%pt_3 no@gram_adj word@n but@conj oute@interj alas@interj
gow/05/139-gow.cat,139-gow3911,"Sche was ago. The moder wepte,",Sche was ago The moder wepte,8,u S uS u Su Sx,she@pron%nom ben@v%pt_3 agon@v%ppl the@def_art moder@n wepen@v%pt_3
gow/05/139-gow.cat,139-gow3912,"The fader as a wod man lepte,",The fader as a wod man lepte,8,u Su S u S u Sx,the@def_art fader@n as@conj a@indef_art wod@adj man@n lepen@v%pt_3
gow/05/139-gow.cat,139-gow3913,"And gan the time forto warie,",And gan the time forto warie,8,u S u Sx uS uS,and@conj ginnen@v%pt_3 the@def_art time@n forto@part warien@v%inf
gow/05/139-gow.cat,139-gow3914,"And swor his oth he wol noght tarie,",And swor his oth he wol noght tarie,0,       ,and@conj sweren@v%pt_3 his@pron1%gen oth@n he@pron1%nom willen@v%pr_3 nought@adv tarien@v1%inf
gow/05/139-gow.cat,139-gow3915,That with Caliphe and with galeie,That with Caliphe and with galeie,8,u S uSx u S uS,that@conj with@prep calife@n and@conj with@prep galeie@n
gow/05/139-gow.cat,139-gow3916,"The same cours, the same weie,",The same cours the same weie,8,u Su S u Su S,the@def_art same@gram_adj cours@n the@def_art same@gram_adj wei@n
gow/05/139-gow.cat,139-gow3917,"Which Jason tok, he wolde take,",Which Jason tok he wolde take,8,u Su S u Su Sx,which@pron jason@n#propn taken@v%pt_3 he@pron1%nom willen@v%pt_3 taken@v%inf
gow/05/139-gow.cat,139-gow3918,If that he mihte him overtake.,If that he mihte him overtake,8,u S u Sx u SuSx,if@conj that@part he@pron1%nom mouen@v3%pt_3 him@pron%obj overtaken@v%inf
gow/05/139-gow.cat,139-gow3919,To this thei seiden alle yee:,To this thei seiden alle yee,8,u S u Su Su S,to@prep this@pron thei@pron%pl_nom seien@v1%pt_pl al@gram_adj ye@adv#n
gow/05/139-gow.cat,139-gow3920,"Anon thei weren ate See,",Anon thei weren ate See,8,uS u Su Su S,an-on@adv thei@pron%pl_nom ben@v%pt_pl atte@prep se@n1
gow/05/139-gow.cat,139-gow3921,"And alle, as who seith, at a word",And alle as who seith at a word,8,u Sx u S u S u S,and@conj al@gram_adjas_n as@conj who@pron%nom seien@v1%pr_3 at@prep a@indef_art word@n
gow/05/139-gow.cat,139-gow3922,"Thei gon withinne schipes bord,",Thei gon withinne schipes bord,8,u S uSu Su S,thei@pron%pl_nom gon@v%pr_pl with-inne@prep ship@n%gen bord@n
gow/05/139-gow.cat,139-gow3923,"The Sail goth up, and forth thei strauhte.",The Sail goth up and forth thei strauhte,8,u S u S u S u Sx,the@def_art seile@n gon@v%pr_3 up@adv and@conj forth@adv thei@pron%pl_nom strecchen@v%pt_pl
gow/05/139-gow.cat,139-gow3924,"Bot non espleit therof thei cauhte,",Bot non espleit therof thei cauhte,8,u S uS uS u Sx,but@conj non@gram_adj expleit@n ther-of@adv thei@pron%pl_nom cacchen@v%pt_pl
gow/05/139-gow.cat,139-gow3925,"And so thei tornen hom ayein,",And so thei tornen hom ayein,8,u S u Su S uS,and@conj so@adv thei@pron%pl_nom turnen@v%pr_pl hom@adv ayen@adv
gow/05/139-gow.cat,139-gow3926,For al that labour was in vein.,For al that labour was in vein,8,u S u Su S u S,for@conj al@gram_adj that@art&gram_adj labour@n ben@v%pt_3 in@prep vein@n
gow/05/139-gow.cat,139-gow3927,Jason to Grece with his preie,Jason to Grece with his preie,8,uS u Su S u S,jason@n#propn to@prep grece@n#propn with@prep his@pron1%gen preie@n2
gow/05/139-gow.cat,139-gow3928,Goth thurgh the See the rihte weie:,Goth thurgh the See the rihte weie,8,u S u S u Su S,gon@v%pr_3 thurgh@prep the@def_art se@n1 the@def_art right@adj wei@n
gow/05/139-gow.cat,139-gow3929,"Whan he ther com and men it tolde,",Whan he ther com and men it tolde,8,u S u S u S u Sx,whan@adv&conj he@pron1%nom ther@adv comen@v%pr_3 and@conj man@n%pl hit@pron tellen@v%pt_pl
gow/05/139-gow.cat,139-gow3930,Thei maden joie yonge and olde.,Thei maden joie yonge and olde,7,S uS u Sx u Sx,thei@pron%pl_nom maken@v1%pt_pl joie@n yong@adj and@conj olde@n
gow/05/139-gow.cat,139-gow3931,"Eson, whan that he wiste of this,",Eson whan that he wiste of this,8,uS u S u Sx u S,eson@n#propn whan@adv&conj that@part he@pron1%nom witen@v1%pt_3 of@prep this@pron
gow/05/139-gow.cat,139-gow3932,"Hou that his Sone comen is,",Hou that his Sone comen is,8,u S u Su Su S,hou@adv&conj that@part his@pron1%gen sone@n comen@v%ppl ben@v%pr_3
gow/05/139-gow.cat,139-gow3933,And hath achieved that he soughte,And hath achieved that he soughte,8,u S uSu S u Sx,and@conj haven@v%pr_3 acheven@v%ppl that@pron he@pron1%nom sechen@v%pt_3
gow/05/139-gow.cat,139-gow3934,"And hom with him Medea broughte,",And hom with him Medea broughte,8,u S u S uSu Sx,and@conj hom@adv with@prep him@pron%obj medea@n#propn bringen@v%pt_3
gow/05/139-gow.cat,139-gow3935,In al the wyde world was non,In al the wyde world was non,8,u S u Su S u S,in@prep al@gram_adj the@def_art wid@adj world@n ben@v%pt_3 non@pron
gow/05/139-gow.cat,139-gow3936,So glad a man as he was on.,So glad a man as he was on,8,u S u S u S u S,so@adv glad@adj a@indef_art man@n as@conj he@pron1%nom ben@v%pt_3 on@pron
