FILENAME,LINE_NUMBER,OG_TEXT,TEXT,NUM_SYBS,SCANSION,TAGGING
gow/07/225-gow.cat,225-gow3295,In a Cronique I finde also,In a Cronique I finde also,0,     ,in@prep a@indef_art cronike@n ich@pron%nom finden@v%pr_3 also@adv
gow/07/225-gow.cat,225-gow3296,"Of Siculus, which was ek so",Of Siculus which was ek so,8,u SuS u S u S,of@prep siculus@n#propn which@pron ben@v%pt_3 ek@adv so@adv
gow/07/225-gow.cat,225-gow3297,"A cruel king lich the tempeste,",A cruel king lich the tempeste,8,u Su S u S uSx,a@indef_art cruel@adj king@n like@prep the@def_art tempest@n
gow/07/225-gow.cat,225-gow3298,"The whom no Pite myhte areste, --",The whom no Pite myhte areste ,8,u S u Su Sx uSx,the@def_art whom@pron%obj no@gram_adj pite@n mouen@v3%pt_3 aresten@v%inf --@dash
gow/07/225-gow.cat,225-gow3299,"He was the ferste, as bokes seie,",He was the ferste as bokes seie,8,u S u Sx u Su S,he@pron1%nom ben@v%pt_3 the@def_art first@num_n as@conj bok@n1%pl seien@v1%pr_pl
gow/07/225-gow.cat,225-gow3300,Upon the See which fond Galeie,Upon the See which fond Galeie,8,uS u S u S uS,upon@prep the@def_art se@n1 which@pron finden@v%pt_3 galeie@n
gow/07/225-gow.cat,225-gow3301,"And let hem make for the werre, --",And let hem make for the werre ,8,u S u Su S u Sx,and@conj leten@v%pt_3 hem@pron%pl_obj maken@v1%inf for@prep the@def_art werre@n1 --@dash
gow/07/225-gow.cat,225-gow3302,As he which al was out of herre,As he which al was out of herre,8,u S u S u S u Sx,as@conj he@pron1%nom which@pron al@adv ben@v%pt_3 oute@adv of@prep herre@n1
gow/07/225-gow.cat,225-gow3303,Fro Pite and misericorde;,Fro Pite and misericorde,8,u Su S uSuSx,from@prep pite@n and@conj misericorde@n
gow/07/225-gow.cat,225-gow3304,"For therto couthe he noght acorde,",For therto couthe he noght acorde,8,u Su Sx u S uSx,for@conj ther-to@adv connen@v%pt_3 he@pron1%nom nought@adv accorden@v%inf
gow/07/225-gow.cat,225-gow3305,"Bot whom he myhte slen, he slouh,",Bot whom he myhte slen he slouh,8,u S u Su S u S,but@conj whom@pron%obj he@pron1%nom mouen@v3%pt_3 slen@v%inf he@pron1%nom slen@v%pt_3
gow/07/225-gow.cat,225-gow3306,And therof was he glad ynouh.,And therof was he glad ynouh,8,u Su S u S uS,and@conj ther-of@adv ben@v%pt_3 he@pron1%nom glad@adj inough@adv
gow/07/225-gow.cat,225-gow3307,"He hadde of conseil manyon,",He hadde of conseil manyon,8,u Su S uS uS,he@pron1%nom haven@v%pt_3 of@prep counseil@n mani_on@phr#n
gow/07/225-gow.cat,225-gow3308,"Among the whiche ther was on,",Among the whiche ther was on,8,uS u Su S u S,amonges@prep the@def_art which@pron ther@adv ben@v%pt_3 on@pron
gow/07/225-gow.cat,225-gow3309,Be name which Berillus hihte;,Be name which Berillus hihte,8,u Su S uSu Sx,bi@prep name@n which@pron berillus@n#propn hoten@v1%pt_3
gow/07/225-gow.cat,225-gow3310,And he bethoghte him hou he myhte,And he bethoghte him hou he myhte,8,u S uSx u S u Sx,and@conj he@pron1%nom bithinken@v%pt_3 him@pron%obj hou@adv&conj he@pron1%nom mouen@v3%pt_3
gow/07/225-gow.cat,225-gow3311,"Unto the tirant do likinge,",Unto the tirant do likinge,8,uS u Su S uSx,unto@prep the@def_art tiraunt@n don@v1%inf likinge@ger1
gow/07/225-gow.cat,225-gow3312,And of his oghne ymaginynge,And of his oghne ymaginynge,8,u S u Sx uSuSx,and@conj of@prep his@pron1%gen ouen@adj imagininge@ger
gow/07/225-gow.cat,225-gow3313,"Let forge and make a Bole of bras,",Let forge and make a Bole of bras,8,u Sx u Sx u Sx u S,leten@v%pt_3 forgen@v%inf and@conj maken@v1%inf a@indef_art bole@n1 of@prep bras@n
gow/07/225-gow.cat,225-gow3314,And on the side cast ther was,And on the side cast ther was,8,u S u Su S u S,and@conj on@prep the@def_art side@n casten@v%ppl ther@adv ben@v%pt_3
gow/07/225-gow.cat,225-gow3315,"A Dore, wher a man mai inne,",A Dore wher a man mai inne,8,u Su S u S u Sx,a@indef_art dore@n1 wher@adv&conj a@indef_art man@n mouen@v3%pr_3 inne@adv
gow/07/225-gow.cat,225-gow3316,Whan he his peine schal beginne,Whan he his peine schal beginne,8,u S u Su S uSx,whan@adv&conj he@pron1%nom his@pron1%gen peine@n shulen@v1%pr_3 biginnen@v%inf
gow/07/225-gow.cat,225-gow3317,"Thurgh fyr, which that men putten under.",Thurgh fyr which that men putten under,8,u S u S u Su Sx,thurgh@prep fir@n which@pron that@pron man@n%pl putten@v%pr_pl under@adv
gow/07/225-gow.cat,225-gow3318,"And al this dede he for a wonder,",And al this dede he for a wonder,8,u S u Sx u S u Sx,and@conj al@gram_adj this@pron don@v1%pt_3 he@pron1%nom for@prep a@indef_art wonder@n
gow/07/225-gow.cat,225-gow3319,"That whanne a man for peine cride,",That whanne a man for peine cride,8,u Sx u S u Su Sx,that@conj whan@adv&conj a@indef_art man@n for@prep peine@n crien@v%pt_3
gow/07/225-gow.cat,225-gow3320,"The Bole of bras, which gapeth wyde,",The Bole of bras which gapeth wyde,8,u Sx u S u Su Sx,the@def_art bole@n1 of@prep bras@n which@pron gapen@v%pr_3 wide@adv
gow/07/225-gow.cat,225-gow3321,It scholde seme as thogh it were,It scholde seme as thogh it were,8,u Su Sx u S u Sx,hit@pron shulen@v1%pt_3 semen@v2%inf as@conj though@conj hit@pron ben@v%pt_3
gow/07/225-gow.cat,225-gow3322,"A belwinge in a mannes Ere,",A belwinge in a mannes Ere,8,u Sux S u Su Sx,a@indef_art belwing@ger in@prep a@indef_art man@n%gen ere@n1
gow/07/225-gow.cat,225-gow3323,And noght the criinge of a man.,And noght the criinge of a man,8,u S u Su S u S,and@conj nought@adv the@def_art criing@ger of@prep a@indef_art man@n
gow/07/225-gow.cat,225-gow3324,"Bot he which alle sleihtes can,",Bot he which alle sleihtes can,8,u S u Su Su S,but@conj he@pron1%nom which@pron al@gram_adj sleight@n%pl connen@v%pr_3
gow/07/225-gow.cat,225-gow3325,"The devel, that lith in helle fast,",The devel that lith in helle fast,8,u Su S u S ux S,the@def_art devel@n that@pron lien@v1%pr_3 in@prep helle@n faste@adv
gow/07/225-gow.cat,225-gow3326,"Him that this caste hath overcast,",Him that this caste hath overcast,8,u S u Sx u SuS,him@pron%obj that@pron this@gram_adj cast@n haven@v%pr_3 overcasten@v%ppl
gow/07/225-gow.cat,225-gow3327,That for a trespas which he dede,That for a trespas which he dede,8,u S u Su S u Sx,that@conj for@prep a@indef_art trespas@n which@pron he@pron1%nom don@v1%pt_3
gow/07/225-gow.cat,225-gow3328,"He was putt in the same stede,",He was putt in the same stede,8,u S u S u Su Sx,he@pron1%nom ben@v%pt_3 putten@v%ppl in@prep the@def_art same@gram_adj stede@n1
gow/07/225-gow.cat,225-gow3329,And was himself the ferste of alle,And was himself the ferste of alle,8,u S uS u Sx u Sx,and@conj ben@v%pt_3 him-self@pron the@def_art first@num_n of@prep al@gram_adjas_n
gow/07/225-gow.cat,225-gow3330,Which was into that peine falle,Which was into that peine falle,8,u S uS u Su Sx,which@pron ben@v%pt_3 in-to@prep that@art&gram_adj peine@n fallen@v%ppl
gow/07/225-gow.cat,225-gow3331,That he for othre men ordeigneth;,That he for othre men ordeigneth,8,u S u Sx u SuS,that@conj he@pron1%nom for@prep other@gram_adj man@n%pl ordeinen@v%pr_3
gow/07/225-gow.cat,225-gow3332,Ther was noman which him compleigneth.,Ther was noman which him compleigneth,8,u S uS u S uSx,ther@adv ben@v%pt_3 no-man@n which@pron him@pron%obj compleinen@v%pr_3
gow/07/225-gow.cat,225-gow3333,Of tirannie and crualte,Of tirannie and crualte,7,S uSu S uSx,of@prep tirannie@n and@conj cruelte@n
gow/07/225-gow.cat,225-gow3334,"Be this ensample a king mai se,",Be this ensample a king mai se,8,u S uSx u S u S,bi@prep this@gram_adj ensaumple@n a@indef_art king@n mouen@v3%pr_3 sen@v1%inf
gow/07/225-gow.cat,225-gow3335,"Himself and ek his conseil bothe,",Himself and ek his conseil bothe,8,uS u S u Su Sx,him-self@pron and@conj ek@adv his@pron1%gen counseil@n bothe@num_conj
gow/07/225-gow.cat,225-gow3336,Hou thei ben to mankinde lothe,Hou thei ben to mankinde lothe,8,u S u S uSu Sx,hou@adv&conj thei@pron%pl_nom ben@v%pr_pl to@prep man-kinde@n loth@adj
gow/07/225-gow.cat,225-gow3337,And to the god abhominable.,And to the god abhominable,8,u S u S uSuSx,and@conj to@prep the@def_art god@n1 abhominable@adj
gow/07/225-gow.cat,225-gow3338,Ensamples that ben concordable,Ensamples that ben concordable,8,uSu S u SuSx,ensaumple@n%pl that@pron ben@v%pr_pl concordable@adj
gow/07/225-gow.cat,225-gow3339,"I finde of othre Princes mo,",I finde of othre Princes mo,8,u Sx u Su Su S,ich@pron%nom finden@v%pr_1 of@prep other@gram_adj prince@n%pl mo@n
gow/07/225-gow.cat,225-gow3340,"As thou schalt hiere, of time go.",As thou schalt hiere of time go,8,u S u Sux S ux S,as@conj thou@pron%nom shulen@v1%pr_2 heren@v%inf of@prep time@n gon@v#adj%ppl
