OG_RIV_TEXT,OG_OXFORD_TEXT,RIVERSIDE_FILENAME,OXFORD_FILENAME,OUTPUT_FILENAME,LINE_NUMBER,MATCH,RIVERSIDE_SYLLABLES,OXFORD_SYLLABLES,RIVERSIDE_TEXT,OXFORD_TEXT,RIVERSIDE_SCANSION,OXFORD_SCANSION,RIVERSIDE_TAGGING,OXFORD_TAGGING,FLAG_COLOR
And whan this knyght hath thus his tale toold,¶And whan this knight hath thus his tale told,data/riverside_cats/SqT_riv.cat,data/oxford_txts/SqT_oxford.txt,data/csvs/SqT,The Squire's Tale 168,,10,10,And whan this knyght hath thus his tale toold,And whan this knight hath thus his tale told,u S u S u S u Su S,u S u S u S u Su S,and@conj whan@adv&conj this@gram_adj knight@n haven@v%pr_3 thus@adv his@pron1%gen tale@n tellen@v%ppl,and@conj whan@adv&conj this@gram_adj knight@n haven@v%pr_3 thus@adv his@pron1%gen tale@n tellen@v%ppl,
He rideth out of halle and doun he lighte.,"He rideth out of halle, and doun he lighte.°",data/riverside_cats/SqT_riv.cat,data/oxford_txts/SqT_oxford.txt,data/csvs/SqT,The Squire's Tale 169,,10,10,He rideth out of halle and doun he lighte,He rideth out of halle and doun he lighte,u Su S u Sx u S u Sx,u Su S u Sx u S u Sx,he@pron1%nom riden@v%pr_3 oute@adv#prep of@prep halle@n and@conj doun@adv he@pron1%nom lighten@v2%pt_3,he@pron1%nom riden@v%pr_3 oute@adv#prep of@prep halle@n and@conj doun@adv he@pron1%nom lighten@v2%pt_3,
"His steede, which that shoon as sonne brighte","His stede, which that shoon as sonne brighte",data/riverside_cats/SqT_riv.cat,data/oxford_txts/SqT_oxford.txt,data/csvs/SqT,The Squire's Tale 170,,10,10,His steede which that shoon as sonne brighte,His stede which that shoon as sonne brighte,u Su S u S u Su Sx,u Su S u S u Su Sx,his@pron1%gen stede@n2 which@pron that@pron shinen@v%pt_3 as@conj sonne@n bright@adj,his@pron1%gen stede@n2 which@pron that@pron shinen@v%pt_3 as@conj sonne@n bright@adj,
"Stant in the court, stille as any stoon.","Stant° in the court,° as stille as any stoon.",data/riverside_cats/SqT_riv.cat,data/oxford_txts/SqT_oxford.txt,data/csvs/SqT,The Squire's Tale 171,DIFF,9,10,Stant in the court stille as any stoon,Stant in the court as stille as any stoon,S u S u Sx u Su S,u S u S u Sx u Su S,stonden@v1%pr_3 in@prep the@def_art court@n1 stille@adv as@conj ani@gram_adj ston@n,stonden@v1%pr_3 in@prep the@def_art court@n1 as@conj stille@adv as@conj ani@gram_adj ston@n,green
This knyght is to his chambre lad anoon,This knight is to his chambre lad anon,data/riverside_cats/SqT_riv.cat,data/oxford_txts/SqT_oxford.txt,data/csvs/SqT,The Squire's Tale 172,,10,10,This knyght is to his chambre lad anoon,This knight is to his chambre lad anon,u S u S u Su S uS,u S u S u Su S uS,this@gram_adj knight@n ben@v%pr_3 to@prep his@pron1%gen chaumbre@n leden@v1%ppl an-on@adv,this@gram_adj knight@n ben@v%pr_3 to@prep his@pron1%gen chaumbre@n leden@v1%ppl an-on@adv,
"And is unarmed, and to mete yset.",And is unarmed° and unto mete° yset.°,data/riverside_cats/SqT_riv.cat,data/oxford_txts/SqT_oxford.txt,data/csvs/SqT,The Squire's Tale 173,DIFF,10,10,And is unarmed and to mete yset,And is unarmed and unto mete yset,u S uSu S u Sx uS,u S uSx u Su Sx uS,and@conj ben@v%pr_3 unarmen@v%ppl and@conj to@prep mete@n1 isetten@v%ppl,and@conj ben@v%pr_3 unarmen@v%ppl and@conj unto@prep mete@n1 isetten@v%ppl,green
The presentes been ful roially yfet --,"The presentes ben ful royally yfet,°",data/riverside_cats/SqT_riv.cat,data/oxford_txts/SqT_oxford.txt,data/csvs/SqT,The Squire's Tale 174,,10,10,The presentes been ful roially yfet,The presentes ben ful royally yfet,u SuS u S uS uS,u Sux S u SuS uS,the@def_art presente@n2%pl ben@v%pr_pl ful@adv roialli@adv fetten@v%ppl --@dash,the@def_art presente@n2%pl ben@v%pr_pl ful@adv roialli@adv fetten@v%ppl --@dash,
"This is to seyn, the swerd and the mirour --","This is to seyn, the swerd and the mirour",data/riverside_cats/SqT_riv.cat,data/oxford_txts/SqT_oxford.txt,data/csvs/SqT,The Squire's Tale 175,,10,10,This is to seyn the swerd and the mirour,This is to seyn the swerd and the mirour,u S u S u S u S uS,u S u S u S u S uS,this@pron ben@v%pr_3 to@part seien@v1%inf the@def_art sword@n and@conj the@def_art mirour@n --@dash,this@pron ben@v%pr_3 to@part seien@v1%inf the@def_art sword@n and@conj the@def_art mirour@n --@dash,
And born anon into the heighe tour,And born anon° into the heighe tour,data/riverside_cats/SqT_riv.cat,data/oxford_txts/SqT_oxford.txt,data/csvs/SqT,The Squire's Tale 176,,10,10,And born anon into the heighe tour,And born anon into the heighe tour,u S uS uS u Su S,u S uS uS u Su S,and@conj beren@v1%ppl an-on@adv in-to@prep the@def_art heigh@adj tour@n1,and@conj beren@v1%ppl an-on@adv in-to@prep the@def_art heigh@adj tour@n1,
With certeine officers ordeyned therfore;,With certeine officers ordeined° therfore;°,data/riverside_cats/SqT_riv.cat,data/oxford_txts/SqT_oxford.txt,data/csvs/SqT,The Squire's Tale 177,,10,10,With certeine officers ordeyned therfore,With certeine officers ordeined therfore,u Sux SuS uSx uSx,u Sux SuS uSx uSx,with@prep certain@adj officer@n%pl ordeinen@v%ppl_abs ther-fore@adv,with@prep certain@adj officer@n%pl ordeinen@v%ppl_abs ther-fore@adv,
And unto Canacee this ryng is bore,And unto Canacee this ring was bore°,data/riverside_cats/SqT_riv.cat,data/oxford_txts/SqT_oxford.txt,data/csvs/SqT,The Squire's Tale 178,DIFF,10,10,And unto Canacee this ryng is bore,And unto Canacee this ring was bore,u Su SuS u S u Sx,u Su SuS u S u Sx,and@conj unto@prep canacee@n1#propn this@gram_adj ring@n ben@v%pr_3 beren@v1%ppl,and@conj unto@prep canacee@n1#propn this@gram_adj ring@n ben@v%pt_3 beren@v1%ppl,green
"Solempnely, ther she sit at the table.","Solempnely, ther° she sit at the table.",data/riverside_cats/SqT_riv.cat,data/oxford_txts/SqT_oxford.txt,data/csvs/SqT,The Squire's Tale 179,,10,10,Solempnely ther she sit at the table,Solempnely ther she sit at the table,uSuS u S u S u Sx,uSuS u S u S u Sx,solempneli@adv ther@adv she@pron%nom sitten@v%pr_3 at@prep the@def_art table@n,solempneli@adv ther@adv she@pron%nom sitten@v%pr_3 at@prep the@def_art table@n,
"But sikerly, withouten any fable","But sikerly, withouten any fable,°",data/riverside_cats/SqT_riv.cat,data/oxford_txts/SqT_oxford.txt,data/csvs/SqT,The Squire's Tale 180,,10,10,But sikerly withouten any fable,But sikerly withouten any fable,u SuS uSu Su Sx,u SuS uSu Su Sx,but@conj sikerli@adv withouten@prep ani@gram_adj fable@n,but@conj sikerli@adv withouten@prep ani@gram_adj fable@n,
"The hors of bras, that may nat be remewed","The hors of bras, that may nat be remewed,°",data/riverside_cats/SqT_riv.cat,data/oxford_txts/SqT_oxford.txt,data/csvs/SqT,The Squire's Tale 181,,10,10,The hors of bras that may nat be remewed,The hors of bras that may nat be remewed,u S u S u S u S uSx,u S u S u S u S uSx,the@def_art hors@n of@prep bras@n that@pron mouen@v3%pr_3 not@adv ben@v%inf remuen@v%ppl,the@def_art hors@n of@prep bras@n that@pron mouen@v3%pr_3 not@adv ben@v%inf remuen@v%ppl,
It stant as it were to the ground yglewed.,It stant as it were to the ground yglewed.°,data/riverside_cats/SqT_riv.cat,data/oxford_txts/SqT_oxford.txt,data/csvs/SqT,The Squire's Tale 182,,10,10,It stant as it were to the ground yglewed,It stant as it were to the ground yglewed,u S u S ux S u S uSx,u S u S ux S u S uSx,hit@pron stonden@v1%pr_3 as@conj hit@pron ben@v%pt_3 to@prep the@def_art ground@n gleuen@v2%ppl,hit@pron stonden@v1%pr_3 as@conj hit@pron ben@v%pt_3 to@prep the@def_art ground@n gleuen@v2%ppl,
Ther may no man out of the place it dryve,Ther° may no man out of the place it drive°,data/riverside_cats/SqT_riv.cat,data/oxford_txts/SqT_oxford.txt,data/csvs/SqT,The Squire's Tale 183,,10,10,Ther may no man out of the place it dryve,Ther may no man out of the place it drive,u S u S u S u Sx u Sx,u S u S u S u Sx u Sx,ther@adv mouen@v3%pr_3 no@gram_adj man@n oute@adv#prep of@prep the@def_art place@n hit@pron driven@v%inf,ther@adv mouen@v3%pr_3 no@gram_adj man@n oute@adv#prep of@prep the@def_art place@n hit@pron driven@v%inf,
For noon engyn of wyndas or polyve;,For noon engin° of windas° or polive;°,data/riverside_cats/SqT_riv.cat,data/oxford_txts/SqT_oxford.txt,data/csvs/SqT,The Squire's Tale 184,,10,10,For noon engyn of wyndas or polyve,For noon engin of windas or polive,u S uS u Su S uSx,u S uS u Su S uSx,for@prep non@gram_adj engin@n of@prep windas@n or@conj puli@n,for@prep non@gram_adj engin@n of@prep windas@n or@conj puli@n,
And cause why? For they kan nat the craft.,"And cause° why, for they can nat the craft.°",data/riverside_cats/SqT_riv.cat,data/oxford_txts/SqT_oxford.txt,data/csvs/SqT,The Squire's Tale 185,,10,10,And cause why For they kan nat the craft,And cause why for they can nat the craft,u Su S u S u S u S,u Su S u S u S u S,and@conj cause@n whi@pron for@conj thei@pron%pl_nom connen@v%pr_pl not@adv the@def_art craft@n1,and@conj cause@n whi@pron for@conj thei@pron%pl_nom connen@v%pr_pl not@adv the@def_art craft@n1,
And therfore in the place they han it laft,And therefore in the place they han it laft,data/riverside_cats/SqT_riv.cat,data/oxford_txts/SqT_oxford.txt,data/csvs/SqT,The Squire's Tale 186,,10,10,And therfore in the place they han it laft,And therefore in the place they han it laft,u Sux S u Sx u S u S,u xSux S u Sx u S u S,and@conj ther-fore@adv in@prep the@def_art place@n thei@pron%pl_nom haven@v%pr_pl hit@pron leven@v1%ppl,and@conj ther-fore@adv in@prep the@def_art place@n thei@pron%pl_nom haven@v%pr_pl hit@pron leven@v1%ppl,
Til that the knyght hath taught hem the manere,Til that the knight hath taught hem the manere,data/riverside_cats/SqT_riv.cat,data/oxford_txts/SqT_oxford.txt,data/csvs/SqT,The Squire's Tale 187,,10,10,Til that the knyght hath taught hem the manere,Til that the knight hath taught hem the manere,u S u S u S u S uSx,u S u S u S u S uSx,til@conj that@conj the@def_art knight@n haven@v%pr_3 techen@v%ppl hem@pron%pl_obj the@def_art manere@n,til@conj that@conj the@def_art knight@n haven@v%pr_3 techen@v%ppl hem@pron%pl_obj the@def_art manere@n,
"To voyden hym, as ye shal after heere.","To voiden° him, as ye shal after here.",data/riverside_cats/SqT_riv.cat,data/oxford_txts/SqT_oxford.txt,data/csvs/SqT,The Squire's Tale 188,,10,10,To voyden hym as ye shal after heere,To voiden him as ye shal after here,u Su S u S u Su Sx,u Su S u S u Su Sx,to@part voiden@v%inf him@pron%obj as@conj ye@pron%pl_nom shulen@v1%pr_pl after@adv heren@v%inf,to@part voiden@v%inf him@pron%obj as@conj ye@pron%pl_nom shulen@v1%pr_pl after@adv heren@v%inf,
Greet was the prees that swarmeth to and fro,"¶Greet was the prees,° that swarmeth to and fro",data/riverside_cats/SqT_riv.cat,data/oxford_txts/SqT_oxford.txt,data/csvs/SqT,The Squire's Tale 189,,10,10,Greet was the prees that swarmeth to and fro,Greet was the prees that swarmeth to and fro,u S u S u Su S u S,u S u S u Su S u S,gret@adj ben@v%pt_3 the@def_art presse@n that@pron swarmen@v%pr_3 to@adv1 and@conj from@adv,gret@adj ben@v%pt_3 the@def_art presse@n that@pron swarmen@v%pr_3 to@adv1 and@conj from@adv,
To gauren on this hors that stondeth so,To gauren on° this hors that stondeth so;,data/riverside_cats/SqT_riv.cat,data/oxford_txts/SqT_oxford.txt,data/csvs/SqT,The Squire's Tale 190,,10,10,To gauren on this hors that stondeth so,To gauren on this hors that stondeth so,u Su S u S u Su S,u Su S u S u Su S,to@part gauren@v%inf on@prep this@gram_adj hors@n that@pron stonden@v1%pr_3 so@adv,to@part gauren@v%inf on@prep this@gram_adj hors@n that@pron stonden@v1%pr_3 so@adv,
"For it so heigh was, and so brood and long","For it so heigh was, and so brood and long",data/riverside_cats/SqT_riv.cat,data/oxford_txts/SqT_oxford.txt,data/csvs/SqT,The Squire's Tale 191,,10,10,For it so heigh was and so brood and long,For it so heigh was and so brood and long,u S u S u S u S u S,u S u S u S u S u S,for@conj hit@pron so@adv heigh@adj ben@v%pt_3 and@conj so@adv brod@adj and@conj long@adj1,for@conj hit@pron so@adv heigh@adj ben@v%pt_3 and@conj so@adv brod@adj and@conj long@adj1,
So wel proporcioned for to been strong,So wel proporcioned for to ben strong,data/riverside_cats/SqT_riv.cat,data/oxford_txts/SqT_oxford.txt,data/csvs/SqT,The Squire's Tale 192,,10,10,So wel proporcioned for to been strong,So wel proporcioned for to ben strong,u S uSuSx u S u S,u S uSuSx u S u S,so@adv wel@adv proporciounen@v#adj%ppl for@prep#adv to@part ben@v%inf strong@adj,so@adv wel@adv proporciounen@v#adj%ppl for@prep#adv to@part ben@v%inf strong@adj,
Right as it were a steede of Lumbardye;,Right as it were a stede of Lumbardie;,data/riverside_cats/SqT_riv.cat,data/oxford_txts/SqT_oxford.txt,data/csvs/SqT,The Squire's Tale 193,,0,10,Right as it were a steede of Lumbardye,Right as it were a stede of Lumbardie,"       ",u S u Sx u Sx u SuS,righte@adv as@conj hit@pron ben@v%pt_3 a@indef_art stede@n2 of@prep lombardie@n#propn,righte@adv as@conj hit@pron ben@v%pt_3 a@indef_art stede@n2 of@prep lombardie@n#propn,
"Therwith so horsly, and so quyk of ye","Therwith so horsly,° and so quik of eye",data/riverside_cats/SqT_riv.cat,data/oxford_txts/SqT_oxford.txt,data/csvs/SqT,The Squire's Tale 194,,10,10,Therwith so horsly and so quyk of ye,Therwith so horsly and so quik of eye,uS u Su S u S u S,uS u Su S u S u S,ther-with@adv so@adv horsli@adj and@conj so@adv quik@adj of@prep eie@n1,ther-with@adv so@adv horsli@adj and@conj so@adv quik@adj of@prep eie@n1,
As it a gentil Poilleys courser were.,As it a gentil Poileis° courser° were.,data/riverside_cats/SqT_riv.cat,data/oxford_txts/SqT_oxford.txt,data/csvs/SqT,The Squire's Tale 195,,10,10,As it a gentil Poilleys courser were,As it a gentil Poileis courser were,u S u Su Su Su Sx,u S u Su Su Su Sx,as@conj hit@pron a@indef_art gentil@adj poileis@adj courser@n ben@v%pt_3,as@conj hit@pron a@indef_art gentil@adj poileis@adj courser@n ben@v%pt_3,
"For certes, fro his tayl unto his ere","For certes, fro his tail unto his ere",data/riverside_cats/SqT_riv.cat,data/oxford_txts/SqT_oxford.txt,data/csvs/SqT,The Squire's Tale 196,,10,10,For certes fro his tayl unto his ere,For certes fro his tail unto his ere,u Su S u S uS u Sx,u Su S u S uS u Sx,for@conj certes@adv from@prep his@pron1%gen tail@n unto@prep his@pron1%gen ere@n1,for@conj certes@adv from@prep his@pron1%gen tail@n unto@prep his@pron1%gen ere@n1,
Nature ne art ne koude hym nat amende,Nature ne art ne coude him nat amende°,data/riverside_cats/SqT_riv.cat,data/oxford_txts/SqT_oxford.txt,data/csvs/SqT,The Squire's Tale 197,,10,10,Nature ne art ne koude hym nat amende,Nature ne art ne coude him nat amende,uSx u S u Sx u S uSx,uSx u S u Sx u S uSx,nature@n#propn ne@conj1 art@n1 ne@adv connen@v%pt_3 him@pron%obj not@adv amenden@v%inf,nature@n#propn ne@conj1 art@n1 ne@adv connen@v%pt_3 him@pron%obj not@adv amenden@v%inf,
"In no degree, as al the people wende.","In no degree, as al the peple wende.°",data/riverside_cats/SqT_riv.cat,data/oxford_txts/SqT_oxford.txt,data/csvs/SqT,The Squire's Tale 198,,10,10,In no degree as al the people wende,In no degree as al the peple wende,u S uS u S u Su Sx,u S uS u S u Su Sx,in@prep no@gram_adj degre@n as@conj al@gram_adj the@def_art peple@n wenen@v2%pt_3,in@prep no@gram_adj degre@n as@conj al@gram_adj the@def_art peple@n wenen@v2%pt_3,
But everemoore hir mooste wonder was,But evermore hir° moste° wonder was,data/riverside_cats/SqT_riv.cat,data/oxford_txts/SqT_oxford.txt,data/csvs/SqT,The Squire's Tale 199,,10,10,But everemoore hir mooste wonder was,But evermore hir moste wonder was,u SuSux S ux Su S,u SuSx u Su Su S,but@conj ever-mor@adv here@pron%pl_gen most@adj%sup wonder@n ben@v%pt_3,but@conj ever-mor@adv here@pron%pl_gen most@adj%sup wonder@n ben@v%pt_3,
"How that it koude gon, and was of bras;","How that it coude goon,° and was of bras;",data/riverside_cats/SqT_riv.cat,data/oxford_txts/SqT_oxford.txt,data/csvs/SqT,The Squire's Tale 200,,10,10,How that it koude gon and was of bras,How that it coude goon and was of bras,u S u Su S u S u S,u S u Su S u S u S,hou@adv&conj that@part hit@pron connen@v%pt_3 gon@v%inf and@conj ben@v%pt_3 of@prep bras@n,hou@adv&conj that@part hit@pron connen@v%pt_3 gon@v%inf and@conj ben@v%pt_3 of@prep bras@n,
"It was a fairye, as the peple semed.","It was of Fairie,° as the peple semed.°",data/riverside_cats/SqT_riv.cat,data/oxford_txts/SqT_oxford.txt,data/csvs/SqT,The Squire's Tale 201,DIFF,10,10,It was a fairye as the peple semed,It was of Fairie as the peple semed,u S u Su S u Sx uS,u S u Su S u Sx uS,hit@pron ben@v%pt_3 a@indef_art fairie@n as@conj the@def_art peple@n semen@v2%pt_3,hit@pron ben@v%pt_3 of@prep fairie@n as@conj the@def_art peple@n semen@v2%pt_3,green
Diverse folk diversely they demed;,Diverse folk diversely they demed;°,data/riverside_cats/SqT_riv.cat,data/oxford_txts/SqT_oxford.txt,data/csvs/SqT,The Squire's Tale 202,,10,10,Diverse folk diversely they demed,Diverse folk diversely they demed,uSx u SuSu S uS,uSx u SuSu S uS,diverse@adj folk@n diverseli@adv thei@pron%pl_nom demen@v%pt_pl,diverse@adj folk@n diverseli@adv thei@pron%pl_nom demen@v%pt_pl,
"As many heddes, as manye wittes ther been.","As many hedes, as many wittes° ther been.",data/riverside_cats/SqT_riv.cat,data/oxford_txts/SqT_oxford.txt,data/csvs/SqT,The Squire's Tale 203,,10,10,As many heddes as manye wittes ther been,As many hedes as many wittes ther been,u Su Sx u Su Sx u S,u Su Sx u Su Sx u S,as@conj mani@gram_adj hed@n1%pl as@conj mani@gram_adj wit@n%pl ther@adv ben@v%pr_pl,as@conj mani@gram_adj hed@n1%pl as@conj mani@gram_adj wit@n%pl ther@adv ben@v%pr_pl,
They murmureden as dooth a swarm of been,"They murmureden as dooth a swarm of been,°",data/riverside_cats/SqT_riv.cat,data/oxford_txts/SqT_oxford.txt,data/csvs/SqT,The Squire's Tale 204,,10,10,They murmureden as dooth a swarm of been,They murmureden as dooth a swarm of been,u SuSx u S u S u S,u SuSx u S u S u S,thei@pron%pl_nom murmuren@v%pt_pl as@conj don@v1%pr_3 a@indef_art swarm@n of@prep be@n,thei@pron%pl_nom murmuren@v%pt_pl as@conj don@v1%pr_3 a@indef_art swarm@n of@prep be@n,
And maden skiles after hir fantasies,"And maden skiles° after° hir fantasies,°",data/riverside_cats/SqT_riv.cat,data/oxford_txts/SqT_oxford.txt,data/csvs/SqT,The Squire's Tale 205,,10,10,And maden skiles after hir fantasies,And maden skiles after hir fantasies,u Su Sx ux S uSuS,u Su Sx ux S uSuS,and@conj maken@v1%pt_pl skil@n%pl after@prep here@pron%pl_gen fantasie@n%pl,and@conj maken@v1%pt_pl skil@n%pl after@prep here@pron%pl_gen fantasie@n%pl,
Rehersynge of thise olde poetries,"Rehersinge of° thise olde poetries,°",data/riverside_cats/SqT_riv.cat,data/oxford_txts/SqT_oxford.txt,data/csvs/SqT,The Squire's Tale 206,,10,10,Rehersynge of thise olde poetries,Rehersinge of thise olde poetries,uSux S ux Sx uSuS,uSux S ux Sx uSuS,rehersen@v%prp_abs of@prep these@gram_adj%pl olde@adj poetrie@n%pl,rehersen@v%prp_abs of@prep these@gram_adj%pl olde@adj poetrie@n%pl,
And seyden it was lyk the Pegasee,"And seiden, it was lik the Pegasee,°",data/riverside_cats/SqT_riv.cat,data/oxford_txts/SqT_oxford.txt,data/csvs/SqT,The Squire's Tale 207,,10,10,And seyden it was lyk the Pegasee,And seiden it was lik the Pegasee,u Su S u S u SuS,u Su S u S u SuS,and@conj seien@v1%pt_pl hit@pron ben@v%pt_3 like@prep the@def_art pegase@n#propn,and@conj seien@v1%pt_pl hit@pron ben@v%pt_3 like@prep the@def_art pegase@n#propn,
The hors that hadde wynges for to flee;,The hors that hadde winges for to flee;°,data/riverside_cats/SqT_riv.cat,data/oxford_txts/SqT_oxford.txt,data/csvs/SqT,The Squire's Tale 208,,10,10,The hors that hadde wynges for to flee,The hors that hadde winges for to flee,u S u Su Su S u S,u S u Su Su S u S,the@def_art hors@n that@pron haven@v%pt_3 wing@n%pl for@prep#adv to@part flien@v%inf,the@def_art hors@n that@pron haven@v%pt_3 wing@n%pl for@prep#adv to@part flien@v%inf,
Or elles it was the Grekes hors Synon,"Or elles it was the Grekes hors Sinon,°",data/riverside_cats/SqT_riv.cat,data/oxford_txts/SqT_oxford.txt,data/csvs/SqT,The Squire's Tale 209,,10,10,Or elles it was the Grekes hors Synon,Or elles it was the Grekes hors Sinon,u Su S u S ux S uS,u Su S u S ux S uS,or@conj elles@adv hit@pron ben@v%pt_3 the@def_art grek@n%pl hors@n sinoun@n#propn,or@conj elles@adv hit@pron ben@v%pt_3 the@def_art grek@n%pl hors@n sinoun@n#propn,
That broghte Troie to destruccion,That broghte Troye to destruccion,data/riverside_cats/SqT_riv.cat,data/oxford_txts/SqT_oxford.txt,data/csvs/SqT,The Squire's Tale 210,,10,10,That broghte Troie to destruccion,That broghte Troye to destruccion,u Su Su S uSuS,u Su Su S uSuS,that@pron bringen@v%pt_3 troie@n1#propn to@prep destruccioun@n,that@pron bringen@v%pt_3 troie@n1#propn to@prep destruccioun@n,
As men in thise olde geestes rede.,As men may in thise olde gestes° rede,data/riverside_cats/SqT_riv.cat,data/oxford_txts/SqT_oxford.txt,data/csvs/SqT,The Squire's Tale 211,DIFF,10,10,As men in thise olde geestes rede,As men may in thise olde gestes rede,u S u Su Su Su Sx,u S u S ux Su Su Sx,as@conj man@n%pl in@prep these@gram_adj%pl olde@adj geste@n1%pl reden@v1%pr_pl,as@conj man@n%pl mouen@v3%pr_pl in@prep these@gram_adj%pl olde@adj geste@n1%pl reden@v1%pr_pl,green
"Myn herte,"""" quod oon, """"is everemoore in drede;","“Min herte,” quod oon, “is evermore in drede;",data/riverside_cats/SqT_riv.cat,data/oxford_txts/SqT_oxford.txt,data/csvs/SqT,The Squire's Tale 212,,10,10,Myn herte quod oon is everemoore in drede,Min herte quod oon is evermore in drede,u Sx u S u SuSux S xx,u Sx u S u SuSx u Sx,min@pron%gen herte@n quethen@v%pt_3 on@pron ben@v%pr_3 ever-mor@adv in@prep drede@n,min@pron%gen herte@n quethen@v%pt_3 on@pron ben@v%pr_3 ever-mor@adv in@prep drede@n,
I trowe som men of armes been therinne,I trowe som men of armes been therinne,data/riverside_cats/SqT_riv.cat,data/oxford_txts/SqT_oxford.txt,data/csvs/SqT,The Squire's Tale 213,,10,10,I trowe som men of armes been therinne,I trowe som men of armes been therinne,u Sx u S u Su S uSx,u Sx u S u Su S uSx,ich@pron%nom trouen@v%pr_1 som@gram_adj man@n%pl of@prep armes@n%pl ben@v%pr_pl ther-inne@adv,ich@pron%nom trouen@v%pr_1 som@gram_adj man@n%pl of@prep armes@n%pl ben@v%pr_pl ther-inne@adv,
That shapen hem this citee for to wynne.,That shapen hem° this citee for to winne.,data/riverside_cats/SqT_riv.cat,data/oxford_txts/SqT_oxford.txt,data/csvs/SqT,The Squire's Tale 214,,10,10,That shapen hem this citee for to wynne,That shapen hem this citee for to winne,u Su S u Su S u Sx,u Su S u Su S u Sx,that@pron shapen@v%pr_pl hem@pron%pl_obj this@gram_adj cite@n for@prep#adv to@part winnen@v%inf,that@pron shapen@v%pr_pl hem@pron%pl_obj this@gram_adj cite@n for@prep#adv to@part winnen@v%inf,
It were right good that al swich thyng were knowe.,It were right good that al swich thing were knowe.”,data/riverside_cats/SqT_riv.cat,data/oxford_txts/SqT_oxford.txt,data/csvs/SqT,The Squire's Tale 215,,10,10,It were right good that al swich thyng were knowe,It were right good that al swich thing were knowe,u Sx u S u S u S ux Sx,u Sx u S u S u S ux Sx,hit@pron ben@v%pt_3 righte@adv god@adj that@conj al@gram_adj swich@gram_adj thing@n ben@v%pt_3 knouen@v%ppl,hit@pron ben@v%pt_3 righte@adv god@adj that@conj al@gram_adj swich@gram_adj thing@n ben@v%pt_3 knouen@v%ppl,
Another rowned to his felawe lowe,Another rowned° to his felawe lowe,data/riverside_cats/SqT_riv.cat,data/oxford_txts/SqT_oxford.txt,data/csvs/SqT,The Squire's Tale 216,,10,10,Another rowned to his felawe lowe,Another rowned to his felawe lowe,uSu Su S u Sux Sx,uSu Su S u Sux Sx,another@pron rounen@v%pt_3 to@prep his@pron1%gen felaue@n loue@adv,another@pron rounen@v%pt_3 to@prep his@pron1%gen felaue@n loue@adv,
"And seyde, """"He lyeth, for it is rather lyk","And seide, “He lieth, it is rather lik",data/riverside_cats/SqT_riv.cat,data/oxford_txts/SqT_oxford.txt,data/csvs/SqT,The Squire's Tale 217,DIFF,10,10,And seyde He lyeth for it is rather lyk,And seide He lieth it is rather lik,u Sx u Su S u S ux S,u Sx u Su S u Su S,and@conj seien@v1%pt_3 he@pron1%nom lien@v2%pr_3 for@conj hit@pron ben@v%pr_3 rathere@adv%comp like@prep,and@conj seien@v1%pt_3 he@pron1%nom lien@v2%pr_3 hit@pron ben@v%pr_3 rathere@adv%comp like@prep,green
An apparence ymaad by som magyk,An apparence° ymaad by som magik,data/riverside_cats/SqT_riv.cat,data/oxford_txts/SqT_oxford.txt,data/csvs/SqT,The Squire's Tale 218,,10,10,An apparence ymaad by som magyk,An apparence ymaad by som magik,u SuSx uS u S uS,u SuSx uS u S uS,a@indef_art apparaunce@n imaken@v%ppl_abs bi@prep som@gram_adj magike@n,a@indef_art apparaunce@n imaken@v%ppl_abs bi@prep som@gram_adj magike@n,
As jogelours pleyen at thise feestes grete.,As jogelours° pleyen at thise festes grete.”,data/riverside_cats/SqT_riv.cat,data/oxford_txts/SqT_oxford.txt,data/csvs/SqT,The Squire's Tale 219,,10,10,As jogelours pleyen at thise feestes grete,As jogelours pleyen at thise festes grete,u SuS uS u Sx ux Sx,u SuS uS u Sx ux Sx,as@conj jogelour@n%pl pleien@v1%pr_pl at@prep these@gram_adj%pl feste@n%pl gret@adj,as@conj jogelour@n%pl pleien@v1%pr_pl at@prep these@gram_adj%pl feste@n%pl gret@adj,
Of sondry doutes thus they jangle and trete,"Of sondry doutes° thus they jangle° and trete,°",data/riverside_cats/SqT_riv.cat,data/oxford_txts/SqT_oxford.txt,data/csvs/SqT,The Squire's Tale 220,,10,10,Of sondry doutes thus they jangle and trete,Of sondry doutes thus they jangle and trete,u Su Su S u Sx u Sx,u Su Su S u Sx u Sx,of@prep sondri@adj doute@n%pl thus@adv thei@pron%pl_nom janglen@v%pr_pl and@conj treten@v%pr_pl,of@prep sondri@adj doute@n%pl thus@adv thei@pron%pl_nom janglen@v%pr_pl and@conj treten@v%pr_pl,
As lewed peple demeth comunly,As lewed° peple demeth° comunly,data/riverside_cats/SqT_riv.cat,data/oxford_txts/SqT_oxford.txt,data/csvs/SqT,The Squire's Tale 221,,10,10,As lewed peple demeth comunly,As lewed peple demeth comunly,u Su Su Su SuS,u Su Su Su SuS,as@conj leued@adj peple@n demen@v%pr_3 communeli@adv,as@conj leued@adj peple@n demen@v%pr_3 communeli@adv,
