OG_RIV_TEXT,OG_OXFORD_TEXT,RIVERSIDE_FILENAME,OXFORD_FILENAME,OUTPUT_FILENAME,LINE_NUMBER,MATCH,RIVERSIDE_SYLLABLES,OXFORD_SYLLABLES,RIVERSIDE_TEXT,OXFORD_TEXT,RIVERSIDE_SCANSION,OXFORD_SCANSION,RIVERSIDE_TAGGING,OXFORD_TAGGING,FLAG_COLOR
That Nature in youre principles hath set.,That nature in your principles hath set.,data/riverside_cats/SqT_riv.cat,data/oxford_txts/SqT_oxford.txt,data/csvs/SqT,The Squire's Tale 487,,10,10,That Nature in youre principles hath set,That nature in your principles hath set,u Sux S ux SuS u S,u Sux S u SuS u S,that@pron nature@n#propn in@prep your@pron%pl_gen principle@n%pl haven@v%pr_3 setten@v%ppl,that@pron nature@n#propn in@prep your@pron%pl_gen principle@n%pl haven@v%pr_3 setten@v%ppl,
But for noon hope for to fare the bet,"But for non hope° for to fare the bet,°",data/riverside_cats/SqT_riv.cat,data/oxford_txts/SqT_oxford.txt,data/csvs/SqT,The Squire's Tale 488,,10,10,But for noon hope for to fare the bet,But for non hope for to fare the bet,u S u Su S u Sx u S,u S u Su S u Sx u S,but@conj for@prep non@gram_adj hope@n1 for@prep#adv to@part faren@v%inf the@adv bet@adv%comp,but@conj for@prep non@gram_adj hope@n1 for@prep#adv to@part faren@v%inf the@adv bet@adv%comp,
But for to obeye unto youre herte free,"But for to obeye unto your herte free,°",data/riverside_cats/SqT_riv.cat,data/oxford_txts/SqT_oxford.txt,data/csvs/SqT,The Squire's Tale 489,,10,10,But for to obeye unto youre herte free,But for to obeye unto your herte free,u S u Su Su Sx ux S,u S u Su Su S ux S,but@conj for@prep#adv to@part obeien@v%inf unto@prep your@pron%pl_gen herte@n fre@adj,but@conj for@prep#adv to@part obeien@v%inf unto@prep your@pron%pl_gen herte@n fre@adj,
And for to maken othere be war by me,And for to maken othere ywar by° me,data/riverside_cats/SqT_riv.cat,data/oxford_txts/SqT_oxford.txt,data/csvs/SqT,The Squire's Tale 490,DIFF,10,10,And for to maken othere be war by me,And for to maken othere ywar by me,u S u Su Sux S u S x,u S u Su Sux Su S x,and@conj for@prep#adv to@part maken@v1%inf other@pron ben@v%inf ware@adj bi@prep me@pron2%obj,and@conj for@prep#adv to@part maken@v1%inf other@pron ware@adj bi@prep me@pron2%obj,green
As by the whelp chasted is the leon,As by the whelpe° chasted° is the leoun,data/riverside_cats/SqT_riv.cat,data/oxford_txts/SqT_oxford.txt,data/csvs/SqT,The Squire's Tale 491,,10,10,As by the whelp chasted is the leon,As by the whelpe chasted is the leoun,u S u S uS u S uS,u S u Sx uS u S uS,as@conj bi@prep the@def_art whelp@n chasten@v%ppl ben@v%pr_3 the@def_art lioun@n1,as@conj bi@prep the@def_art whelp@n chasten@v%ppl ben@v%pr_3 the@def_art lioun@n1,
Right for that cause and that conclusion,"Right for that cause and that conclusioun,°",data/riverside_cats/SqT_riv.cat,data/oxford_txts/SqT_oxford.txt,data/csvs/SqT,The Squire's Tale 492,,10,10,Right for that cause and that conclusion,Right for that cause and that conclusioun,u S u Sx u S uSuS,u S u Sx u S uSuS,righte@adv for@prep that@art&gram_adj cause@n and@conj that@art&gram_adj conclusioun@n,righte@adv for@prep that@art&gram_adj cause@n and@conj that@art&gram_adj conclusioun@n,
Whil that I have a leyser and a space,"Whil that I have a leiser° and a space,°",data/riverside_cats/SqT_riv.cat,data/oxford_txts/SqT_oxford.txt,data/csvs/SqT,The Squire's Tale 493,,10,10,Whil that I have a leyser and a space,Whil that I have a leiser and a space,u S u Sx u Su S u Sx,u S u Sx u Su S u Sx,whil@conj that@part ich@pron%nom haven@v%pr_1 a@indef_art leiser@n and@conj a@indef_art space@n,whil@conj that@part ich@pron%nom haven@v%pr_1 a@indef_art leiser@n and@conj a@indef_art space@n,
Myn harm I wol confessen er I pace.,"Min harm° I wol confessen, er I pace.”°",data/riverside_cats/SqT_riv.cat,data/oxford_txts/SqT_oxford.txt,data/csvs/SqT,The Squire's Tale 494,,10,10,Myn harm I wol confessen er I pace,Min harm I wol confessen er I pace,u S u S uSu S u Sx,u S u S uSu S u Sx,min@pron%gen harm@n ich@pron%nom willen@v%pr_1 confessen@v%inf er@conj1 ich@pron%nom passen@v%pr_1,min@pron%gen harm@n ich@pron%nom willen@v%pr_1 confessen@v%inf er@conj1 ich@pron%nom passen@v%pr_1,
"And evere, whil that oon hir sorwe tolde","And ever, whil that oon hir sorwe tolde",data/riverside_cats/SqT_riv.cat,data/oxford_txts/SqT_oxford.txt,data/csvs/SqT,The Squire's Tale 495,,10,10,And evere whil that oon hir sorwe tolde,And ever whil that oon hir sorwe tolde,u Sux S u S u Su Sx,u Su S u S u Su Sx,and@conj ever@adv whil@conj that@art&gram_adj on@pron hire@pron1%fem_gen sorwe@n tellen@v%pt_3,and@conj ever@adv whil@conj that@art&gram_adj on@pron hire@pron1%fem_gen sorwe@n tellen@v%pt_3,
That oother weep as she to water wolde,"That other weep, as° she to water wolde,°",data/riverside_cats/SqT_riv.cat,data/oxford_txts/SqT_oxford.txt,data/csvs/SqT,The Squire's Tale 496,,10,10,That oother weep as she to water wolde,That other weep as she to water wolde,u Su S u S u Su Sx,u Su S u S u Su Sx,that@art&gram_adj other@pron wepen@v%pt_3 as@conj she@pron%nom to@prep water@n willen@v%pt_3,that@art&gram_adj other@pron wepen@v%pt_3 as@conj she@pron%nom to@prep water@n willen@v%pt_3,
Til that the faucon bad hire to be stille,Til that the faucon bad hir to be stille;,data/riverside_cats/SqT_riv.cat,data/oxford_txts/SqT_oxford.txt,data/csvs/SqT,The Squire's Tale 497,,10,10,Til that the faucon bad hire to be stille,Til that the faucon bad hir to be stille,u S u Su S ux S u Sx,u S u Su S u S u Sx,til@conj that@part the@def_art faucoun@n bidden@v%pt_3 hire@pron2%fem_obj to@part ben@v%inf stille@adj,til@conj that@part the@def_art faucoun@n bidden@v%pt_3 hire@pron2%fem_obj to@part ben@v%inf stille@adj,
"And, with a syk, right thus she seyde hir wille:","And, with a sik,° right thus she seide hir wille.",data/riverside_cats/SqT_riv.cat,data/oxford_txts/SqT_oxford.txt,data/csvs/SqT,The Squire's Tale 498,,10,10,And with a syk right thus she seyde hir wille,And with a sik right thus she seide hir wille,u S u S u S u Sx u Sx,u S u S u S u Sx u Sx,and@conj with@prep a@indef_art sike@n righte@adv thus@adv she@pron%nom seien@v1%pt_3 hire@pron1%fem_gen wille@n,and@conj with@prep a@indef_art sike@n righte@adv thus@adv she@pron%nom seien@v1%pt_3 hire@pron1%fem_gen wille@n,
"Ther I was bred -- allas, that ilke day! --",“Ther° I was bred (allas! that harde day!),data/riverside_cats/SqT_riv.cat,data/oxford_txts/SqT_oxford.txt,data/csvs/SqT,The Squire's Tale 499,DIFF,10,10,Ther I was bred allas that ilke day,Ther I was bred allas that harde day,u S u S uS u Su S,u S u S uS u Su S,ther@adv ich@pron%nom ben@v%pt_1 breden@v3%ppl --@dash alas@interj that@art&gram_adj ilke@pron_gram_adj dai@n --@dash,ther@adv ich@pron%nom ben@v%pt_1 breden@v3%ppl alas@interj that@art&gram_adj hard@adj ilke@pron_gram_adj,green
And fostred in a roche of marbul gray,And fostred° in a roche of marbul gray,data/riverside_cats/SqT_riv.cat,data/oxford_txts/SqT_oxford.txt,data/csvs/SqT,The Squire's Tale 500,,10,10,And fostred in a roche of marbul gray,And fostred in a roche of marbul gray,u Su S u Sx u Su S,u Su S u Sx u Su S,and@conj fostren@v%ppl in@prep a@indef_art roche@n2 of@prep marble@n grei@adj,and@conj fostren@v%ppl in@prep a@indef_art roche@n2 of@prep marble@n grei@adj,
So tendrely that no thyng eyled me,"So tendrely, that nothing eiled° me",data/riverside_cats/SqT_riv.cat,data/oxford_txts/SqT_oxford.txt,data/csvs/SqT,The Squire's Tale 501,DIFF,10,10,So tendrely that no thyng eyled me,So tendrely that nothing eiled me,u SuS u S u Su S,u SuS u Su Su S,so@adv tenderli@adv that@conj no@gram_adj thing@n eilen@v%pt_3 me@pron2%obj,so@adv tenderli@adv that@conj no-thing@pron eilen@v%pt_3 me@pron2%obj,green
I nyste nat what was adversitee,I niste nat° what was adversitee,data/riverside_cats/SqT_riv.cat,data/oxford_txts/SqT_oxford.txt,data/csvs/SqT,The Squire's Tale 502,,10,10,I nyste nat what was adversitee,I niste nat what was adversitee,u Su S u S uSuS,u Su S u S uSuS,ich@pron%nom witen@v1%pt_1_neg not@adv what@pron ben@v%pt_3 adversite@n,ich@pron%nom witen@v1%pt_1_neg not@adv what@pron ben@v%pt_3 adversite@n,
Til I koude flee ful hye under the sky.,Til I coud flee° ful hie under the sky.,data/riverside_cats/SqT_riv.cat,data/oxford_txts/SqT_oxford.txt,data/csvs/SqT,The Squire's Tale 503,,10,10,Til I koude flee ful hye under the sky,Til I coud flee ful hie under the sky,u S ux S u S uS u S,u S u S u S uS u S,til@conj ich@pron%nom connen@v%pt_1 flien@v%inf ful@adv heighe@adv under@prep the@def_art skie@n,til@conj ich@pron%nom connen@v%pt_1 flien@v%inf ful@adv heighe@adv under@prep the@def_art skie@n,
Tho dwelte a tercelet me faste by,Tho dwelte a tercelet° me faste by,data/riverside_cats/SqT_riv.cat,data/oxford_txts/SqT_oxford.txt,data/csvs/SqT,The Squire's Tale 504,,10,10,Tho dwelte a tercelet me faste by,Tho dwelte a tercelet me faste by,u Sx u SuS u Su S,u Sx u SuS u Su S,tho@adv dwellen@v%pt_3 a@indef_art tercelet@n me@pron2%obj faste@adv bi@adv,tho@adv dwellen@v%pt_3 a@indef_art tercelet@n me@pron2%obj faste@adv bi@adv,
That semed welle of alle gentillesse;,That semed welle° of alle gentillesse;°,data/riverside_cats/SqT_riv.cat,data/oxford_txts/SqT_oxford.txt,data/csvs/SqT,The Squire's Tale 505,,10,10,That semed welle of alle gentillesse,That semed welle of alle gentillesse,u Su Sx u Su SuSx,u Su Sx u Su SuSx,that@art&gram_adj semen@v2%pt_3 welle@n of@prep al@gram_adj gentilesse@n,that@art&gram_adj semen@v2%pt_3 welle@n of@prep al@gram_adj gentilesse@n,
Al were he ful of treson and falsnesse,Al were he° ful of treson and falsnesse,data/riverside_cats/SqT_riv.cat,data/oxford_txts/SqT_oxford.txt,data/csvs/SqT,The Squire's Tale 506,,10,10,Al were he ful of treson and falsnesse,Al were he ful of treson and falsnesse,u Sx u S u Su S uSx,u Sx u S u Su S uSx,al@conj ben@v%pt_3 he@pron1%nom ful@adj of@prep treisoun@n and@conj falsnesse@n,al@conj ben@v%pt_3 he@pron1%nom ful@adj of@prep treisoun@n and@conj falsnesse@n,
It was so wrapped under humble cheere,"It was so wrapped under humble chere,°",data/riverside_cats/SqT_riv.cat,data/oxford_txts/SqT_oxford.txt,data/csvs/SqT,The Squire's Tale 507,,10,10,It was so wrapped under humble cheere,It was so wrapped under humble chere,u S u Su Su Su Sx,u S u Su Su Su Sx,hit@pron ben@v%pt_3 so@adv wrappen@v%ppl under@prep humble@adj chere@n1,hit@pron ben@v%pt_3 so@adv wrappen@v%ppl under@prep humble@adj chere@n1,
And under hewe of trouthe in swich manere,And under hewe° of trouthe in swich manere,data/riverside_cats/SqT_riv.cat,data/oxford_txts/SqT_oxford.txt,data/csvs/SqT,The Squire's Tale 508,,10,10,And under hewe of trouthe in swich manere,And under hewe of trouthe in swich manere,u Su Sx u Sx u S uSx,u Su Sx u Sx u S uSx,and@conj under@prep heu@n of@prep treuth@n in@prep swich@gram_adj manere@n,and@conj under@prep heu@n of@prep treuth@n in@prep swich@gram_adj manere@n,
"Under plesance, and under bisy peyne","Under plesance, and under bisy° peine",data/riverside_cats/SqT_riv.cat,data/oxford_txts/SqT_oxford.txt,data/csvs/SqT,The Squire's Tale 509,,10,10,Under plesance and under bisy peyne,Under plesance and under bisy peine,uS uSx u Su Su Sx,uS uSx u Su Su Sx,under@prep plesaunce@n1 and@conj under@prep bisi@adj peine@n,under@prep plesaunce@n1 and@conj under@prep bisi@adj peine@n,
That no wight koude han wend he koude feyne,"That no wight coude han wend° he coude feine,°",data/riverside_cats/SqT_riv.cat,data/oxford_txts/SqT_oxford.txt,data/csvs/SqT,The Squire's Tale 510,,10,10,That no wight koude han wend he koude feyne,That no wight coude han wend he coude feine,u S u Sx u S u Su Sx,u S u Sx u S u Su Sx,that@conj no@gram_adj wight@n connen@v%pt_3 haven@v%inf wenen@v2%ppl he@pron1%nom connen@v%pt_3 feinen@v%inf,that@conj no@gram_adj wight@n connen@v%pt_3 haven@v%inf wenen@v2%ppl he@pron1%nom connen@v%pt_3 feinen@v%inf,
So depe in greyn he dyed his coloures.,So depe in grein° he dyed his coloures.,data/riverside_cats/SqT_riv.cat,data/oxford_txts/SqT_oxford.txt,data/csvs/SqT,The Squire's Tale 511,,10,10,So depe in greyn he dyed his coloures,So depe in grein he dyed his coloures,u Sx u S u Su S uSx,u Sx u S u Su S uSx,so@adv depe@adv in@prep grain@n he@pron1%nom deien@v%pt_3 his@pron1%gen colour@n%pl,so@adv depe@adv in@prep grain@n he@pron1%nom deien@v%pt_3 his@pron1%gen colour@n%pl,
Right as a serpent hit hym under floures,Right° as a serpent hit him° under floures,data/riverside_cats/SqT_riv.cat,data/oxford_txts/SqT_oxford.txt,data/csvs/SqT,The Squire's Tale 512,,10,10,Right as a serpent hit hym under floures,Right as a serpent hit him under floures,u S u Su S u Su Sx,u S u Su S u Su Sx,righte@adv as@conj a@indef_art serpent@n hiden@v%pr_3 him@pron%obj under@prep flour@n1%pl,righte@adv as@conj a@indef_art serpent@n hiden@v%pr_3 him@pron%obj under@prep flour@n1%pl,
Til he may seen his tyme for to byte,Til he may seen his time for to bite,data/riverside_cats/SqT_riv.cat,data/oxford_txts/SqT_oxford.txt,data/csvs/SqT,The Squire's Tale 513,,10,10,Til he may seen his tyme for to byte,Til he may seen his time for to bite,u S u S u Su S u Sx,u S u S u Su S u Sx,til@conj he@pron1%nom mouen@v3%pr_3 sen@v1%inf his@pron1%gen time@n for@prep#adv to@part biten@v1%inf,til@conj he@pron1%nom mouen@v3%pr_3 sen@v1%inf his@pron1%gen time@n for@prep#adv to@part biten@v1%inf,
Right so this god of loves ypocryte,"Right so this God of love, this ypocrite",data/riverside_cats/SqT_riv.cat,data/oxford_txts/SqT_oxford.txt,data/csvs/SqT,The Squire's Tale 514,DIFF,10,10,Right so this god of loves ypocryte,Right so this God of love this ypocrite,u S u S u Su SuSx,u S u S u Sx u SuSx,righte@adv so@adv this@gram_adj god@n1 of@prep love@n1%gen ipocrite@n,righte@adv so@adv this@gram_adj god@n1 of@prep love@n1 this@gram_adj ipocrite@n,green
Dooth so his cerymonyes and obeisaunces,"Doth so his cerimonies° and obeisaunces,°",data/riverside_cats/SqT_riv.cat,data/oxford_txts/SqT_oxford.txt,data/csvs/SqT,The Squire's Tale 515,,10,10,Dooth so his cerymonyes and obeisaunces,Doth so his cerimonies and obeisaunces,u x S xuSuS u SuSx,u x S xuSuS u SuSx,don@v1%pr_3 so@adv his@pron1%gen cerimonie@n%pl and@conj obeisaunce@n%pl,don@v1%pr_3 so@adv his@pron1%gen cerimonie@n%pl and@conj obeisaunce@n%pl,
And kepeth in semblaunt alle his observaunces,And kepeth in semblant° alle his observances°,data/riverside_cats/SqT_riv.cat,data/oxford_txts/SqT_oxford.txt,data/csvs/SqT,The Squire's Tale 516,,10,10,And kepeth in semblaunt alle his observaunces,And kepeth in semblant alle his observances,u Sx u Su Sx u SuSx,u Sx u Su Sx u SuSx,and@conj kepen@v%pr_3 in@prep semblaunt@n al@gram_adj his@pron1%gen observaunce@n%pl,and@conj kepen@v%pr_3 in@prep semblaunt@n al@gram_adj his@pron1%gen observaunce@n%pl,
That sownen into gentillesse of love.,That sowneth into° gentillesse of love.,data/riverside_cats/SqT_riv.cat,data/oxford_txts/SqT_oxford.txt,data/csvs/SqT,The Squire's Tale 517,DIFF,10,10,That sownen into gentillesse of love,That sowneth into gentillesse of love,u Su Su SuSx u Sx,u Su Su SuSx u Sx,that@pron sounen@v%pr_pl in-to@prep gentilesse@n of@prep love@n1,that@pron sounen@v%pr_pl in-to@prep gentilesse@n of@prep love@n1,green
As in a toumbe is al the faire above,As in a toumbe is al the faire° above,data/riverside_cats/SqT_riv.cat,data/oxford_txts/SqT_oxford.txt,data/csvs/SqT,The Squire's Tale 518,,10,10,As in a toumbe is al the faire above,As in a toumbe is al the faire above,u S u Sx u S u Sx uSx,u S u Sx u S u Sx uSx,as@conj in@prep a@indef_art tombe@n ben@v%pr_3 al@gram_adj the@def_art fair@n aboven@advas_adj,as@conj in@prep a@indef_art tombe@n ben@v%pr_3 al@gram_adj the@def_art fair@n aboven@advas_adj,
"And under is the corps, swich as ye woot","And under is the corps,° swich as ye woot",data/riverside_cats/SqT_riv.cat,data/oxford_txts/SqT_oxford.txt,data/csvs/SqT,The Squire's Tale 519,,10,10,And under is the corps swich as ye woot,And under is the corps swich as ye woot,u Su S u S u S u S,u Su S u S u S u S,and@conj under@adv ben@v%pr_3 the@def_art cors@n swich@gram_adj as@conj ye@pron%pl_nom witen@v1%pr_pl,and@conj under@adv ben@v%pr_3 the@def_art cors@n swich@gram_adj as@conj ye@pron%pl_nom witen@v1%pr_pl,
"Swich was this ypocrite, bothe coold and hoot.","Swich was this ypocrite, both cold and hoot",data/riverside_cats/SqT_riv.cat,data/oxford_txts/SqT_oxford.txt,data/csvs/SqT,The Squire's Tale 520,,10,10,Swich was this ypocrite bothe coold and hoot,Swich was this ypocrite both cold and hoot,u S u SuSx ux S u S,u S u SuSx u S u S,swich@gram_adj ben@v%pt_3 this@gram_adj ipocrite@n bothe@num_conj cold@adj and@conj hot@adj,swich@gram_adj ben@v%pt_3 this@gram_adj ipocrite@n bothe@num_conj cold@adj and@conj hot@adj,
And in this wise he served his entente,"And in this wise he served his entente,°",data/riverside_cats/SqT_riv.cat,data/oxford_txts/SqT_oxford.txt,data/csvs/SqT,The Squire's Tale 521,,10,10,And in this wise he served his entente,And in this wise he served his entente,u S u Sx u Su S uSx,u S u Sx u Su S uSx,and@conj in@prep this@gram_adj wise@n2 he@pron1%nom serven@v1%pt_3 his@pron1%gen entente@n,and@conj in@prep this@gram_adj wise@n2 he@pron1%nom serven@v1%pt_3 his@pron1%gen entente@n,
"That, save the feend, noon wiste what he mente",That (save the feend) non wiste what he mente.,data/riverside_cats/SqT_riv.cat,data/oxford_txts/SqT_oxford.txt,data/csvs/SqT,The Squire's Tale 522,,10,10,That save the feend noon wiste what he mente,That save the feend non wiste what he mente,u Sx u S u Su S u Sx,u Sx u S u Su S u Sx,that@conj sauf@prep the@def_art fend@n non@pron witen@v1%pt_3 what@pron he@pron1%nom menen@v1%pt_3,that@conj sauf@prep the@def_art fend@n non@pron witen@v1%pt_3 what@pron he@pron1%nom menen@v1%pt_3,
Til he so longe hadde wopen and compleyned,"Til he so longe had wopen and compleined,°",data/riverside_cats/SqT_riv.cat,data/oxford_txts/SqT_oxford.txt,data/csvs/SqT,The Squire's Tale 523,,10,10,Til he so longe hadde wopen and compleyned,Til he so longe had wopen and compleined,u S u Sx ux Su S uSx,u S u Sx u Su S uSx,til@conj he@pron1%nom so@adv longe@adv haven@v%pt_3 wepen@v%ppl and@conj compleinen@v%ppl,til@conj he@pron1%nom so@adv longe@adv haven@v%pt_3 wepen@v%ppl and@conj compleinen@v%ppl,
And many a yeer his service to me feyned,"And many a yeer his service to me feined,°",data/riverside_cats/SqT_riv.cat,data/oxford_txts/SqT_oxford.txt,data/csvs/SqT,The Squire's Tale 524,,10,10,And many a yeer his service to me feyned,And many a yeer his service to me feined,u Su S u S uSx u x Sx,u Su S u S uSx u x Sx,and@conj mani@gram_adj a@indef_art yer@n his@pron1%gen servise@n to@prep me@pron2%obj feinen@v%ppl,and@conj mani@gram_adj a@indef_art yer@n his@pron1%gen servise@n to@prep me@pron2%obj feinen@v%ppl,
"Til that myn herte, to pitous and to nyce","Til that min hert, to pitous° and to nice,°",data/riverside_cats/SqT_riv.cat,data/oxford_txts/SqT_oxford.txt,data/csvs/SqT,The Squire's Tale 525,,10,10,Til that myn herte to pitous and to nyce,Til that min hert to pitous and to nice,u S u Sx u Su S u Sx,u S u S u Su S u Sx,til@conj that@part min@pron%gen herte@n to@adv2 pitous@adj and@conj to@adv2 nice@adj,til@conj that@part min@pron%gen herte@n to@adv2 pitous@adj and@conj to@adv2 nice@adj,
Al innocent of his crouned malice,Al innocent of his crouned° malice,data/riverside_cats/SqT_riv.cat,data/oxford_txts/SqT_oxford.txt,data/csvs/SqT,The Squire's Tale 526,,10,10,Al innocent of his crouned malice,Al innocent of his crouned malice,u SuS u S uS uSx,u SuS u S uS uSx,al@adv innocent@adj of@prep his@pron1%gen corounen@v1#adj%ppl malice@n,al@adv innocent@adj of@prep his@pron1%gen corounen@v1#adj%ppl malice@n,
"Forfered of his deeth, as thoughte me","Forfered° of his deeth, as thoughte me,°",data/riverside_cats/SqT_riv.cat,data/oxford_txts/SqT_oxford.txt,data/csvs/SqT,The Squire's Tale 527,,10,10,Forfered of his deeth as thoughte me,Forfered of his deeth as thoughte me,uSu S u S u Su S,uSu S u S u Su S,forfered@ppl_abs of@prep his@pron1%gen deth@n as@conj thinken@v1%pt_3 me@pron2%obj,forfered@ppl_abs of@prep his@pron1%gen deth@n as@conj thinken@v1%pt_3 me@pron2%obj,
Upon his othes and his seuretee,"Upon his othes and his seuretee,°",data/riverside_cats/SqT_riv.cat,data/oxford_txts/SqT_oxford.txt,data/csvs/SqT,The Squire's Tale 528,,10,10,Upon his othes and his seuretee,Upon his othes and his seuretee,uS u Su S u SuS,uS u Su S u SuS,upon@prep his@pron1%gen oth@n%pl and@conj his@pron1%gen seurte@n,upon@prep his@pron1%gen oth@n%pl and@conj his@pron1%gen seurte@n,
"Graunted hym love, upon this condicioun","Graunted him love, on this condicioun",data/riverside_cats/SqT_riv.cat,data/oxford_txts/SqT_oxford.txt,data/csvs/SqT,The Squire's Tale 529,DIFF,10,10,Graunted hym love upon this condicioun,Graunted him love on this condicioun,ux S ux Su S uSuS,uS u Sx u S uSuS,graunten@v%pt_3 him@pron%obj love@n1 upon@prep this@gram_adj condicioun@n,graunten@v%pt_3 him@pron%obj love@n1 on@prep this@gram_adj condicioun@n,green
That everemoore myn honour and renoun,That evermore min honour and renoun,data/riverside_cats/SqT_riv.cat,data/oxford_txts/SqT_oxford.txt,data/csvs/SqT,The Squire's Tale 530,,10,10,That everemoore myn honour and renoun,That evermore min honour and renoun,u SuSux S uS u xS,u SuSx u Su S uS,that@pron ever-mor@adv min@pron%gen honour@n and@conj renoun@n,that@pron ever-mor@adv min@pron%gen honour@n and@conj renoun@n,
"Were saved, bothe privee and apert;","Were saved,° bothe privee° and apert;°",data/riverside_cats/SqT_riv.cat,data/oxford_txts/SqT_oxford.txt,data/csvs/SqT,The Squire's Tale 531,,10,10,Were saved bothe privee and apert,Were saved bothe privee and apert,ux Su Su Su S uS,ux Su Su Su S uS,ben@v%pt_3 saven@v%ppl bothe@num_conj prive@adv and@conj apert@adj,ben@v%pt_3 saven@v%ppl bothe@num_conj prive@adv and@conj apert@adj,
"This is to seyn, that after his desert","This is to seyn, that, after° his desert,°",data/riverside_cats/SqT_riv.cat,data/oxford_txts/SqT_oxford.txt,data/csvs/SqT,The Squire's Tale 532,,10,10,This is to seyn that after his desert,This is to seyn that after his desert,u S u S u Su S uS,u S u S u Su S uS,this@pron ben@v%pr_3 to@part seien@v1%inf that@conj after@prep his@pron1%gen desert@n1,this@pron ben@v%pr_3 to@part seien@v1%inf that@conj after@prep his@pron1%gen desert@n1,
I yaf hym al myn herte and al my thoght --,I yaf him al min herte and al my thoght—,data/riverside_cats/SqT_riv.cat,data/oxford_txts/SqT_oxford.txt,data/csvs/SqT,The Squire's Tale 533,,10,10,I yaf hym al myn herte and al my thoght,I yaf him al min herte and al my thoght,u S u S u Sx u S u S,u S u S u Sx u S u S,ich@pron%nom yeven@v%pt_3 him@pron%obj al@gram_adj min@pron%gen herte@n and@conj al@gram_adj min@pron%gen thought@n --@dash,ich@pron%nom yeven@v%pt_3 him@pron%obj al@gram_adj min@pron%gen herte@n and@conj al@gram_adj min@pron%gen thought@n --@dash,
"God woot and he, that ootherwise noght --","God woot and he, that otherwise noght—",data/riverside_cats/SqT_riv.cat,data/oxford_txts/SqT_oxford.txt,data/csvs/SqT,The Squire's Tale 534,,10,10,God woot and he that ootherwise noght,God woot and he that otherwise noght,u S u S u SuSu S,u S u S u SuSu S,god@n1#propn witen@v1%pr_3 and@conj he@pron1%nom that@conj other-wise@adv nought@adv --@dash,god@n1#propn witen@v1%pr_3 and@conj he@pron1%nom that@conj other-wise@adv nought@adv --@dash,
And took his herte in chaunge of myn for ay.,And took his herte in chaunge° for min for ay.,data/riverside_cats/SqT_riv.cat,data/oxford_txts/SqT_oxford.txt,data/csvs/SqT,The Squire's Tale 535,DIFF,10,10,And took his herte in chaunge of myn for ay,And took his herte in chaunge for min for ay,u S u Sx u Sx u S u S,u S u Sx u Sx u S u S,and@conj taken@v%pt_3 his@pron1%gen herte@n in@prep chaunge@n of@prep min@pron%gen for@prep ai@adv,and@conj taken@v%pt_3 his@pron1%gen herte@n in@prep chaunge@n for@prep min@pron%gen for@prep ai@adv,green
"But sooth is seyd, goon sithen many a day","¶“But sooth is seid, gon sithen many a day,°",data/riverside_cats/SqT_riv.cat,data/oxford_txts/SqT_oxford.txt,data/csvs/SqT,The Squire's Tale 536,,10,10,But sooth is seyd goon sithen many a day,But sooth is seid gon sithen many a day,u S u S u Su Sx u S,u S u S u Su Sx u S,but@conj soth@n ben@v%pr_3 seien@v1%ppl gon@v%ppl_abs sitthen@adv mani@gram_adj a@indef_art dai@n,but@conj soth@n ben@v%pr_3 seien@v1%ppl gon@v%ppl_abs sitthen@adv mani@gram_adj a@indef_art dai@n,
`A trewe wight and a theef thenken nat oon.',‘A trew wight° and a theef thenken nat oon.’°,data/riverside_cats/SqT_riv.cat,data/oxford_txts/SqT_oxford.txt,data/csvs/SqT,The Squire's Tale 537,,10,10,A trewe wight and a theef thenken nat oon,A trew wight and a theef thenken nat oon,u Sx u S u S uS u S,u S u S u S uS u S,a@indef_art treu@adj wight@n and@conj a@indef_art thef@n2 thinken@v2%pr_pl not@adv on@adv2,a@indef_art treu@adj wight@n and@conj a@indef_art thef@n2 thinken@v2%pr_pl not@adv on@adv2,
And whan he saugh the thyng so fer ygoon,"And, whan he saugh the thing so fer ygoon",data/riverside_cats/SqT_riv.cat,data/oxford_txts/SqT_oxford.txt,data/csvs/SqT,The Squire's Tale 538,,10,10,And whan he saugh the thyng so fer ygoon,And whan he saugh the thing so fer ygoon,u S u S u S u S uS,u S u S u S u S uS,and@conj whan@adv&conj he@pron1%nom sen@v1%pt_3 the@def_art thing@n so@adv fer@adv igon@v%ppl_abs,and@conj whan@adv&conj he@pron1%nom sen@v1%pt_3 the@def_art thing@n so@adv fer@adv igon@v%ppl_abs,
That I hadde graunted hym fully my love,That I had graunted him fully my love,data/riverside_cats/SqT_riv.cat,data/oxford_txts/SqT_oxford.txt,data/csvs/SqT,The Squire's Tale 539,,10,10,That I hadde graunted hym fully my love,That I had graunted him fully my love,u S ux Su S uS u Sx,u S u Su S uS u Sx,that@conj ich@pron%nom haven@v%pt_1 graunten@v%ppl him@pron%obj fulli@adv min@pron%gen love@n1,that@conj ich@pron%nom haven@v%pt_1 graunten@v%ppl him@pron%obj fulli@adv min@pron%gen love@n1,
