OG_RIV_TEXT,OG_OXFORD_TEXT,RIVERSIDE_FILENAME,OXFORD_FILENAME,OUTPUT_FILENAME,LINE_NUMBER,MATCH,RIVERSIDE_SYLLABLES,OXFORD_SYLLABLES,RIVERSIDE_TEXT,OXFORD_TEXT,RIVERSIDE_SCANSION,OXFORD_SCANSION,RIVERSIDE_TAGGING,OXFORD_TAGGING,FLAG_COLOR
"Trille this pyn, and he wol vanysshe anoon","Trille this pin, and he wol vanishe anoon",data/riverside_cats/SqT_riv.cat,data/oxford_txts/SqT_oxford.txt,data/csvs/SqT,The Squire's Tale 328,,10,10,Trille this pyn and he wol vanysshe anoon,Trille this pin and he wol vanishe anoon,ux S u S u S uSx uS,ux S u S u S uSx uS,trillen@v2%imp this@gram_adj pin@n and@conj he@pron1%nom willen@v%pr_3 vanishen@v%inf an-on@adv,trillen@v2%imp this@gram_adj pin@n and@conj he@pron1%nom willen@v%pr_3 vanishen@v%inf an-on@adv,
Out of the sighte of every maner wight,"Out of the sighte of every maner wight,°",data/riverside_cats/SqT_riv.cat,data/oxford_txts/SqT_oxford.txt,data/csvs/SqT,The Squire's Tale 329,,10,10,Out of the sighte of every maner wight,Out of the sighte of every maner wight,u S u Sx u SuS ux S,u S u Sx u SuS ux S,oute@adv#prep of@prep the@def_art sighte@n of@prep everi@pron_gram_adj manere@n#adj wight@n,oute@adv#prep of@prep the@def_art sighte@n of@prep everi@pron_gram_adj manere@n#adj wight@n,
"And come agayn, be it by day or nyght","And come again, be it by day or night",data/riverside_cats/SqT_riv.cat,data/oxford_txts/SqT_oxford.txt,data/csvs/SqT,The Squire's Tale 330,,10,10,And come agayn be it by day or nyght,And come again be it by day or night,u Sx uS u S u S u S,u Sx uS u S u S u S,and@conj comen@v%inf ayen@adv ben@v%pr_3 hit@pron bi@prep dai@n or@conj night@n,and@conj comen@v%inf ayen@adv ben@v%pr_3 hit@pron bi@prep dai@n or@conj night@n,
Whan that yow list to clepen hym ageyn,When that yow list to clepen° him agein,data/riverside_cats/SqT_riv.cat,data/oxford_txts/SqT_oxford.txt,data/csvs/SqT,The Squire's Tale 331,,10,10,Whan that yow list to clepen hym ageyn,When that yow list to clepen him agein,u S u S u Su S uS,u S u S u Su S uS,whan@adv&conj that@part you@pron%pl_obj listen@v1%pr_3 to@part clepen@v%inf him@pron%obj ayen@adv,whan@adv&conj that@part you@pron%pl_obj listen@v1%pr_3 to@part clepen@v%inf him@pron%obj ayen@adv,
In swich a gyse as I shal to yow seyn,In swich a gise° as I shal to yow seyn,data/riverside_cats/SqT_riv.cat,data/oxford_txts/SqT_oxford.txt,data/csvs/SqT,The Squire's Tale 332,,10,10,In swich a gyse as I shal to yow seyn,In swich a gise as I shal to yow seyn,u S u Sx u S u S u S,u S u Sx u S u S u S,in@prep swich@gram_adj a@indef_art gise@n as@conj ich@pron%nom shulen@v1%pr_1 to@prep you@pron%pl_obj seien@v1%inf,in@prep swich@gram_adj a@indef_art gise@n as@conj ich@pron%nom shulen@v1%pr_1 to@prep you@pron%pl_obj seien@v1%inf,
"Bitwixe yow and me, and that ful soone.","Bitwixe yow and me, and that ful sone.",data/riverside_cats/SqT_riv.cat,data/oxford_txts/SqT_oxford.txt,data/csvs/SqT,The Squire's Tale 333,,10,10,Bitwixe yow and me and that ful soone,Bitwixe yow and me and that ful sone,uSu S u S u S u Sx,uSu S u S u S u Sx,bitwixe@prep you@pron%pl_obj and@conj me@pron2%obj and@conj that@pron ful@adv sone@adv,bitwixe@prep you@pron%pl_obj and@conj me@pron2%obj and@conj that@pron ful@adv sone@adv,
Ride whan yow list; ther is namoore to doone.,"Ride whan yow list, ther is namore° to done.”",data/riverside_cats/SqT_riv.cat,data/oxford_txts/SqT_oxford.txt,data/csvs/SqT,The Squire's Tale 334,,10,10,Ride whan yow list ther is namoore to doone,Ride whan yow list ther is namore to done,ux S u S u S uSx u Sx,ux S u S u S uSx u Sx,riden@v%imp whan@adv&conj you@pron%pl_obj listen@v1%pr_3 ther@adv ben@v%pr_3 no_more@n to@part don@v1%inf,riden@v%imp whan@adv&conj you@pron%pl_obj listen@v1%pr_3 ther@adv ben@v%pr_3 no_more@n to@part don@v1%inf,
Enformed whan the kyng was of that knyght,Enformed whan the king was of° that knight,data/riverside_cats/SqT_riv.cat,data/oxford_txts/SqT_oxford.txt,data/csvs/SqT,The Squire's Tale 335,,10,10,Enformed whan the kyng was of that knyght,Enformed whan the king was of that knight,uSu S u S u S u S,uSu S u S u S u S,enfourmen@v%ppl whan@adv&conj the@def_art king@n ben@v%pt_3 of@prep that@art&gram_adj knight@n,enfourmen@v%ppl whan@adv&conj the@def_art king@n ben@v%pt_3 of@prep that@art&gram_adj knight@n,
And hath conceyved in his wit aright,And hath conceived in his wit° aright,data/riverside_cats/SqT_riv.cat,data/oxford_txts/SqT_oxford.txt,data/csvs/SqT,The Squire's Tale 336,,10,10,And hath conceyved in his wit aright,And hath conceived in his wit aright,u S uSu S u S uS,u S uSu S u S uS,and@conj haven@v%pr_3 conceiven@v%ppl in@prep his@pron1%gen wit@n a-right@adv,and@conj haven@v%pr_3 conceiven@v%ppl in@prep his@pron1%gen wit@n a-right@adv,
The manere and the forme of al this thyng,The maner and the forme of al this thing,data/riverside_cats/SqT_riv.cat,data/oxford_txts/SqT_oxford.txt,data/csvs/SqT,The Squire's Tale 337,,10,10,The manere and the forme of al this thyng,The maner and the forme of al this thing,u Sux S u Sx u S u S,u Su S u Sx u S u S,the@def_art manere@n and@conj the@def_art forme@n of@prep al@gram_adj this@gram_adj thing@n,the@def_art manere@n and@conj the@def_art forme@n of@prep al@gram_adj this@gram_adj thing@n,
"Ful glad and blithe, this noble doughty kyng","Thus glad and blithe, this noble doughty° king",data/riverside_cats/SqT_riv.cat,data/oxford_txts/SqT_oxford.txt,data/csvs/SqT,The Squire's Tale 338,DIFF,10,10,Ful glad and blithe this noble doughty kyng,Thus glad and blithe this noble doughty king,u S u Sx u Su Su S,u S u Sx u Su Su S,ful@adv glad@adj and@conj blithe@adj this@gram_adj noble@adj doughti@adj king@n,this@gram_adj glad@adj and@conj blithe@adj this@gram_adj noble@adj doughti@adj king@n,green
Repeireth to his revel as biforn.,Repeireth° to his revel as biforn.,data/riverside_cats/SqT_riv.cat,data/oxford_txts/SqT_oxford.txt,data/csvs/SqT,The Squire's Tale 339,,10,10,Repeireth to his revel as biforn,Repeireth to his revel as biforn,uSu S u Su S uS,uSu S u Su S uS,repairen@v%pr_3 to@prep his@pron1%gen revel@n1 as@conj biforen@adv,repairen@v%pr_3 to@prep his@pron1%gen revel@n1 as@conj biforen@adv,
The brydel is unto the tour yborn,"The bridel is unto the tour yborn,°",data/riverside_cats/SqT_riv.cat,data/oxford_txts/SqT_oxford.txt,data/csvs/SqT,The Squire's Tale 340,,10,10,The brydel is unto the tour yborn,The bridel is unto the tour yborn,u Su S uS u S uS,u Su S uS u S uS,the@def_art bridel@n ben@v%pr_3 unto@prep the@def_art tour@n1 iberen@v1%ppl,the@def_art bridel@n ben@v%pr_3 unto@prep the@def_art tour@n1 iberen@v1%ppl,
And kept among his jueles leeve and deere.,And kept among his jewels° leve° and dere.,data/riverside_cats/SqT_riv.cat,data/oxford_txts/SqT_oxford.txt,data/csvs/SqT,The Squire's Tale 341,DIFF,10,10,And kept among his jueles leeve and deere,And kept among his jewels leve and dere,u S uS u Su Sx u Sx,u S uS u Su Sx u Sx,and@conj kepen@v%ppl amonges@prep his@pron1%gen jeuel@n%pl lef@adj and@conj dere@adj1,and@conj kepen@v%ppl amonges@prep his@pron1%gen jeuel@n%pl lef@adj and@conj dere@adj1,green
"The hors vanysshed, I noot in what manere","The hors vanisshed, I noot° in what manere",data/riverside_cats/SqT_riv.cat,data/oxford_txts/SqT_oxford.txt,data/csvs/SqT,The Squire's Tale 342,,10,10,The hors vanysshed I noot in what manere,The hors vanisshed I noot in what manere,u S uSu S u S u Sxx,u S uSu S u S u Sxx,the@def_art hors@n vanishen@v%pt_3 ich@pron%nom witen@v1%pr_1_neg in@prep what@gram_adj manere@n,the@def_art hors@n vanishen@v%pt_3 ich@pron%nom witen@v1%pr_1_neg in@prep what@gram_adj manere@n,
Out of hir sighte; ye gete namoore of me.,Out of hir sighte; ye gete namore of me.,data/riverside_cats/SqT_riv.cat,data/oxford_txts/SqT_oxford.txt,data/csvs/SqT,The Squire's Tale 343,,10,10,Out of hir sighte ye gete namoore of me,Out of hir sighte ye gete namore of me,u S u Sx u Sx uSx u S,u S u Sx u Sx uSx u S,oute@adv#prep of@prep here@pron%pl_gen sighte@n ye@pron%pl_nom geten@v1%pr_pl no_more@n of@prep me@pron2%obj,oute@adv#prep of@prep here@pron%pl_gen sighte@n ye@pron%pl_nom geten@v1%pr_pl no_more@n of@prep me@pron2%obj,
But thus I lete in lust and jolitee,But thus I lete° in lust° and jolitee,data/riverside_cats/SqT_riv.cat,data/oxford_txts/SqT_oxford.txt,data/csvs/SqT,The Squire's Tale 344,,10,10,But thus I lete in lust and jolitee,But thus I lete in lust and jolitee,u S u Sx u S u SuS,u S u Sx u S u SuS,but@conj thus@adv ich@pron%nom leten@v%pr_1 in@prep lust@n and@conj jolite@n,but@conj thus@adv ich@pron%nom leten@v%pr_1 in@prep lust@n and@conj jolite@n,
This Cambyuskan his lordes festeiynge,"This Cambinskan his lordes festeyinge,°",data/riverside_cats/SqT_riv.cat,data/oxford_txts/SqT_oxford.txt,data/csvs/SqT,The Squire's Tale 345,DIFF,9,10,This Cambyuskan his lordes festeiynge,This Cambinskan his lordes festeyinge,S uSu S uS uSx,u SuS u Su SuSx,this@gram_adj cambiuskan@n#propn his@pron1%gen lord@n%pl festen@v%prp_abs,this@gram_adj cambiuskan@n#propn his@pron1%gen lord@n%pl festen@v%prp_abs,green
Til wel ny the day bigan to sprynge.,Til wel ny the day bigan to springe.°,data/riverside_cats/SqT_riv.cat,data/oxford_txts/SqT_oxford.txt,data/csvs/SqT,The Squire's Tale 346,,9,9,Til wel ny the day bigan to sprynge,Til wel ny the day bigan to springe,S u S u S uS u Sx,S u S u S uS u Sx,til@conj wel@adv neigh@adv the@def_art dai@n biginnen@v%pt_3 to@part springen@v%inf,til@conj wel@adv neigh@adv the@def_art dai@n biginnen@v%pt_3 to@part springen@v%inf,
"The norice of digestioun, the sleep","¶The norice° of digestioun, the slepe",data/riverside_cats/SqT_riv.cat,data/oxford_txts/SqT_oxford.txt,data/csvs/SqT,The Squire's Tale 347,,10,10,The norice of digestioun the sleep,The norice of digestioun the slepe,u Sux S uSuS u S,u Sux S uSuS u Sx,the@def_art norice@n of@prep digestioun@n the@def_art slep@n,the@def_art norice@n of@prep digestioun@n the@def_art slep@n,
Gan on hem wynke and bad hem taken keep,"Gan on hem winke,° and bad° hem taken kepe,°",data/riverside_cats/SqT_riv.cat,data/oxford_txts/SqT_oxford.txt,data/csvs/SqT,The Squire's Tale 348,,10,10,Gan on hem wynke and bad hem taken keep,Gan on hem winke and bad hem taken kepe,u S u Sx u S u Su S,u S u Sx u S u Su Sx,ginnen@v%pt_3 on@prep hem@pron%pl_obj winken@v%inf and@conj bidden@v%pt_3 hem@pron%pl_obj taken@v%inf kep@n,ginnen@v%pt_3 on@prep hem@pron%pl_obj winken@v%inf and@conj bidden@v%pt_3 hem@pron%pl_obj taken@v%inf kep@n,
That muchel drynke and labour wolde han reste;,That muchel° drink and labour wolde han reste;,data/riverside_cats/SqT_riv.cat,data/oxford_txts/SqT_oxford.txt,data/csvs/SqT,The Squire's Tale 349,,10,10,That muchel drynke and labour wolde han reste,That muchel drink and labour wolde han reste,u Su Sx u Su Sx u Sx,u Su S u Su Sx u Sx,that@conj muchel@adj drinke@n and@conj labour@n willen@v%pt_3 haven@v%inf reste@n1,that@conj muchel@adj drinke@n and@conj labour@n willen@v%pt_3 haven@v%inf reste@n1,
And with a galpyng mouth hem alle he keste,"And with a galping° mouth hem alle he keste,°",data/riverside_cats/SqT_riv.cat,data/oxford_txts/SqT_oxford.txt,data/csvs/SqT,The Squire's Tale 350,,10,10,And with a galpyng mouth hem alle he keste,And with a galping mouth hem alle he keste,u S u Su S u Sx u Sx,u S u Su S u Sx u Sx,and@conj with@prep a@indef_art galpen@v#adj%prp mouth@n hem@pron%pl_obj al@gram_adj he@pron1%nom kissen@v%pt_3,and@conj with@prep a@indef_art galpen@v#adj%prp mouth@n hem@pron%pl_obj al@gram_adj he@pron1%nom kissen@v%pt_3,
And seyde that it was tyme to lye adoun,"And seid, that it was time to lie adoun",data/riverside_cats/SqT_riv.cat,data/oxford_txts/SqT_oxford.txt,data/csvs/SqT,The Squire's Tale 351,,10,10,And seyde that it was tyme to lye adoun,And seid that it was time to lie adoun,u Sx u S u Sx u S uS,u S u S u Sx u S uS,and@conj seien@v1%pt_3 that@conj hit@pron ben@v%pt_3 time@n to@part lien@v1%inf adoun@adv,and@conj seien@v1%pt_3 that@conj hit@pron ben@v%pt_3 time@n to@part lien@v1%inf adoun@adv,
For blood was in his domynacioun.,For blood was in his dominacioun;°,data/riverside_cats/SqT_riv.cat,data/oxford_txts/SqT_oxford.txt,data/csvs/SqT,The Squire's Tale 352,,10,10,For blood was in his domynacioun,For blood was in his dominacioun,u S u S u SuSuS,u S u S u SuSuS,for@conj blod@n1 ben@v%pt_3 in@prep his@pron1%gen dominacioun@n,for@conj blod@n1 ben@v%pt_3 in@prep his@pron1%gen dominacioun@n,
"Cherisseth blood, natures freend,"""" quod he.","“Cherissheth blood, natures freend,” quod he.",data/riverside_cats/SqT_riv.cat,data/oxford_txts/SqT_oxford.txt,data/csvs/SqT,The Squire's Tale 353,DIFF,10,10,Cherisseth blood natures freend quod he,Cherissheth blood natures freend quod he,uSu S uSu S u S,uSu S uSu S u S,cherishen@v%imp blod@n1 nature@n%gen frend@n quethen@v%pt_3 he@pron1%nom,cherishen@v%imp blod@n1 nature@n%gen frend@n quethen@v%pt_3 he@pron1%nom,green
"They thanken hym galpynge, by two, by thre","They thanken him galping, by two, by three",data/riverside_cats/SqT_riv.cat,data/oxford_txts/SqT_oxford.txt,data/csvs/SqT,The Squire's Tale 354,,10,10,They thanken hym galpynge by two by thre,They thanken him galping by two by three,u Su S uSx u S u S,u Su S uS u S u S,thei@pron%pl_nom thanken@v%pr_pl him@pron%obj galpen@v%prp_abs bi@prep two@num_n bi@prep thre@num_n,thei@pron%pl_nom thanken@v%pr_pl him@pron%obj galpen@v%prp_abs bi@prep two@num_n bi@prep thre@num_n,
And every wight gan drawe hym to his reste,And every wight gan drawe° him to his reste,data/riverside_cats/SqT_riv.cat,data/oxford_txts/SqT_oxford.txt,data/csvs/SqT,The Squire's Tale 355,,10,10,And every wight gan drawe hym to his reste,And every wight gan drawe him to his reste,u SuS u S ux S u S xx,u SuS u S ux S u S xx,and@conj everi@pron_gram_adj wight@n ginnen@v%pt_3 drauen@v%inf him@pron%obj to@prep his@pron1%gen reste@n1,and@conj everi@pron_gram_adj wight@n ginnen@v%pt_3 drauen@v%inf him@pron%obj to@prep his@pron1%gen reste@n1,
As sleep hem bad; they tooke it for the beste.,As slepe hem bad; they toke it for the beste.,data/riverside_cats/SqT_riv.cat,data/oxford_txts/SqT_oxford.txt,data/csvs/SqT,The Squire's Tale 356,,10,10,As sleep hem bad they tooke it for the beste,As slepe hem bad they toke it for the beste,u S u S u Sx u S u Sx,u Sx u S u Sx u S u Sx,as@conj slep@n hem@pron%pl_obj bidden@v%pt_3 thei@pron%pl_nom taken@v%pr_pl hit@pron for@prep the@def_art best@adjas_n%sup,as@conj slep@n hem@pron%pl_obj bidden@v%pt_3 thei@pron%pl_nom taken@v%pr_pl hit@pron for@prep the@def_art best@adjas_n%sup,
Hire dremes shul nat now been toold for me;,Hir dremes shul nat been ytold for° me;,data/riverside_cats/SqT_riv.cat,data/oxford_txts/SqT_oxford.txt,data/csvs/SqT,The Squire's Tale 357,DIFF,10,10,Hire dremes shul nat now been toold for me,Hir dremes shul nat been ytold for me,ux Su S u S u S u S,u Su S u S uS u S,here@pron%pl_gen drem@n2%pl shulen@v1%pr_pl not@adv nou@adv ben@v%inf tellen@v%ppl for@prep me@pron2%obj,here@pron%pl_gen drem@n2%pl shulen@v1%pr_pl not@adv ben@v%inf tellen@v%ppl for@prep me@pron2%obj,green
Ful were hire heddes of fumositee,"Ful were hir hedes of fumositee,°",data/riverside_cats/SqT_riv.cat,data/oxford_txts/SqT_oxford.txt,data/csvs/SqT,The Squire's Tale 358,,10,10,Ful were hire heddes of fumositee,Ful were hir hedes of fumositee,u Sx ux Su S uSuS,u Sx u Su S uSuS,ful@adj ben@v%pt_3 here@pron%pl_gen hed@n1%pl of@prep fumosite@n,ful@adj ben@v%pt_3 here@pron%pl_gen hed@n1%pl of@prep fumosite@n,
That causeth dreem of which ther nys no charge.,"That causeth dreem, of which ther nis no° charge.°",data/riverside_cats/SqT_riv.cat,data/oxford_txts/SqT_oxford.txt,data/csvs/SqT,The Squire's Tale 359,,10,10,That causeth dreem of which ther nys no charge,That causeth dreem of which ther nis no charge,u Su S u S u S u Sx,u Su S u S u S u Sx,that@pron causen@v1%pr_3 drem@n2 of@prep which@pron ther@adv ben@v%pr_3_neg no@gram_adj charge@n,that@pron causen@v1%pr_3 drem@n2 of@prep which@pron ther@adv ben@v%pr_3_neg no@gram_adj charge@n,
They slepen til that it was pryme large,"They slepen til that it was prime large,°",data/riverside_cats/SqT_riv.cat,data/oxford_txts/SqT_oxford.txt,data/csvs/SqT,The Squire's Tale 360,,10,10,They slepen til that it was pryme large,They slepen til that it was prime large,u Su S u S u Su Sx,u Su S u S u Su Sx,thei@pron%pl_nom slepen@v%pr_pl til@conj that@part hit@pron ben@v%pt_3 prime@n large@adv,thei@pron%pl_nom slepen@v%pr_pl til@conj that@part hit@pron ben@v%pt_3 prime@n large@adv,
"The mooste part, but it were Canacee.","The moste part, but it were° Canacee;",data/riverside_cats/SqT_riv.cat,data/oxford_txts/SqT_oxford.txt,data/csvs/SqT,The Squire's Tale 361,,10,10,The mooste part but it were Canacee,The moste part but it were Canacee,u Sx u S u Su SuS,u Sx u S u Su SuS,the@def_art most@adj%sup part@n but@conj hit@pron ben@v%pt_3 canacee@n1#propn,the@def_art most@adj%sup part@n but@conj hit@pron ben@v%pt_3 canacee@n1#propn,
"She was ful mesurable, as wommen be;","She was ful mesurable,° as wommen be.",data/riverside_cats/SqT_riv.cat,data/oxford_txts/SqT_oxford.txt,data/csvs/SqT,The Squire's Tale 362,,10,10,She was ful mesurable as wommen be,She was ful mesurable as wommen be,u S u SuSx u Su S,u S u SuSx u Su S,she@pron%nom ben@v%pt_3 ful@adv mesurable@adj as@conj womman@n%pl ben@v%pr_pl,she@pron%nom ben@v%pt_3 ful@adv mesurable@adj as@conj womman@n%pl ben@v%pr_pl,
For of hir fader hadde she take leve,For of hir fader had she take leve,data/riverside_cats/SqT_riv.cat,data/oxford_txts/SqT_oxford.txt,data/csvs/SqT,The Squire's Tale 363,,10,10,For of hir fader hadde she take leve,For of hir fader had she take leve,u S u Su Sx u Su Sx,u S u Su S u Su Sx,for@conj of@prep hire@pron1%fem_gen fader@n haven@v%pt_3 she@pron%nom taken@v%ppl leve@n2,for@conj of@prep hire@pron1%fem_gen fader@n haven@v%pt_3 she@pron%nom taken@v%ppl leve@n2,
To goon to reste soone after it was eve.,"To gon to reste, sone after it was eve;",data/riverside_cats/SqT_riv.cat,data/oxford_txts/SqT_oxford.txt,data/csvs/SqT,The Squire's Tale 364,,10,10,To goon to reste soone after it was eve,To gon to reste sone after it was eve,u S u Sx ux Su S u Sx,u S u Sx ux Su S u Sx,to@part gon@v%inf to@prep reste@n1 sone@adv after@conj hit@pron ben@v%pt_3 even@n,to@part gon@v%inf to@prep reste@n1 sone@adv after@conj hit@pron ben@v%pt_3 even@n,
Hir liste nat appalled for to be,Hir liste nat° appalled° for to be,data/riverside_cats/SqT_riv.cat,data/oxford_txts/SqT_oxford.txt,data/csvs/SqT,The Squire's Tale 365,,10,10,Hir liste nat appalled for to be,Hir liste nat appalled for to be,u Su S uSu S u S,u Su S uSu S u S,hire@pron2%fem_obj listen@v1%pr_3 not@adv apallen@v%ppl for@prep#adv to@part ben@v%inf,hire@pron2%fem_obj listen@v1%pr_3 not@adv apallen@v%ppl for@prep#adv to@part ben@v%inf,
Ne on the morwe unfeestlich for to se,Nor on the morwe unfestlich° for to see;°,data/riverside_cats/SqT_riv.cat,data/oxford_txts/SqT_oxford.txt,data/csvs/SqT,The Squire's Tale 366,DIFF,10,10,Ne on the morwe unfeestlich for to se,Nor on the morwe unfestlich for to see,u S u Sx uSu S u S,u S u Sx uSu S u S,ne@conj1 on@prep the@def_art morwe@n unfesteli@adj for@prep#adv to@part sen@v1%inf,nor@conj ne@conj1 the@def_art morwe@n unfesteli@adj for@prep#adv to@part sen@v1%inf,green
"And slepte hire firste sleep, and thanne awook.","And slepte hir firste sleep, and thanne awook.",data/riverside_cats/SqT_riv.cat,data/oxford_txts/SqT_oxford.txt,data/csvs/SqT,The Squire's Tale 367,,10,10,And slepte hire firste sleep and thanne awook,And slepte hir firste sleep and thanne awook,u Sx ux Su S u Sx uS,u Sx u Su S u Sx uS,and@conj slepen@v%pt_3 hire@pron1%fem_gen first@num_adj slep@n and@conj thanne@adv awaken@v%pt_3,and@conj slepen@v%pt_3 hire@pron1%fem_gen first@num_adj slep@n and@conj thanne@adv awaken@v%pt_3,
For swich a joye she in hir herte took,For swich a joy she in hir herte took,data/riverside_cats/SqT_riv.cat,data/oxford_txts/SqT_oxford.txt,data/csvs/SqT,The Squire's Tale 368,,10,10,For swich a joye she in hir herte took,For swich a joy she in hir herte took,u S u Su x S u Su S,u S u S u S u Su S,for@conj swich@gram_adj a@indef_art joie@n she@pron%nom in@prep hire@pron1%fem_gen herte@n taken@v%pt_3,for@conj swich@gram_adj a@indef_art joie@n she@pron%nom in@prep hire@pron1%fem_gen herte@n taken@v%pt_3,
Bothe of hir queynte ryng and hire mirour,Both of hir queinte° ring and hir mirour,data/riverside_cats/SqT_riv.cat,data/oxford_txts/SqT_oxford.txt,data/csvs/SqT,The Squire's Tale 369,,10,10,Bothe of hir queynte ryng and hire mirour,Both of hir queinte ring and hir mirour,ux S u Su S u Sx uS,u S u Su S u S uS,bothe@num_conj of@prep hire@pron1%fem_gen queinte@adj ring@n and@conj hire@pron1%fem_gen mirour@n,bothe@num_conj of@prep hire@pron1%fem_gen queinte@adj ring@n and@conj hire@pron1%fem_gen mirour@n,
That twenty tyme she changed hir colour;,That twenty time she changed hir colour;,data/riverside_cats/SqT_riv.cat,data/oxford_txts/SqT_oxford.txt,data/csvs/SqT,The Squire's Tale 370,,10,10,That twenty tyme she changed hir colour,That twenty time she changed hir colour,u Su Sx u Su S uS,u Su Sx u Su S uS,that@conj twenti@num_adj time@n she@pron%nom chaungen@v%pt_3 hire@pron1%fem_gen colour@n,that@conj twenti@num_adj time@n she@pron%nom chaungen@v%pt_3 hire@pron1%fem_gen colour@n,
"And in hire sleep, right for impressioun","And in hir slepe, right for° impressioun°",data/riverside_cats/SqT_riv.cat,data/oxford_txts/SqT_oxford.txt,data/csvs/SqT,The Squire's Tale 371,,10,10,And in hire sleep right for impressioun,And in hir slepe right for impressioun,u S ux S u S uSuS,u S u Sx u S uSuS,and@conj in@prep hire@pron1%fem_gen slep@n righte@adv for@prep impressioun@n,and@conj in@prep hire@pron1%fem_gen slep@n righte@adv for@prep impressioun@n,
"Of hire mirour, she hadde a visioun.","Of hir mirour, she hadde a visioun.",data/riverside_cats/SqT_riv.cat,data/oxford_txts/SqT_oxford.txt,data/csvs/SqT,The Squire's Tale 372,,10,10,Of hire mirour she hadde a visioun,Of hir mirour she hadde a visioun,u Sx uS u Sx u SuS,u S uS u Sx u SuS,of@prep hire@pron1%fem_gen mirour@n she@pron%nom haven@v%pt_3 a@indef_art visioun@n,of@prep hire@pron1%fem_gen mirour@n she@pron%nom haven@v%pt_3 a@indef_art visioun@n,
"Wherfore, er that the sonne gan up glyde","¶Wherfore,° er that° the sonne gan up glide",data/riverside_cats/SqT_riv.cat,data/oxford_txts/SqT_oxford.txt,data/csvs/SqT,The Squire's Tale 373,,10,10,Wherfore er that the sonne gan up glyde,Wherfore er that the sonne gan up glide,uSx u S u Su S u Sx,uSx u S u Su S u Sx,wher-for@adv er@conj1 that@part the@def_art sonne@n ginnen@v%pt_3 up@adv gliden@v%inf,wher-for@adv er@conj1 that@part the@def_art sonne@n ginnen@v%pt_3 up@adv gliden@v%inf,
She cleped on hir maistresse hire bisyde,She cleped° on hir maistresse° hir biside,data/riverside_cats/SqT_riv.cat,data/oxford_txts/SqT_oxford.txt,data/csvs/SqT,The Squire's Tale 374,,10,10,She cleped on hir maistresse hire bisyde,She cleped on hir maistresse hir biside,x uS u S uSu Sx uSx,x uS u S uSu S uSx,she@pron%nom clepen@v%pt_3 on@prep hire@pron1%fem_gen maistresse@n hire@pron2%fem_obj bisides@prep,she@pron%nom clepen@v%pt_3 on@prep hire@pron1%fem_gen maistresse@n hire@pron2%fem_obj bisides@prep,
And seyde that hire liste for to ryse.,"And seide, that hir liste for to rise.",data/riverside_cats/SqT_riv.cat,data/oxford_txts/SqT_oxford.txt,data/csvs/SqT,The Squire's Tale 375,,10,10,And seyde that hire liste for to ryse,And seide that hir liste for to rise,u Sx u Su Su S u Sx,u Su S u Su S u Sx,and@conj seien@v1%pt_3 that@conj hire@pron2%fem_obj listen@v1%pt_3 for@prep#adv to@part risen@v%inf,and@conj seien@v1%pt_3 that@conj hire@pron2%fem_obj listen@v1%pt_3 for@prep#adv to@part risen@v%inf,
Thise olde wommen that been gladly wyse,"Thise olde wommen that been gladly wise,°",data/riverside_cats/SqT_riv.cat,data/oxford_txts/SqT_oxford.txt,data/csvs/SqT,The Squire's Tale 376,,10,10,Thise olde wommen that been gladly wyse,Thise olde wommen that been gladly wise,ux Su Su S u Su Sx,ux Su Su S u Su Sx,these@gram_adj%pl olde@adj womman@n%pl that@pron ben@v%pr_pl gladli@adv wise@adj,these@gram_adj%pl olde@adj womman@n%pl that@pron ben@v%pr_pl gladli@adv wise@adj,
"As is hire maistresse, answerde hire anon","As is hir maistresse, answerde hir anoon,°",data/riverside_cats/SqT_riv.cat,data/oxford_txts/SqT_oxford.txt,data/csvs/SqT,The Squire's Tale 377,,10,10,As is hire maistresse answerde hire anon,As is hir maistresse answerde hir anoon,u S ux Sux Sux Sx uS,u S u Sux Sux S uS,as@conj ben@v%pr_3 hire@pron1%fem_gen maistresse@n answeren@v%pt_pl hire@pron2%fem_obj an-on@adv,as@conj ben@v%pr_3 hire@pron1%fem_gen maistresse@n answeren@v%pt_pl hire@pron2%fem_obj an-on@adv,
"And seyde, """"Madame, whider wil ye goon","And seide, “Madame, whider° wil ye goon",data/riverside_cats/SqT_riv.cat,data/oxford_txts/SqT_oxford.txt,data/csvs/SqT,The Squire's Tale 378,,10,10,And seyde Madame whider wil ye goon,And seide Madame whider wil ye goon,u Sx uSu Su S u S,u Sx uSu Su S u S,and@conj seien@v1%pt_pl ma-dame@n whider@adv willen@v%pr_pl ye@pron%pl_nom gon@v%inf,and@conj seien@v1%pt_pl ma-dame@n whider@adv willen@v%pr_pl ye@pron%pl_nom gon@v%inf,
"Thus erly, for the folk been alle on reste?",Thus erly? For the folk° ben alle on reste.”,data/riverside_cats/SqT_riv.cat,data/oxford_txts/SqT_oxford.txt,data/csvs/SqT,The Squire's Tale 379,,10,10,Thus erly for the folk been alle on reste,Thus erly For the folk ben alle on reste,u Su S u S u Sx u Sx,u Su S u S u Sx u Sx,thus@adv erli@adv for@conj the@def_art folk@n ben@v%pr_pl al@gram_adj on@prep reste@n1,thus@adv erli@adv for@conj the@def_art folk@n ben@v%pr_pl al@gram_adj on@prep reste@n1,
